id,created_at,text1063819418252251136,2018-11-17 15:41:28,FIL : Fin du jour 1 a la Reunion des dirigeants economiques de l@APEC de Port Moresby. LAsie-Pacifique connait un... https://t.co/q4jKnwPPDZ
1063543992804171776,2018-11-16 21:27:02,"RT @Carolyn_Bennett: On Louis Riel Day we celebrate the Metis Nation - their resilience, and the preservation of their vibrant culture from..."
1063543974571446279,2018-11-16 21:26:57,"RT @Carolyn_Bennett: Pour la journee Louis Riel, nous celebrons la nation metisse - leur resilience et la preservation de leur culture viva..."
1063513926544035840,2018-11-16 19:27:33,"Today is a good day to reflect on how absolutely critical it is for governments in this country to protect, preserv... https://t.co/h8Hd2KOoM7"
1063513925763895301,2018-11-16 19:27:33,"On Louis Riel Day, we commemorate the life of this dedicated Metis leader and founder of the province of Manitoba: https://t.co/Y6fqwCvWCx"
1063513531700658176,2018-11-16 19:25:59,RT @melaniejoly: We welcome the decision of the Supreme Court in the Mazraani case. No compromise can be made : Canadians have the right to...
1063513509445668865,2018-11-16 19:25:54,RT @melaniejoly: Nous nous rejouissons de la decision de la Cour supreme dans le dossier Mazraani. Aucun compromis ne peut etre fait sur le...
1063513385663377410,2018-11-16 19:25:24,"Cest une excellente journee pour penser au role essentiel des gouvernements pour proteger, preserver et cherir les... https://t.co/2e9nXqK7Iq"
1063513384761610240,2018-11-16 19:25:24,"En ce Jour de Louis Riel, nous commemorons la vie de ce leader metis devoue et fondateur de la province du Manitoba... https://t.co/QRRIu43OnS"
1063470319468371968,2018-11-16 16:34:17,Weve arrived in Papua New Guinea for the @APEC summit. Busy couple of days ahead meeting with leaders and promotin... https://t.co/84tY010v9f
1063470199582552065,2018-11-16 16:33:48,Nous sommes arrives en Papouasie-Nouvelle-Guinee pour assister au Sommet de l@APEC. Au menu de ces deux journees b... https://t.co/5z2GQsRZFd
1063181829031821313,2018-11-15 21:27:55,"On trade, sustainable development, climate change and so many key issues, Canada and @ASEAN are strong partners - w... https://t.co/21CFgrdklz"
1063181823226904576,2018-11-15 21:27:54,Tech and innovation are driving change in every sector  especially transportation  and were working hard as a go... https://t.co/uMrqM75CNd
1063181164981166080,2018-11-15 21:25:17,"Quil sagisse du commerce, du climat ou dautres grands enjeux, le Canada et l#ANASE sont des partenaires solides... https://t.co/f4oMoWVPXx"
1063180605800747009,2018-11-15 21:23:04,"La technologie et linnovation stimulent le changement dans tous les secteurs, surtout celui du transport, et nous... https://t.co/SWnWwNPzwf"
1063164216184582144,2018-11-15 20:17:56,"My thanks to President Halimah Yacob for her warm welcome today  and for our discussion on multiculturalism, diver... https://t.co/YCPU0WJiIZ"
1063164039214317568,2018-11-15 20:17:14,Je remercie la presidente Halimah Yacob pour son accueil chaleureux aujourdhui et pour notre discussion sur le mul... https://t.co/AQP0Lggaug
1063151726373548032,2018-11-15 19:28:18,"We're thinking of everyone dealing with this storm today  stay safe out there and please follow local instructions.
https://t.co/qfw3kQm5LI"
1063151471959699456,2018-11-15 19:27:17,"Nos pensees accompagnent toutes les personnes touchees par la tempete daujourdhui. Sil vous plait, soyez prudent... https://t.co/RQTnZk2DaY"
1063131694046371842,2018-11-15 18:08:42,"RT @liberal_party: The Conservative assertion that its plan would make Canadian communities safer is a lot of baloney.  
https://t.co/x..."
1063074314264764416,2018-11-15 14:20:42,"RT @minliangtan: Been an absolute blast chatting with @JustinTrudeau - excited to know theres a lot more to do for the youth, in growing e..."
1063074243771072520,2018-11-15 14:20:25,"@minliangtan So I hope you came away from our chat with some good ones... skys the limit, really!"
1063073837074530304,2018-11-15 14:18:48,With Lim Chow Kiat of Singapores Government Investment Corporation - talking about why it makes sense to invest in... https://t.co/K2GbGOqk88
1063073831328366592,2018-11-15 14:18:47,We know putting a price on pollution is the best way to fight climate change while keeping our economies strong and... https://t.co/zJ7BudzR9n
1063073825674461188,2018-11-15 14:18:45,"We kicked off a busy Day 3 Singapore with great news from @Agrocorp, which is choosing Saskatchewan for its multimi... https://t.co/2K1fgI9Aye"
1063072813739847685,2018-11-15 14:14:44,Discussion avec Lim Chow Kiat de la Singapores Government Investment Corporation sur les avantages des investissem... https://t.co/SuYBb38VVh
1063072808073338881,2018-11-15 14:14:43,Nous le savons : le meilleur moyen daffronter les changements climatiques tout en assurant la vigueur de nos econo... https://t.co/xQXtnSikFs
1063072801861632000,2018-11-15 14:14:41,Nous avons lance une 3e journee chargee a Singapour avec une excellente nouvelle d@Agrocorp: sa nouvelle installat... https://t.co/MT0M3YlT9s
1062845942062297088,2018-11-14 23:13:13,"Moving forward, growing our relationship. Thank you Prime Minister @LeeHsienLoong of for your invitation and hospit... https://t.co/dL6wXmW8Hn"
1062845733945126912,2018-11-14 23:12:24,"Nous allons de lavant et faisons croitre notre relation. Merci, Monsieur le premier ministre @LeeHsienLoong, pour... https://t.co/uHeGSHHunf"
1062840050558386177,2018-11-14 22:49:49,Canadian tech is on the cutting edge of innovation and creativity  and our FinTech companies help keep our banking... https://t.co/mqMICOKI8r
1062839828105097216,2018-11-14 22:48:56,La technologie canadienne est a lavant-garde de linnovation et de la creativite. Nos entreprises FinTech aident a... https://t.co/GnvIrStA35
1062826146016960512,2018-11-14 21:54:34,RT @marcomendicino: Spoke with Rabbi Wagner of Yeshivas Lubavitch to offer steadfast support for the young Jewish students who were victimi...
1062821277323460610,2018-11-14 21:35:13,"We must be on constant guard against this troubling resurgence of antisemitism, here at home or anywhere else. We t... https://t.co/LRd9Huthi1"
1062821146272374790,2018-11-14 21:34:42,"Nous devons demeurer vigilants face a cette resurgence preoccupante de lantisemitisme, ici comme ailleurs. Nous re... https://t.co/RB7MVH2eba"
1062796090506907657,2018-11-14 19:55:08,RT @Bill_Morneau: Did you know that Canada is now the only G7 country to have trade deals with every other G7 country? By working to create...
1062796081220722689,2018-11-14 19:55:06,RT @Bill_Morneau: Le Canada est maintenant le seul pays du G7 a avoir conclu des accords commerciaux avec tous les autres pays du G7. En tr...
1062783706593705984,2018-11-14 19:05:55,Very good to speak with Premier Li again as part of our annual China-Canada dialogue. We had a productive &amp; frank d... https://t.co/jWm2ajBLkT
1062783491430068227,2018-11-14 19:05:04,"Discussion productive avec le PM Li lors du dialogue annuel Chine-Canada : droits de la personne, changements clima... https://t.co/fwNQ8wpKca"
1062761153435189248,2018-11-14 17:36:18,"Thanks to Trade Minister @JimCarr_WPG for his hard work promoting Canada here this week, especially on our commitme... https://t.co/K3vnijLoif"
1062761146975961088,2018-11-14 17:36:17,"Day 2 in Singapore  right down to business meeting with @Temasek, focused on Canadas leadership in AI, taking adv... https://t.co/Ml3YNFEihV"
1062760648587780097,2018-11-14 17:34:18,"Merci a @JimCarr_WPG, qui a fait la promotion des engagements du Canada ici cette semaine, en particulier : infrast... https://t.co/NsiESrhG1r"
1062760642623520769,2018-11-14 17:34:16,"Jour 2 a Singapour : reunion daffaires avec @Temasek axee sur le leadership du Canada en matiere dIA, les moyens... https://t.co/H3KAf90DAE"
1062490198829875200,2018-11-13 23:39:38,"Paris, 3 years ago. We honour the victims memories, and pledge to fight terrorism and intolerance always.... https://t.co/GxJF2Nba7K"
1062490125266010117,2018-11-13 23:39:20,"Paris, il y a trois ans. Nous rendons hommage a la memoire des victimes et promettons de toujours lutter contre le... https://t.co/f1bmocCrsP"
1062484554802520066,2018-11-13 23:17:12,"RT @mary_ng: CETA is a catalyst for increased Canada-EU ties, job creation, business growth and investment. Thanks to CETA, 98% of Canadian..."
1062484535961677824,2018-11-13 23:17:08,"RT @mary_ng: L#AECG est un catalyseur qui favorise le resserrement des liens entre le Canada et lUE, la creation demplois, la croissance..."
1062459374155767809,2018-11-13 21:37:08,"RT @jimcarr_wpg: The benefits of #FreeTrade with the European Union have been felt across Canada. As neighbours across the Atlantic, our ma..."
1062459354543284225,2018-11-13 21:37:04,"RT @jimcarr_wpg: Les avantages du #libreechange avec l'Union europeenne resonnent partout au Canada. Nos provinces maritimes, voisins de l..."
1062404961605218304,2018-11-13 18:00:56,"Thank you, President Anastasiades, for your warm welcome and for your partnership. I look forward to our two countr... https://t.co/IWsmUQNACZ"
1062404781531152384,2018-11-13 18:00:13,"Merci, Monsieur le president Anastasiades, pour votre accueil chaleureux et votre partenariat. Je suis impatient de... https://t.co/i3iAvAPcwR"
1062388868954099714,2018-11-13 16:56:59,Smart cities are coming  and we need to find the best way to harness their potential while making them work for pe... https://t.co/f5HCFiDmgy
1062388863467950080,2018-11-13 16:56:57,"Very positive meeting with @Temasek President Song Hwee Chia today, talking about Canadas AI leadership and ways w... https://t.co/42HXop8Mek"
1062388243822456833,2018-11-13 16:54:30,"Les villes intelligentes sont pour bientot, et nous devons trouver le meilleur moyen dexploiter leur potentiel et... https://t.co/MBLvfEDdOb"
1062388238227259392,2018-11-13 16:54:28,"Rencontre tres positive avec le president de @Temasek, Song Hwee Chia, pour parler du leadership du Canada en matie... https://t.co/sIHPLWbXzh"
1062387113616961537,2018-11-13 16:50:00,Hello from Singapore! Were wrapping up a busy first day ahead of the @ASEAN Summit. I started the day meeting with... https://t.co/4BVsdVxY1I
1062386619691474944,2018-11-13 16:48:02,"RT @DiedrahKelly: Great meeting between @JustinTrudeau, @jimcarr_wpg and representatives of @CAN_ASEAN and CanCham Singapore on opportuniti..."
1062386600917778432,2018-11-13 16:47:58,Bonjour de Singapour! Nous terminons une journee chargee avant le Sommet de lANASE. Jai dabord rencontre des che... https://t.co/sNlbr1uKzI
1062086687877025792,2018-11-12 20:56:13,"Amazing - now convince them that shoveling is fun and you're all set. Thank you for everything you do, Rebecca.... https://t.co/aYeQVGT1H6"
1062086517391151105,2018-11-12 20:55:33,"Extraordinaire. Il reste maintenant a les convaincre que cest agreable de pelleter, et tout va etre beau. Merci po... https://t.co/6yyvWFROp4"
1062064706456698881,2018-11-12 19:28:52,RT @melaniejoly: Canada is big. Canada is beautiful. We want the people working in the tourism industry to be confident in their future and...
1062064140783480832,2018-11-12 19:26:38,RT @melaniejoly: Notre pays est grand et magnifique. Nous voulons que les personnes qui travaillent dans l'industrie du #tourisme aient con...
1062058683268444160,2018-11-12 19:04:56,And thanks so much to @DanielKorski for the discussion on how governments can do a better job getting digital servi... https://t.co/YHFtLSwSxt
1062058483351080960,2018-11-12 19:04:09,Et un grand merci a @DanielKorski pour la discussion sur les moyens que les gouvernements peuvent prendre pour offr... https://t.co/wpdOjQtejY
1062016290527703041,2018-11-12 16:16:29,"Thank you for having us today, Mayor! Governments in Canada &amp; France can learn a lot from each other when it comes... https://t.co/BFLIUD69On"
1062016172525146113,2018-11-12 16:16:01,"Merci de nous avoir recus aujourdhui, Madame la Maire! Les gouvernements au Canada et en France peuvent apprendre... https://t.co/6RY30o2STz"
1062001646534836224,2018-11-12 15:18:18,RT @BradSmi: Its always nice to run into a familiar face when youre far from home. Thank you @JustinTrudeau for your strong leadership on...
1061803771032813569,2018-11-12 02:12:01,".@NadiaMuradBasee - your courage is immeasurable, and it was a true honour to meet you. Your work on behalf of Yazi... https://t.co/gaDz1NFkOr"
1061803448973189120,2018-11-12 02:10:44,".@NadiaMuradBasee, votre courage est inestimable et ce fut un veritable honneur de vous rencontrer. Votre travail a... https://t.co/bNxCzAXCad"
1061783438254997504,2018-11-12 00:51:13,"Solid institutions, independent voices and a free press are the backbones of our democracy - and were stronger for... https://t.co/Ti68OTlKwU"
1061783322869739520,2018-11-12 00:50:45,"Au cur de notre democratie se trouvent des institutions fortes, des voix independantes et une presse libre  et el... https://t.co/9Y0SDpFClU"
1061763644101292032,2018-11-11 23:32:34,Today we join Polish communities in Canada &amp; around the world in celebrating a century since Poland regained its so... https://t.co/Prvp2vPzzM
1061763517303283712,2018-11-11 23:32:03,"Aujourdhui, nous nous joignons aux communautes polonaises au Canada et ailleurs dans le monde pour celebrer le cen... https://t.co/TYISXDQtyC"
1061748378260762624,2018-11-11 22:31:54,"In times of conflict and in times of peace, Canada &amp; France are partners, allies &amp; the closest of friends. Thank yo... https://t.co/1FN9LaElB3"
1061748192369291265,2018-11-11 22:31:10,"En temps de conflit comme de paix, le Canada et la France sont des allies, les amis les plus proches. Merci... https://t.co/HUZFrO35PC"
1061689809712820224,2018-11-11 18:39:10,"This morning in Paris, 100 years after the WWI Armistice, leaders from around the world came together to remember t... https://t.co/4M5tRLyuuW"
1061689465133879296,2018-11-11 18:37:48,"Ce matin a Paris, 100 ans apres la declaration de l'Armistice suivant la 1ere Guerre mondiale, des dirigeants du mo... https://t.co/7qhgq08TVJ"
1061664754211508224,2018-11-11 16:59:36,"RT @CanadianForces: On this day, Canadians pause in a silent moment of remembrance for those who have served, and continue to serve our cou..."
1061664692437901312,2018-11-11 16:59:22,"RT @ForcesCanada: Le 11 novembre de chaque annee, les Canadiens de partout au pays se recueillent en silence pendant quelques instants pour..."
1061624471537270785,2018-11-11 14:19:32,"Today, we remember every Canadian who has sacrificed their future for generations beyond their own - we are free be... https://t.co/TnhMVOwwx2"
1061623996649742336,2018-11-11 14:17:39,"Aujourdhui, nous nous rappelons de tous les Canadiens qui ont sacrifie leur avenir pour les generations qui allaie... https://t.co/yiKQOKlsF0"
1061564472685481989,2018-11-11 10:21:07,"Watch live: Marking Remembrance Day, exactly 100 years since the end of the First World War.
 
En direct  Nous s... https://t.co/R2n4F7GZDX"
1061412393497120768,2018-11-11 00:16:49,"RT @CanadianPM: 117,000 poppies, one for each of Canadas fallen since the beginning of the First World War, are projected on Centre Block..."
1061412367479857157,2018-11-11 00:16:43,"RT @PMcanadien: Une pluie de 117 000 coquelicots, un pour chaque Canadien mort au combat depuis le debut de la Premiere Guerre mondiale, es..."
1061288360570957824,2018-11-10 16:03:57,"11,000 Canadian names on these walls. https://t.co/6vcoF0gdEE"
1061288222498717696,2018-11-10 16:03:24,"Sur ces murs, les noms de 11 000 Canadiens. https://t.co/J6R2b38Zun"
1061274762817744901,2018-11-10 15:09:55,"Today, I joined our delegation of Canadian veterans at Vimy Ridge  to thank them for their service and to pay trib... https://t.co/nCd4CBb69a"
1061274307547090944,2018-11-10 15:08:07,"Aujourd'hui, je suis accompagne de notre delegation d'anciens combattants canadiens a la crete de Vimy pour les rem... https://t.co/DPplgHJ4VQ"
1061242964784177153,2018-11-10 13:03:34,RT @RoyalCdnLegion: Help us make a real difference in the lives of Veterans and their families by donating to the Poppy Fund online and rec...
1061242940729839616,2018-11-10 13:03:28,RT @RoyalCdnLegion: Aidez-nous a faire une vraie difference dans la vie des veterans et de leur famille en faisant un don en ligne au Fonds...
1061036241271967744,2018-11-09 23:22:07,"Were on the way to Vimy, France  for the first day of ceremonies marking 100 years since the Armistice that ended... https://t.co/k2ySlfU64z"
1061036099592630272,2018-11-09 23:21:33,"Nous sommes en route vers Vimy, en France, pour le premier jour des ceremonies soulignant le 100e anniversaire de l... https://t.co/MBAszsgawU"
1061028836383453184,2018-11-09 22:52:42,Great visit with PoliSci students from @RMC_Canada_CMR in Parliament yesterday. The future is in some very bright h... https://t.co/o8wI5CKKt0
1061028721593802752,2018-11-09 22:52:14,Excellente visite detudiants en sciences politiques du @RMC_Canada_CMR au Parlement hier. Lavenir est entre tres... https://t.co/kbO8rm7gZI
1061003902722719746,2018-11-09 21:13:37,RT @CQualtro: The newly restored #WestBlock and Visitor Welcome Centre will continue to serve as the seat of our democracy and proudly welc...
1061003667552305157,2018-11-09 21:12:41,RT @CQualtro: Ledifice de lOuest et le Centre daccueil des visiteurs nouvellement restaures continueront detre le siege de notre democr...
1061003215146229761,2018-11-09 21:10:53,"RT @HarjitSajjan: Private Buckam Singh was born in Punjab, India and came to Canada in 1907 at the age of 14. This Remembrance Day, we hono..."
1061003164441329667,2018-11-09 21:10:41,"RT @HarjitSajjan: Le soldat Buckam Singh est ne au Pendjab et est arrive au Canada en 1907 a l'age de 14 ans. En ce jour du Souvenir, rendo..."
1060922521569112065,2018-11-09 15:50:14,"The fight against climate change has never been more urgent, and its going to take a coordinated effort to leave a... https://t.co/w7kxeytSZs"
1060922239145644033,2018-11-09 15:49:07,La lutte contre les changements climatiques na jamais ete aussi urgente. Il faudra un effort concerte pour laisser... https://t.co/tP5bJNWvRR
1060714875498856448,2018-11-09 02:05:08,"RT @MarcMillerVM: Today, on Indigenous Veterans Day, I spoke to the House in Kanienkeha (Mohawk), used as code in WWII and language of the..."
1060714845027192832,2018-11-09 02:05:00,"RT @MarcMillerVM: A l'occasion de la Journee des anciens combattants autochtones, jai pris la parole en Chambre en Mohawk, utilisee durant..."
1060688970827350016,2018-11-09 00:22:11,"Papineau comes to Ottawa! Riding folks paid a visit today  10 years later, I am still so grateful to work with suc... https://t.co/hClHLZllos"
1060688753935683585,2018-11-09 00:21:20,"De Papineau a Ottawa! L'equipe de la circonscription m'a visite aujourd'hui. Dix ans plus tard, je suis toujours tr... https://t.co/LkeqRf9qBf"
1060669608229855232,2018-11-08 23:05:15,"It was a pleasure to welcome The Right Rev. Dr. Richard Bott, Moderator of the @UnitedChurchCda, to the Hill today.... https://t.co/JSErItvqsp"
1060669500641685504,2018-11-08 23:04:49,"Ravi daccueillir le tres rev. Richard Bott, moderateur de la @UnitedChurchCda, sur la Colline aujourdhui. Je suis... https://t.co/FuO1oWB32U"
1060601866025910272,2018-11-08 18:36:04,RT @RalphGoodale: Gun &amp; gang violence is a threat to the safety &amp; prosperity of our communities. Today Minister @BillBlair + I announced an...
1060601841388544006,2018-11-08 18:35:58,"RT @RalphGoodale: La violence armee et les gangs menacent la securite et la prosperite de nos collectivites. Aujourdhui, @BillBlair et moi..."
1060584170081148930,2018-11-08 17:25:45,"Today we grieve for the victims of the terrible shooting in Thousand Oaks, CA, in a bar full of college students ou... https://t.co/a43BRZnwzo"
1060583963570384897,2018-11-08 17:24:56,"Aujourdhui, nous pleurons les victimes de la terrible fusillade de Thousand Oaks, en Californie, survenue dans un... https://t.co/shdSiMrX2X"
1060583035760979972,2018-11-08 17:21:15,A toutes les personnes autochtones qui ont servi au sein des @ForcesCanada  nous profitons de cette journee pour v... https://t.co/NYJ6IB2RCb
1060550529615568897,2018-11-08 15:12:04,"To every Indigenous person whos served in the @CanadianForces  today is a day to say thank you, and to remember.... https://t.co/9XLV50fJcx"
1060304780785004547,2018-11-07 22:55:33,"What we can hardly imagine, the passengers of the MS. St. Louis, the victims of the Holocaust, and their descendant... https://t.co/Iu2S0nVxI9"
1060304558289833985,2018-11-07 22:54:40,"On se doute a peine de tout ce que les passagers du MS St. Louis, les victimes de lHolocauste et leurs descendants... https://t.co/PZnvHsnBb2"
1060265664382951426,2018-11-07 20:20:07,"In 1939, Canada turned its back on 907 Jewish refugees, deeming them unworthy of a home, and undeserving of our hel... https://t.co/rsH9Kjl3b2"
1060265447042547714,2018-11-07 20:19:16,"En 1939, le Canada a refuse 907 refugies juifs percus comme indignes davoir un foyer ou notre aide. Je presente en... https://t.co/xk368EbG5s"
1060258355913150466,2018-11-07 19:51:05,RT @DarrenFisherNS: Today PM @JustinTrudeau will deliver an apology in the House of Commons to the passengers' families of the MS St. Louis...
1060257755779469312,2018-11-07 19:48:42,Ana Maria Gordon is the only surviving passenger of the MS St. Louis living in Canada. I met with her today ahead o... https://t.co/k1jM5y8cvH
1060257548534714371,2018-11-07 19:47:52,Ana Maria Gordon est la seule survivante du MS St. Louis qui vit au Canada. Je lai rencontree aujourdhui avant la... https://t.co/HHMJdrrm39
1060233923702202369,2018-11-07 18:14:00,"Congratulations to the winners in last nights US elections, including the historic number of women who will sit in... https://t.co/BbwmYivacF"
1060233448101761024,2018-11-07 18:12:06,"Felicitations aux candidats et a ceux qui ont remporte lelection dhier aux E-U, dont le nombre sans precedent de... https://t.co/8E1tSztVvG"
1060232674655256578,2018-11-07 18:09:02,"RT @CoastGuardCAN: #CCGProud to celebrate the two year anniversary of the #OceansProtectionPlan. Through collaboration, we continue to buil..."
1060232659677470720,2018-11-07 18:08:58,"RT @GardeCotiereCAN: #GCCFiers de celebrer les 2 ans du #PlanDeProtectionDesOceans. Grace a la collaboration, nous batissons un systeme de..."
1060216864301858816,2018-11-07 17:06:12,Congratulations to the 2018 @Macleans Parliamentarians of the Year for their outstanding work and dedication. Were... https://t.co/h0iVqsva5Y
1060216732873310208,2018-11-07 17:05:41,RT @macleans: Judy Sgro has won Best Mentor both times it's been awardeda consequence of a political career full of wisdom for newcomers....
1060216698534539264,2018-11-07 17:05:33,"RT @macleans: Terry Beech, the 2018 winner for Best Civic Outreach says he's visited every house in his riding three timesand adds to the..."
1060216664334188545,2018-11-07 17:05:25,"RT @macleans: Voted this year's hardest-working MP, Chrystia Freeland spent most of the past year effectively doing two ministerial jobs at..."
1060216487544262668,2018-11-07 17:04:43,Felicitations aux laureats du prix Parliamentarian of the Year 2018 de @Macleans pour leur travail et leur devoueme... https://t.co/mtRIUkSdjN
1060215312786821121,2018-11-07 17:00:03,RT @JonathanWNV: To mark the 2nd anniversary of the #OceansProtection plan - the @CoastGuardCAN will be simulating some of their increased...
1060215296693280768,2018-11-07 16:59:59,"RT @JonathanWNV: Pour marquer le 2e anniversaire du plan de #ProtectiondesOceans, la @GardeCotiereCAN fera une simulation demontrant sa plu..."
1060212780056371200,2018-11-07 16:49:59,"RT @jyduclos: Today, we gather to celebrate #Diwali, the festival of lights. It is the triumph of good over evil and knowledge over ignoran..."
1060212767930699776,2018-11-07 16:49:56,"RT @jyduclos: Aujourdhui, nous nous reunissons pour celebrer #Diwali, la fete des lumieres. Cest le triomphe du bien sur le mal et de la..."
1060185436784640001,2018-11-07 15:01:20,Happy #Diwali to everyone celebrating! https://t.co/LJZGWkgXku
1060185271663316992,2018-11-07 15:00:40,Heureuse fete de #Diwali a tous ceux et celles qui la celebrent! https://t.co/P5lwdp3GuB
1059970494131130368,2018-11-07 00:47:13,RT @Bill_Morneau: Keep an eye out in your pocket change for the new $2 coin commemorating the 100th anniversary of the Armistice  an oppor...
1059970483758817289,2018-11-07 00:47:11,RT @Bill_Morneau: Restez a laffut pour decouvrir la nouvelle piece de 2 $ commemorant le 100e anniversaire de l'armistice - une occasion d...
1059943660970786816,2018-11-06 23:00:36,Please read my full statement on the death of Bernard Landry: https://t.co/j331mlT710
1059943479575543808,2018-11-06 22:59:52,Lisez ma declaration concernant le deces de Bernard Landry : https://t.co/ZUXkxF5UpX
1059925977474596864,2018-11-06 21:50:20,"My condolences to the family of former Premier Bernard Landry, who died today. He dedicated his life to serving Que... https://t.co/is6J41oltj"
1059925621000724480,2018-11-06 21:48:55,"Mes condoleances a la famille de lancien PM Bernard Landry, qui est decede aujourdhui. Il a consacre sa vie a ser... https://t.co/2cwCBBxNLZ"
1059917377243095041,2018-11-06 21:16:09,"From there well go to Singapore to meet with world &amp; business leaders at the ASEAN summit, and at the APEC Leaders... https://t.co/wpvRhacF4r"
1059917209961725953,2018-11-06 21:15:29,"Ensuite, jirai rencontrer des dirigeants au Sommet de lANASE a Singapour et assister a la Reunion des dirigeants... https://t.co/4Ug5Jj5xne"
