id,created_at,text1044739984102707200,2018-09-26 00:06:37,RT @theresa_may: Millions of girls around the world are missing out on a good education. Were working with partner countries to ensure all...
1044739910412963840,2018-09-26 00:06:19,RT @EmmanuelMacron: Quon me presente la jeune femme qui a fait le choix libre de se marier a 12 ans au lieu de suivre une education libre....
1044731509297471488,2018-09-25 23:32:56,"Canada, France, and the UK share common values. And today @theresa_may, @EmmanuelMacron, and I talked about tacklin... https://t.co/iNkvW3teXr"
1044731396923838465,2018-09-25 23:32:29,"Le Canada, la France et le R-U ont des valeurs communes. Aujourdhui, @theresa_may, @EmmanuelMacron et moi avons ab... https://t.co/kW6naZkmCi"
1044720272627167232,2018-09-25 22:48:17,"Thanks to President @IvanDuque for a great first meeting at #UNGA this afternoon, focused on growing our economies,... https://t.co/G15WoctInG"
1044720215215546368,2018-09-25 22:48:03,Merci au president @IvanDuque pour une excellente premiere rencontre a l#AGNU cet apres-midi sur la facon de faire... https://t.co/CBydXd9YqD
1044681637571817473,2018-09-25 20:14:46,RT @CanadianPM: Watch live in New York City: Prime Minister Justin Trudeau joins world leaders at an event focused on advancing girls educ...
1044681619808768000,2018-09-25 20:14:42,RT @PMcanadien: En direct de New York: le premier ministre Justin Trudeau se joint a des leaders mondiaux pour un evenement sur lavancemen...
1044654070957580289,2018-09-25 18:25:13,"Today, I had another excellent discussion with @Shells CEO, Ben van Beurden, on how we can work together to advanc... https://t.co/BpvNiD3rGO"
1044653912391856128,2018-09-25 18:24:36,"Aujourdhui, jai eu une autre excellente discussion avec Ben van Beurden, PDG de @Shell, sur les moyens de collabo... https://t.co/37p3HYhfLl"
1044634659479605248,2018-09-25 17:08:05,"Morning roundtable with business leaders in NYC, talking about trade, economic growth, and the benefits of investin... https://t.co/5Vt3is2PBQ"
1044634610158776321,2018-09-25 17:07:54,"Table ronde ce matin avec des dirigeants d'entreprise a New York sur le commerce, la croissance economique et les a... https://t.co/xpJ2Qf3NcN"
1044621188566339585,2018-09-25 16:14:34,"@ShawnMendes @GlblCtzn Thanks Shawn. The more people we have fighting for girls education, the better! Let's talk."
1044611283989999617,2018-09-25 15:35:12,Wishing all Francophones in Ontario a happy Franco-Ontarian Day! Celebrons! #OnFr https://t.co/kwPNaSFCnV
1044611216390451200,2018-09-25 15:34:56,Bonne Journee des Franco-Ontariens et des Franco-Ontariennes a tous les francophones de l'Ontario! Celebrons! #OnFr https://t.co/sKy8aCTTDl
1044594388985352194,2018-09-25 14:28:04,"RT @cafreeland: Great conversation with @RichardHaass this morning at @CFR_org! @JustinTrudeau, @jimcarr_wpg and I discussed the #CanadaUS..."
1044594374078857216,2018-09-25 14:28:01,"RT @cafreeland: Excellentes conversations avec @RichardHaass ce matin a @CFR_org! @JustinTrudeau, @jimcarr_wpg et moi avons discute de la r..."
1044560373163151361,2018-09-25 12:12:54,"RT @CanadianPM: Watch live: Prime Minister Justin Trudeau, accompanied by Ministers Chrystia Freeland and Jim Carr, speaks at the Council o..."
1044560356109103105,2018-09-25 12:12:50,"RT @PMcanadien: En direct: le premier ministre Justin Trudeau, accompagne par les ministres Chrystia Freeland et Jim Carr, prend la parole..."
1044551911393771520,2018-09-25 11:39:17,RT @ottawacity: Community supports centres are being setup to offer information and services to anyone affected by the tornado and windstor...
1044551574519869440,2018-09-25 11:37:56,"RT @ville_gatineau: [Mise a jour 7h] L'aide aux sinistres se poursuit :
 Baisse du nombre de personnes ayant recours a l'aide au logement..."
1044406695063998465,2018-09-25 02:02:14,@CharlesMichel Amen Charles! Un accord qui porte deja ses fruits des deux cotes de lAtlantique. Cetait un plaisir... https://t.co/DX5vP4le7C
1044404442135769089,2018-09-25 01:53:17,"RT @phumzileunwomen: Thank you to Canadian Prime Minister @JustinTrudeau for hosting the ""Leaders Dialogue: Together for Girls Education...."
1044400450940915713,2018-09-25 01:37:26,A momentous donation and a historic achievement. Congratulations Gina - may your success and generosity inspire gen... https://t.co/Faa9y2gPwf
1044400183054925825,2018-09-25 01:36:22,"Un don considerable et une realisation sans precedent. Felicitations, Gina! Esperons que votre succes et votre gene... https://t.co/it7By5ejdq"
1044394040295378945,2018-09-25 01:11:57,"At the G7, we announced the single largest investment in girls education. Today, we discussed ideas on how we can m... https://t.co/M2GxmS4FPY"
1044393935400050688,2018-09-25 01:11:32,"Au Sommet du G7, nous avions annonce le plus grand investissement dans leducation des filles. Aujourdhui, nous av... https://t.co/zNj4ILva9h"
1044387945757769728,2018-09-25 00:47:44,"RT @liberal_party: Today, the womens employment rate in Canada is 79.2%  the highest its ever been! When we invest in women, we strength..."
1044387896814374912,2018-09-25 00:47:33,"RT @parti_liberal: Aujourd'hui au Canada, le taux d'emploi chez les femmes atteint 79,2 %  cest le taux le plus eleve jamais obtenu! En i..."
1044381491285962753,2018-09-25 00:22:05,"RT @CharlesMichel: #CETA est un succes! 

Croissance des exportations, plus dinvestissements et de jobs pour la Belgique  et le Canada..."
1044376214339825669,2018-09-25 00:01:07,"Island nations are particularly vulnerable to the effects of climate change. This afternoon at #UNGA, I met with PM... https://t.co/wEJkv1yxGh"
1044375701623902209,2018-09-24 23:59:05,Les Etats insulaires sont particulierement vulnerables aux effets des changements climatiques. Cet apresmidi a l... https://t.co/WLn2p6lviG
1044350721901121536,2018-09-24 22:19:49,"Today at #UNGA, we announced were investing in the Global Infrastructure Hub so more people see the benefits of ec... https://t.co/OR0JSUWMZU"
1044350684731199493,2018-09-24 22:19:40,"Aujourdhui a l#AGNU, nous avons annonce un investissement dans le centre mondial de coordination en matiere dinf... https://t.co/3EBbAtSDRs"
1044348607183368192,2018-09-24 22:11:25,"RT @mclaudebibeau: Good to hear ideas, opportunities and the level of ambition in the room on how best to finance the Agenda 2030. #SDGs

M..."
1044348589022085120,2018-09-24 22:11:21,"RT @mclaudebibeau: La salle est enthousiaste: des idees, des opportunites et beaucoup d'ambition pour financer l'Agenda 2030. #SDGs

Realis..."
1044334364862173189,2018-09-24 21:14:50,Today the countries of the world honoured Nelson Mandelas life and legacy at the UN. Its up to us to keep carryin... https://t.co/pYlLo0hqRL
1044334300118876160,2018-09-24 21:14:34,"Aujourdhui, aux Nations Unies, les pays du monde ont rendu hommage a la vie et a lheritage de Nelson Mandela. Ce... https://t.co/okCtocR2Wk"
1044320482177273862,2018-09-24 20:19:40,"RT @CanadaUN: Leading Canadas delegation to #UNGA, Prime Minister Justin Trudeau attended the opening of the #NelsonMandela Peace Summit t..."
1044320456759803906,2018-09-24 20:19:34,RT @CanadaONU: Le premier ministre Justin Trudeau etait a la tete de la delegation canadienne au Sommet #NelsonMandela pour la paix ce mati...
1044310222473482241,2018-09-24 19:38:54,"RT @UNDESA: How can we foster an enabling environment for financing the #GlobalGoals? 

@junesarpong leads discussion at #UNGA #Fin4Dev eve..."
1044301601509429249,2018-09-24 19:04:38,Nice to see you PM @nikolpashinyan - looking forward to seeing you again at La Francophonie next month! https://t.co/Rhhzbs2d6I
1044301563412582403,2018-09-24 19:04:29,"Jai ete content de vous voir, @nikolpashinyan, et jai bien hate de vous revoir au Sommet de la Francophonie le mo... https://t.co/IMgPhhdAN3"
1044284053136920576,2018-09-24 17:54:54,"RT @janephilpott: An important milestone for Shoal Lake 40. Not only will this road provide all-season access to the community, it also pus..."
1044284035734765568,2018-09-24 17:54:50,"RT @janephilpott: Une etape importante pour Shoal Lake 40. Cette route offrira non seulement un acces en toute saison a la communaute, mais..."
1044277390686519296,2018-09-24 17:28:26,"Canada &amp; Nepal are longstanding friends - and this morning, I met with PM Khadga Prasad Sharma Oli to strengthen th... https://t.co/1MUmayvLBR"
1044277291583524865,2018-09-24 17:28:02,"Le Canada et le Nepal sont des amis de longue date. Ce matin, jai rencontre le PM Khadga Prasad Sharma Oli pour re... https://t.co/VFkkN7ClcV"
1044261587618590720,2018-09-24 16:25:38,Beverley Busson and Martin Klyne have done tremendous work in their professional lives &amp; in their communities. Wel... https://t.co/WsPpwThQdK
1044261515635953664,2018-09-24 16:25:21,Beverley Busson et Martin Klyne ont un parcours extraordinaire tant sur le plan professionnel quau sein de leur co... https://t.co/mOCUAqOZBE
1044221155622756352,2018-09-24 13:44:58,"Good morning from NYC, where Canadas delegation will be at the @UN General Assembly this week, working with leader... https://t.co/ydHjrTTOBt"
1044221081790427136,2018-09-24 13:44:41,"Salutations de New York, ou la delegation canadienne va participer a lAssemblee generale de l@ONU_fr cette semain... https://t.co/OKaUxKlFNw"
1044216148269694976,2018-09-24 13:25:05,"RT @jyduclos: Today, families and love ones gather to celebrate the #MidAutumnFestival. I am thankful for a Canada made stronger because of..."
1044216131450474497,2018-09-24 13:25:00,"RT @jyduclos: Aujourdhui, les familles et leurs proches se reunissent pour celebrer la #FeteMiAutomne. Je suis reconnaissant de vivre dans..."
1044046323429896195,2018-09-24 02:10:15,My congratulations to PM @AbeShinzo on his leadership reelection! Lets keep working together in the months ahead t... https://t.co/nuLLPZfXti
1044045922924204033,2018-09-24 02:08:40,Toutes mes felicitations au PM @AbeShinzo pour sa reelection a la tete de son parti! Continuons a travailler ensemb... https://t.co/cGLNCvfvNG
1044034779123986432,2018-09-24 01:24:23,"Busy day in Montreal with PM @sanchezcastejon, focused on how Canada &amp; Spain can work together to fight climate cha... https://t.co/p4Bv8LfJjw"
1044034115568324609,2018-09-24 01:21:45,Journee remplie a Montreal avec le PM @sanchezcastejon : comment le Canada et l'Espagne peuvent lutter contre les c... https://t.co/hwrLDxvNcR
1044013967738327042,2018-09-24 00:01:41,RT @sanchezcastejon: Many thanks @JustinTrudeau for your invitation! We design ways for our countries to work more closely together to buil...
1044009229831483393,2018-09-23 23:42:51,Happy Mid-Autumn Festival to everyone celebrating tonight! https://t.co/MlrIcx34KB https://t.co/5WhVP4oRJG
1044008946648854528,2018-09-23 23:41:44,Joyeuse Fete de la mi-automne a tous ceux et celles qui la celebrent ce soir! https://t.co/r7otErZJ2r https://t.co/Hi8YYP0t7P
1043963670781468672,2018-09-23 20:41:49,"Welcome to Canada, @sanchezcastejon!  https://t.co/MiC1kslcm4"
1043963634605543424,2018-09-23 20:41:41,"Bienvenue au Canada, @sanchezcastejon!  https://t.co/HQvxW3zke0"
1043895067478560768,2018-09-23 16:09:13,RT @MaryamMonsef: Today marks the beginning of Canada's first Gender Equality Week. I spoke with Prime Minister @JustinTrudeau  about what...
1043895053155028997,2018-09-23 16:09:09,RT @MaryamMonsef: Aujourd'hui marque le debut de la premiere Semaine de l'egalite des sexes au Canada. J'ai parlee avec le premier ministre...
1043860118738284547,2018-09-23 13:50:20,"This week, we mark the first ever Gender Equality Week in Canada. We honour the people behind the progress weve ma... https://t.co/BtsOto8XOd"
1043860064271040512,2018-09-23 13:50:07,Nous soulignons la toute premiere Semaine de l'egalite des sexes au Canada. Rendons hommage aux gens a l'origine de... https://t.co/P94Y2uWP3y
1043615978641391616,2018-09-22 21:40:13,"I spoke to mayors @JimWatsonOttawa &amp; @MPedneaudJobin of Gatineau today by phone to get an update on storm recovery,... https://t.co/0W1fLYKyyd"
1043615768057991169,2018-09-22 21:39:23,RT @JimWatsonOttawa: Residents who wish to help with the #Ottstorm tornado relief can call the @redcrosscanada at 1-800-418-1111 to make do...
1043615723287920643,2018-09-22 21:39:12,"RT @MPedneaudJobin: Plan de reintegration presente aux sinistres en apres-midi, important d'attendre les instructions des autorites. Detail..."
1043615593327419397,2018-09-22 21:38:41,Jai appele les maires @JimWatsonOttawa et @MPedneaudJobin de Gatineau afin de faire le point sur les dommages caus... https://t.co/tEJcPm559o
1043543433263104005,2018-09-22 16:51:57,"RT @ville_gatineau: UPDATE: Municipal crews are still out in the field stabilizing and securing the areas touched by the tornado.
200 muni..."
1043543421783298049,2018-09-22 16:51:54,"RT @ville_gatineau: #Communique - Nos equipes sont toujours deployees pour securiser les zones touchees par la #tornade;
200 employes muni..."
1043532248690176000,2018-09-22 16:07:30,RT @cathmckenna: Thinking of everyone in the Ottawa-Gatineau region who were impacted by the tornado. Thank you to all @ottawacity first re...
1043532236564451328,2018-09-22 16:07:27,RT @cathmckenna: Je pense a tous ceux dans la region Ottawa-Gatineau qui ont ete affectes par la tornade. Merci aux @ottawacity premiers in...
1043506547345756161,2018-09-22 14:25:22,"Thanks John for your hard work, and thank you to @thesaaac for having me last night. This is a really important res... https://t.co/7VI4J5BGd6"
1043506414956756993,2018-09-22 14:24:51,"Merci John pour votre travail acharne, et merci a @thesaaac de mavoir invite hier soir. Le Centre constitue une re... https://t.co/OSr2gFUkQW"
1043490455311339521,2018-09-22 13:21:26,"RT @hydroottawa: UPDATE: as of 7:20 am, 171,462 customers are affected by 200 power outages across our service territory. More than 80 pole..."
1043490278886318081,2018-09-22 13:20:44,"RT @client_hydro: Environ 114 000 clients sont toujours en #panne suite a des #vents violents. Regions les plus touchees : Outaouais, Laure..."
1043298320985321472,2018-09-22 00:37:57,"Small business owners are the ambitious, hardworking backbone of Canadas economy  and our government is committed... https://t.co/4VKdAcCirw"
1043298137207721984,2018-09-22 00:37:14,"Les proprietaires de petites entreprises, ambitieux et vaillants, sont lepine dorsale de leconomie du Canada, et... https://t.co/J2xXGcqoXR"
1043287921615425539,2018-09-21 23:56:38,"To everyone dealing with the aftermath of the tornado in Dunrobin, ON &amp; the Ottawa-Gatineau area  stay safe, follo... https://t.co/8cYiSOVEl6"
1043287537522016256,2018-09-21 23:55:06,"Si vous avez ete touches par la tornade a Dunrobin et dans la region dOttawa-Gatineau: soyez prudents, suivez les... https://t.co/TO6gnAZoFF"
1043271052183392256,2018-09-21 22:49:36,"Ryan, your courage and determination are inspiring. It was great to catch up today and hear how youre doing, on an... https://t.co/2fAAnqP0d7"
1043270917177126912,2018-09-21 22:49:04,"Ryan, ton courage et ta determination sont une source dinspiration. Jai ete ravi de te revoir aujourdhui et dav... https://t.co/bnOVGCGQ96"
1043250424684466176,2018-09-21 21:27:38,"Canada &amp; Namibia have a long friendship &amp; history of working together. Today, President @hagegeingob &amp; I met in Ott... https://t.co/KDRJ2swhin"
1043250253053546497,2018-09-21 21:26:57,"Le Canada et la Namibie sont des amis et collaborateurs de longue date. Aujourdhui, a Ottawa, le president... https://t.co/xRbWWlKgXj"
1043238364697251841,2018-09-21 20:39:43,RT @MarcGarneau: Its not every day we have the opportunity to gather 9 Canadian astronauts to exchange on space exploration!  https://t.c...
1043238348607959040,2018-09-21 20:39:39,RT @MarcGarneau: Ce nest pas tous les jours que nous pouvons reunir 9 astronautes canadiens pour discuter de lexploration spatiale!  htt...
1043237115918786565,2018-09-21 20:34:45,Update on our governments plan to move forward with the TMX pipeline expansion in the right way  to create more j... https://t.co/GaGIHIOZqK
1043236983701753856,2018-09-21 20:34:13,Le point sur le plan de notre gouvernement pour bien proceder a lagrandissement de loleoduc TMX afin de creer plu... https://t.co/aE6PkPWaN1
1043233357088350210,2018-09-21 20:19:49,"Very positive meeting with German Minister-President Kretschmann of Baden-Wurttemberg today, focused on trade, grow... https://t.co/ZSocVxCSFG"
1043233249810690050,2018-09-21 20:19:23,Reunion tres productive aujourdhui avec le ministre-president allemand Kretschmann de Baden-Wurttemberg sur le com... https://t.co/ar8sYbkbOA
1043224658663931905,2018-09-21 19:45:15,"Its been one year since #CETA took effect. Thats one year of free trade with 28 countries in the EU, which means... https://t.co/enFj5cpLKN"
1043224592104546309,2018-09-21 19:44:59,Voila maintenant un an que l#AECG est entre en vigueur. Un an de libre-echange avec 28 pays de lUE signifie plus... https://t.co/1sQ4eAa4E4
1043216818477977612,2018-09-21 19:14:06,RT @shahrzadrafati: Im honoured to be appointed by @JustinTrudeau to lead Canada G20 Business Women Leaders task force to advance female e...
1043187987738230784,2018-09-21 17:19:32,"From October 11 - 13, Ill travel to Yerevan to visit Armenia and attend the XVII Francophonie Summit. I'm looking... https://t.co/sMTbSrQyKk"
1043187858163593217,2018-09-21 17:19:01,"Du 11 au 13 octobre, je me rendrai a Erevan pour visiter lArmenie et assister au XVIIe Sommet de la Francophonie.... https://t.co/PIW1sffMGC"
1043171038564151296,2018-09-21 16:12:11,"Human rights are the building blocks of freedom, justice and peace in the world. On the International Day of Peace,... https://t.co/lqL5XkPvNz"
1043170952933257217,2018-09-21 16:11:51,"Les droits de la personne garantissent la liberte, la justice et la paix dans le monde. La Journee internationale d... https://t.co/Dh7u4EUBe4"
1043146468285181952,2018-09-21 14:34:33,"RT @jimcarr_wpg: Today, we celebrate 1-year of #FreeTrade with 28 European Union countries. Thanks to #CETA, bilateral trade is up 10%. Thi..."
1043146454896975872,2018-09-21 14:34:30,"RT @jimcarr_wpg: Aujourdhui, celebrons un an de #libreechange avec les 28 pays de lUnion europeenne. Grace a l#AECG, le commerce bilater..."
1043111465820016640,2018-09-21 12:15:28,Wishing a happy Independence Day to all Armenians celebrating today! https://t.co/rQZJHWzU6f
1043111351743389696,2018-09-21 12:15:00,Joffre mes meilleurs vux a tous les Armeniens qui celebrent le Jour de lindependance de lArmenie aujourdhui! https://t.co/euWexchjh4
1042935610544189441,2018-09-21 00:36:41,"Lunch meeting, Centre Block, Parliament Hill. https://t.co/hS5rgQdPpm"
1042935499676180481,2018-09-21 00:36:14,"Diner de travail, edifice du Centre, Colline du Parlement. https://t.co/gG1buMLSo3"
1042927756412166146,2018-09-21 00:05:28,Excellente conversation. Jai ete tres heureux de vous revoir. https://t.co/D1l2i5O7uO
1042926503468695552,2018-09-21 00:00:29,"Come on, @IGRugby, bring the @BinghamCup2020 to Ottawa... wed love to have you and the @OttawaWolves are eager to ho... https://t.co/KiUtTjx8Jr"
1042926391870808066,2018-09-21 00:00:03,"Allez, @IGRugby, amenez la @BinghamCup2020 a Ottawa... on adorerait vous voir chez nous et les @OttawaWolves sont imp... https://t.co/q3B2HtoZTB"
1042898079165235200,2018-09-20 22:07:32,"As Minister of Youth I say it often, because I see it often: Young people arent the leaders of tomorrow, theyre l... https://t.co/2sT7BgR4eF"
1042897686528176129,2018-09-20 22:05:59,"Je le dis souvent, car je le vois souvent : les jeunes ne sont pas les leaders de demain, mais daujourdhui. Ces j... https://t.co/D1fIDTMKk1"
1042885618806804480,2018-09-20 21:18:02,Im looking forward to leading the Canadian delegation to the @UN General Assembly in NYC next week. Well be meeti... https://t.co/A1r2gIvNeF
1042885444898377729,2018-09-20 21:17:20,Jai hate de diriger la delegation canadienne lors de lAssemblee generale de l@ONU_fr la semaine prochaine. Avec... https://t.co/SQICF12Iaw
1042875523486167041,2018-09-20 20:37:55,"RT @cafreeland: Today, Canadas House of Commons unanimously adopted a motion recognizing the crimes against the #Rohingya as a genocide &amp;..."
1042875503575740424,2018-09-20 20:37:50,RT @cafreeland: La CdC du Canada a passe unanimement auj. une motion qui reconnait les crimes envers les #Rohingyas comme un genocide &amp; app...
1042788344311283713,2018-09-20 14:51:30,"RT @jimcarr_wpg: Opening new markets for Cdns is about creating jobs &amp; prosperity for families. Tomorrow, we celebrate the 1st year of #CET..."
1042788316154945536,2018-09-20 14:51:23,"RT @jimcarr_wpg: Offrir de nouveaux debouches pour les cdns, ca veut dire creer des emplois &amp; de la prosperite pour les familles. Demain, n..."
1042786394786156544,2018-09-20 14:43:45,"RT @CQualtro: As we lay the ground-work for an accessible future with Bill C-81, I am calling on provinces and territories, the corporate s..."
1042786380227772418,2018-09-20 14:43:41,"RT @CQualtro: Alors que nous jetons les bases dun avenir accessible, jen appelle aux provinces/territoires, aux entreprises et a tous les..."
1042598769248927745,2018-09-20 02:18:11,"After spending the afternoon speaking with some of our youngest scientists, I can tell you that the future of innov... https://t.co/cQ2UdYSLj8"
1042598651820949504,2018-09-20 02:17:43,"Apres avoir passe l'apres-midi avec certains de nos plus jeunes scientifiques, je peux vous assurer que l'avenir du... https://t.co/B4pE264Po3"
1042543982142791680,2018-09-19 22:40:29,"On Friday, well welcome Namibian President @hagegeingob to Ottawa as part of his Canadian visit. Im very much loo... https://t.co/cEW45IrEio"
1042543881479495680,2018-09-19 22:40:05,"Ce vendredi, nous accueillerons le president de la Namibie @hagegeingob a Ottawa dans le cadre de sa visite au Cana... https://t.co/Nu2ehUBVl8"
1042490400655790082,2018-09-19 19:07:34,RT @KirstyDuncanMP: Some of Canada's top young scientists are in Ottawa today for the #PMScienceFair. This morning I sat down with them to...
1042490378518257665,2018-09-19 19:07:29,RT @KirstyDuncanMP: Quelques un des meilleurs jeunes scientifiques du Canada sont a Ottawa aujourd'hui pour la foire scientifique du Premie...
1042439627234320384,2018-09-19 15:45:49,RT @mclaudebibeau: An honest and impassioned call from @rihanna on the need to invest in #education. Thank you for using your voice and tal...
1042439574948069376,2018-09-19 15:45:36,RT @mclaudebibeau: Un plaidoyer honnete et inspirant de @Rihanna sur la necessite d'investir dans l' #education. Vous etes une vraie activi...
1042425538068000770,2018-09-19 14:49:50,RT @sanchezcastejon: Many thanks @JustinTrudeau for your kind invitation! Our countries share important ties and values. I look forward to...
1042406848421355521,2018-09-19 13:35:34,RT @JonathanWNV: Canada and the #UK share many things in common  and one is fundamental: the ocean is closely linked to our economy. In my...
1042406836056612864,2018-09-19 13:35:31,RT @JonathanWNV: Le Canada et la #GB partagent de nombreuses choses en commun - et lune de ces choses est fondamentale: locean est etroit...
1042406751994343424,2018-09-19 13:35:11,"RT @janephilpott: Small clarification - the advisory for Adams Lake was in place for more than nine years, and for Cowichan Tribes just ove..."
1042406743014293504,2018-09-19 13:35:09,"RT @janephilpott: Une petite clarification - lavis a Adams Lake etait en vigeur depuis plus de neuf ans, a Cowichan Tribes depuis plus de..."
1042193139337977856,2018-09-18 23:26:22,"RT @janephilpott: Two more long-term drinking water advisories on public systems on reserve have been lifted recently:

Adams Lake Indian..."
1042193124620230656,2018-09-18 23:26:18,RT @janephilpott: Deux autres avis sur la qualite de l'eau potable a long terme touchant des systemes publics dans les reserves ont ete lev...
1042174193280929794,2018-09-18 22:11:04,"Were focused on helping our businesses succeed &amp; creating new, well-paying jobs for Canadians. Trade deals  like... https://t.co/rDLC8FJeLH"
1042174144241131521,2018-09-18 22:10:53,Nous sommes resolus a aider nos entreprises a reussir et a creer des emplois bien remuneres pour les Canadiens. Des... https://t.co/0xAdJq906m
1042149701607452676,2018-09-18 20:33:45,"This Sunday, Ill meet with Spanish PM @sanchezcastejon in Montreal to talk about how we can keep working together... https://t.co/ihbcjCFoOH"
1042149531440300032,2018-09-18 20:33:05,"Ce dimanche a Montreal, je discuterai avec le PM espagnol @sanchezcastejon de la facon dont nous pouvons accroitre... https://t.co/ksBdWOevJG"
1042108844825038853,2018-09-18 17:51:24,"RT @CanAmbClimate: Get ready! This week, Minister McKenna, Minister Wilkinson and Minister Sohi will co-host the G7 Halifax Environment, Oc..."
1042108816844832768,2018-09-18 17:51:18,"RT @AmbCanClimat: Soyez prets! Cette semaine, les ministres McKenna, Wilkinson et Sohi co-presideront la reunion des ministres de lEnviron..."
1042085069576433665,2018-09-18 16:16:56,Wishing Jewish communities in Canada &amp; around the world observing Yom Kippur a Gmar Chatimah Tovah: https://t.co/Kcb6NmC16K
1042084899983949824,2018-09-18 16:16:15,Meilleurs vux aux communautes juives au Canada et ailleurs dans le monde qui celebrent Yom Kippour. Gmar Chatimah... https://t.co/5827G5qqvh
1042071314427772928,2018-09-18 15:22:16,"RT @MaryamMonsef: When we invest in women, we strengthen the economy for everyone.  We have a $150 billion dollar reason to do this well. T..."
