id,created_at,text
1114687741659316225,2019-04-07 00:34:02,"Toronto dreams big! The @Raptors are empowering local kids through basketball, so they can succeed &amp; dream even big... https://t.co/9p77kYtiQK"
1114687670951776256,2019-04-07 00:33:45,"Toronto reve grand! Les @Raptors valorisent les enfants de leur communaute avec le basketball, pour qu'ils puissent... https://t.co/bIa4nSY2ur"
1114686497486192640,2019-04-07 00:29:05,RT @Raptors: Honoured to be joined by Prime Minister @JustinTrudeau and the Minister of Immigration @HonAhmedHussen today at the OVO Athlet...
1114684954598891521,2019-04-07 00:22:57,RT @HonAhmedHussen: Thank you @Raptors for hosting us today. Your continuous support of Toronto's youth is making a real difference in our...
1114661409781108737,2019-04-06 22:49:24,RT @CBCNews: LIVE: Memorial service marking 1 year since #HumboldtBroncos bus crash https://t.co/i1jtcf77AA
1114659611519401984,2019-04-06 22:42:15,"RT @TSN_Sports: ON NOW: The city of Humboldt marks one year since the fatal Broncos bus crash with a memorial service, paying tribute to th..."
1114657508935778304,2019-04-06 22:33:54,"Oh baby! What a career. For half a century, Bob Cole was the voice of hockey in Canada and made the game even more... https://t.co/dtlr7BTq37"
1114657502321434624,2019-04-06 22:33:52,"Oh baby! Quelle carriere! Pendant un demi-siecle, Bob Cole a ete la voix du hockey au Canada et a rendu le match en... https://t.co/urCZ9jMtRi"
1114646977113993217,2019-04-06 21:52:03,"Together, we are #HumboldtStrong. Watch this powerful tribute to the 16 lives lost one year ago today: https://t.co/6xEVC63imn"
1114646871442694144,2019-04-06 21:51:37,"Ensemble, nous sommes unis pour #Humboldt. Regardez l'hommage poignant rendu aux 16 vies que nous avons perdues il... https://t.co/2pAIl4EpFv"
1114537753344192514,2019-04-06 14:38:02,Big news for families in Toronto: yesterday we announced the largest investment in municipal housing in Canadian hi... https://t.co/H3q1eoIAvY
1114537400519352322,2019-04-06 14:36:38,Bonne nouvelle pour les Torontois: nous avons annonce le plus important investissement dans le logement municipal d... https://t.co/SntSJbwbz9
1114531913803419648,2019-04-06 14:14:49,"RT @RalphGoodale: One year ago today, a terrible highway crash devastated the #HumboldtBroncos. Our hearts ache for the 16 lives that were..."
1114531899186274305,2019-04-06 14:14:46,"RT @RalphGoodale: Il y a un an aujourdhui, un terrible accident dautoroute a devaste les #HumboldtBroncos. Nos coeurs souffrent pour les..."
1114527191935660032,2019-04-06 13:56:04,"My thanks to Tom Reid of @IBEWCanada for the call yesterday. Our government has electrical workers backs, and wer... https://t.co/ZNYNwx3FgC"
1114527190375444481,2019-04-06 13:56:03,"Canadian workers have built our country, and theyre building our future. I had a good call with Lionel Railton of... https://t.co/yI7fpFaPz5"
1114527011920392193,2019-04-06 13:55:21,Merci a Tom Reid de la @IBEWCanada pour lappel dhier. Notre gouvernement est derriere les ouvriers en electricite... https://t.co/PCnAdszBuo
1114527010460786689,2019-04-06 13:55:20,"Les travailleurs canadiens ont bati notre pays, et ils batissent notre avenir. Hier, jai eu une bonne discussion a... https://t.co/WiSjgAG4mx"
1114500946053206016,2019-04-06 12:11:46,"One year ago, Canada grieved as the Humboldt community faced incredible tragedy. Today, we remember the Humboldt Br... https://t.co/CHLQ8yC2c1"
1114500809092403202,2019-04-06 12:11:13,"Il y a un an, le Canada etait en deuil avec la communaute de Humboldt apres une incroyable tragedie. Aujourd'hui, o... https://t.co/8bdLm8r5XB"
1114321672759332864,2019-04-06 00:19:24,"Canadians are appalled by Bruneis new penal code that will target women, the LGBTQ2 community &amp; other minority gro... https://t.co/L44el880hk"
1114321544166158336,2019-04-06 00:18:53,"Nous sommes consternes par le nouveau code penal de Brunei ciblant les femmes, les LGBTQ2 et dautres minorites et... https://t.co/FkZ7JAv1l3"
1114314630141231104,2019-04-05 23:51:25,Investing in affordable housing is about giving everyone a real &amp; fair chance at success. Today we announced a hist... https://t.co/1zneyHGkWR
1114314533760319493,2019-04-05 23:51:02,"Investir dans le logement abordable, c'est donner a tous une chance reelle et egale de reussir. Grace a linvestiss... https://t.co/QoCXgcr9pd"
1114312224275927040,2019-04-05 23:41:51,"RT @HonAhmedHussen: Affordable housing helped me and many others pursue their dreams &amp; go to University.

Everyone should have a roof over..."
1114312206131367936,2019-04-05 23:41:47,"RT @HonAhmedHussen: Le logement abordable m'a aide et beaucoup d'autres personnes a poursuivre leurs reves et daller a l'universite.

Tout..."
1114311465996095488,2019-04-05 23:38:51,RT @FCM_online: Important news for social housing in Toronto. Todays announcement demonstrates how the federal-municipal partnership can g...
1114270444851466240,2019-04-05 20:55:50,"Yesterday I spoke with @JunckerEU. Thanks for the call, Jean-Claude, and for the conversation on trade, and the imp... https://t.co/5UCfsI1WPv"
1114270443765157888,2019-04-05 20:55:50,Good phone call this morning with @eucopresident Tusk on our shared commitment to respecting the rule of law and pr... https://t.co/XPsZQESZXl
1114270319466954752,2019-04-05 20:55:20,"Hier, je me suis entretenu avec @JunckerEU. Merci pour l'appel, Jean-Claude, et pour la conversation sur le commerc... https://t.co/qingoyqffi"
1114270318607196161,2019-04-05 20:55:20,Bon entretien telephonique ce matin avec l@eucopresident Tusk sur notre engagement commun a respecter la primaute... https://t.co/3sYutX0Xnr
1114258198746288129,2019-04-05 20:07:11,RT @TOAdamVaughan: Today we announced a historic $1.3 billion to repair Toronto's community housing units. We are stepping up and working w...
1114255519529807872,2019-04-05 19:56:32,RT @JohnTory: Joining Prime Minister @JustinTrudeau &amp; Minister @JYDuclos in Scarborough to announce a new $1.3 billion partnership with the...
1114254956968722433,2019-04-05 19:54:18,RT @Bill_Morneau: The new First-Time Home Buyer Incentive will reduce the cost of purchasing a home by up to 10%. By making it possible for...
1114254941588205568,2019-04-05 19:54:14,RT @Bill_Morneau: Le nouvel incitatif a l'achat d'une premiere propriete fera baisser le cout de l'accession a la propriete de juqua 10%....
1114184648328871936,2019-04-05 15:14:55,RT @PattyHajdu: Attention all young Canadians! The Youth Video Challenge has begun. Share a video telling us why you are #InspiredToServe f...
1114184627462320131,2019-04-05 15:14:50,RT @PattyHajdu: Attention a tous les jeunes Canadiens! Le Defi video du Sommet est commence. Partagez une video ou vous nous dites pourquoi...
1114182352861835266,2019-04-05 15:05:48,"RT @HarjitSajjan: 70 years ago today, Canada was among the 12 countries that gathered in Washington to sign the treaty that formed @NATO. S..."
1114182331458310145,2019-04-05 15:05:42,"RT @HarjitSajjan: Il y a 70 ans, le Canada etait des 12 pays reunis a Washington pour signer le traite qui formant lOTAN. Depuis, nous avo..."
1114179534369316866,2019-04-05 14:54:36,Entrepreneurs &amp; workers in Saguenay-Lac-Saint-Jean are world renowned for their innovation &amp; bright ideas. Last nig... https://t.co/FYUGtKSbmE
1114179497274880001,2019-04-05 14:54:27,Les entreprises et travailleurs du Saguenay-Lac-Saint-Jean sont reputes pour leur innovation et leurs bonnes idees.... https://t.co/a7Nf8RESi0
1113968998822096896,2019-04-05 00:58:00,Last week I spoke with leading scientists about Canadas Changing Climate Report. Canada is warming at 2x the globa... https://t.co/TqlEIEKoIq
1113968953150312448,2019-04-05 00:57:49,La semaine passee jai parle avec des scientifiques du Rapport sur le climat changeant du Canada. Le Canada se rech... https://t.co/oOTEpbWrCm
1113959211766038530,2019-04-05 00:19:07,"The nature of work is changing, and Canadians like the students at @collegealma need time &amp; money to get their skil... https://t.co/a6jOvMB7xj"
1113959157340823553,2019-04-05 00:18:54,"La nature du travail change, et les etudiants comme ceux du @collegealma doivent avoir temps &amp; argent pour renforce... https://t.co/8I137ZRTg7"
1113903212501848066,2019-04-04 20:36:35,RT @KirstyDuncanMP: The safety of our children and athletes is paramount. That's why #Budget2019 proposes to invest $30 million to enable C...
1113903200678158336,2019-04-04 20:36:33,RT @KirstyDuncanMP: La securite de nos enfants et athletes est primordiale. C'est pourquoi #Budget2019 propose d'investir 30 millions de do...
1113856012870737920,2019-04-04 17:29:02,RT @PattyHajdu: Our government is introducing the Canada Training Benefita new tool giving workers the two things they need most to upgrad...
1113855998156996609,2019-04-04 17:28:59,RT @PattyHajdu: Notre gouvernement a cree lAllocation canadienne pour la formation  un nouvel outil offrant aux travailleurs les deux ele...
1113855225864048641,2019-04-04 17:25:54,"RT @SeamusORegan: Education, food security and the changing climate in the North were front and centre at last nights Inuit-Crown Partners..."
1113815203349762049,2019-04-04 14:46:52,"We have more than an ally in Israel, we have a trusted and longstanding friend. Thank you to @PresidentRuvi for vis... https://t.co/GUOeq13dv8"
1113815148429565952,2019-04-04 14:46:39,"Israel est plus qu'un allie, cest un ami de confiance et de longue date. Merci au @PresidentRuvi d'avoir visite le... https://t.co/KIVyUGeoIx"
1113793828849442816,2019-04-04 13:21:56,"Canada is a proud founding member of NATO, and weve shown strong and active leadership throughout its history. Tod... https://t.co/IALV7XjvPj"
1113793712612610048,2019-04-04 13:21:29,"Le Canada est un fier membre fondateur de lOTAN, ou il a toujours fait preuve dun leadership fort et dynamique. E... https://t.co/BSySDkL1F5"
1113623678552616961,2019-04-04 02:05:49,"Since 2017, the Inuit-Crown Partnership Committee has been working together to advance reconciliation &amp; create pros... https://t.co/wmSiI92hlL"
1113623569119027201,2019-04-04 02:05:23,"Depuis 2017, le Comite de partenariat entre les Inuits et la Couronne favorise la reconciliation et la prosperite p... https://t.co/jjj0qYeZfS"
1113597960921800709,2019-04-04 00:23:38,"Annalyn Ervas represented Papineau for #DaughtersOfTheVote. Thank you Annalyn for meeting with me today, and for yo... https://t.co/Rs5cHZLMiV"
1113597954407981057,2019-04-04 00:23:36,"Today, 338 young women from across Canada took their seats in the House of Commons for #DaughtersOfTheVote. Thanks... https://t.co/Gb5wVx8zS6"
1113597856328421376,2019-04-04 00:23:13,"Annalyn Ervas a represente Papineau a #HeritieresDuSuffrage. Merci, Annalyn, pour la rencontre daujourd'hui et le... https://t.co/uuvJtXZTrS"
1113597849894359040,2019-04-04 00:23:11,"Aujourd'hui, 338 jeunes femmes de partout au Canada ont pris place a la Chambre des communes pour... https://t.co/O049blFYoW"
1113495796912152576,2019-04-03 17:37:40,"Canada and Israel have a special bond, rooted in mutual respect and shared values. Last night I joined Torontos Je... https://t.co/wHxRQNKKqA"
1113495729278996481,2019-04-03 17:37:24,"Le Canada et Israel ont des liens particuliers, ancres dans le respect mutuel et des valeurs communes. Hier, avec l... https://t.co/RTTVDd9Hnt"
1113430740505640962,2019-04-03 13:19:09,We kicked off @cancersociety's #DaffodilCampaign with Bria and Odin in Ottawa yesterday. They're both living with c... https://t.co/ZCZKSk2ddP
1113430664173510656,2019-04-03 13:18:51,"Hier a Ottawa, nous avons lance la #CampagneDeLaJonquille de la @societeducancer avec Bria et Odin. Ils sont tous d... https://t.co/kXn3FybpdK"
1113222121289912322,2019-04-02 23:30:11,"Sophie and I are deeply saddened to hear of this, @PresidentRuvi. Canadians are thinking of you and Nechama, and wi... https://t.co/zd0T5lLV9m"
1113222090314924032,2019-04-02 23:30:03,"Sophie et moi sommes profondement attristes d'apprendre cela, @PresidentRuvi. Les Canadiens pensent a vous et a Nec... https://t.co/QJd0NhvfD4"
1113203063467200517,2019-04-02 22:14:27,Im speaking at our National Caucus meeting in Ottawa tonight. Click here to watch live: https://t.co/Gv0DIO0LEm
1113203031963779072,2019-04-02 22:14:19,Je prends la parole a la reunion du caucus national a Ottawa ce soir. Cliquez ici pour regarder en direct : https://t.co/Gv0DIO0LEm
1113138736232062982,2019-04-02 17:58:50,"The #YouthSummit2019 will gather 300 young leaders whove served their communities for the better, to talk about wh... https://t.co/RbXg4VkQao"
1113138734520823808,2019-04-02 17:58:50,Calling all young Canadians! Your leadership &amp; ideas are critical as we work to make life better for everyone. That... https://t.co/jPPowSZsQT
1113138550877442050,2019-04-02 17:58:06,Le #SommetJeunesse2019 reunira 300 jeunes qui ont servi leur communaute afin de discuter de ce qui est important po... https://t.co/idDx8ofNF0
1113138548889325580,2019-04-02 17:58:05,Appel a tous les jeunes Canadiens! Votre leadership et vos idees sont necessaires pour ameliorer la vie de tout le... https://t.co/9cSlgjfzxF
1113127217096261633,2019-04-02 17:13:04,"RT @liberal_party: Canadians with autism and those who care for them face unique challenges every day. On #WorldAutismDay, and every day, l..."
1113127197139664896,2019-04-02 17:12:59,RT @parti_liberal: Les Canadiens souffrant dautisme et leurs proches sont confrontes chaque jour a des defis uniques. En cette Journee mon...
1113103907788656642,2019-04-02 15:40:26,"This is why we need #ClimateAction NOW, &amp; a price on pollution is a key part of that. Our kids and grandkids are co... https://t.co/ivkMB4qcEI"
1113103850267906048,2019-04-02 15:40:13,"Voila pourquoi nous avons besoin d#actionclimat MAINTENANT, et mettre un prix sur la pollution est un element cle... https://t.co/cIU42V5x76"
1113100488294195201,2019-04-02 15:26:51,"RT @MarcSerreMP: Our government is taking real action for our kids, grandkids and communities while making life more affordable for Canadia..."
1113100470954983424,2019-04-02 15:26:47,"RT @MarcSerreMP: Notre gouvernement prend des mesures concretes pour nos enfants, nos petits-enfants et nos collectivites, tout en rendant..."
1113074779462995973,2019-04-02 13:44:42,"What we dont want:
Pollution &amp; climate change
What we do want:
Clean air
Strong communities
A healthy planet f... https://t.co/fcLyGBgQqE"
1113074726405095424,2019-04-02 13:44:29,"On ne veut pas:
Pollution et changement climatique
On veut:
Air propre
Communautes fortes
Planete en sante pour... https://t.co/M3L9vj8SIs"
1112874981283725312,2019-04-02 00:30:46,"Today is an important day for Newfoundland and Labrador, and Canada. Together under our Atlantic Accord agreement,... https://t.co/tlzFegzsnm"
1112874853164634112,2019-04-02 00:30:15,"Cest un jour important pour Terre-Neuve-et-Labrador et le Canada. Dans le cadre de l'Accord atlantique, nous trava... https://t.co/brBhfrL81y"
1112861370985402368,2019-04-01 23:36:41,"Canadians know that climate change is real, and that we need to act now. Putting a price on pollution is going to p... https://t.co/BnDi6COJTR"
1112861340245348352,2019-04-01 23:36:34,Les Canadiens savent que les changements climatiques sont vrais et quil faut agir des maintenant. Le fait de mettr... https://t.co/rzi5hThxxr
1112859751682068485,2019-04-01 23:30:15,"RT @liberal_party: We all want a cleaner environment and a healthier future for our kids and grandkids. Starting today, its no longer free..."
1112859700561887232,2019-04-01 23:30:03,RT @parti_liberal: Nous souhaitons tous un environnement plus propre et un avenir plus sain pour nos enfants et nos petits-enfants. A compt...
1112859186646450176,2019-04-01 23:28:00,RT @mclaudebibeau: Maintaining market access for our high-quality #canola is our priority because it means more money in the pockets of our...
1112859173941923840,2019-04-01 23:27:57,RT @mclaudebibeau: Conserver l'acces aux marches pour notre #canola de haute qualite est notre priorite parce que cela signifie plus d'arge...
1112855261679702016,2019-04-01 23:12:24,"Thank you, friend. Anti-Semitism has no place in Canada or anywhere in the world, and Canada will continue to stand... https://t.co/rXFpoRH92E"
1112855239982530561,2019-04-01 23:12:19,"Merci, mon ami. L'antisemitisme n'a pas sa place au Canada ni ailleurs dans le monde, et le Canada continuera de s'... https://t.co/erQV3F6Atz"
1112848338750201861,2019-04-01 22:44:54,A moving moment at the National Holocaust Monument as @PresidentRuvi and I remembered and honoured the more than si... https://t.co/gwyS7ifOeB
1112848333511561217,2019-04-01 22:44:53,Our shared values and strong friendships are worth celebrating. My thanks to @PresidentRuvi and the members of the... https://t.co/YzJ65xcFtA
1112848328784596993,2019-04-01 22:44:51,"Welcome to Canada, @PresidentRuvi. Canada and Israel have long been steadfast allies and friends. This year, were... https://t.co/1IXPFHF6ZD"
1112848197821579266,2019-04-01 22:44:20,Un moment emouvant au Monument national de l'Holocauste. Le @PresidentRuvi et moi avons commemore et honore les plu... https://t.co/kNcOzCFyTz
1112848192817848321,2019-04-01 22:44:19,Nos valeurs communes et nos amities solides meritent d'etre celebrees. Je remercie le @PresidentRuvi et les membres... https://t.co/XU1KFtmO8y
1112848188166365184,2019-04-01 22:44:18,"Bienvenue au Canada, @PresidentRuvi. Le Canada et Israel sont depuis longtemps des amis et des allies fideles. Cett... https://t.co/EqSYLVzdPC"
1112830452124057601,2019-04-01 21:33:49,"RT @jyduclos: Homelessness is a reality for too many Canadians, and a challenge for every community. Learn more about Reaching Home, Canada..."
1112830439222362112,2019-04-01 21:33:46,RT @jyduclos: Litinerance est une situation bien reelle pour trop de Canadiens. Pour en savoir plus sur Vers un chez-soi : la nouvelle str...
1112829346409037826,2019-04-01 21:29:26,"This is good news for the Canadian energy sector  Keystone XL will create good, well-paying jobs for Canadians. We... https://t.co/ZLIwCRN134"
1112829302083645440,2019-04-01 21:29:15,Bonne nouvelle pour le secteur canadien de l'energie : le projet Keystone XL creera de bons emplois bien remuneres... https://t.co/8okIiNxByr
1112772941316542466,2019-04-01 17:45:18,"Starting today, were making big polluters pay, and giving the money right back to Canadians  to keep our communit... https://t.co/50jKASRHb2"
1112772895003066368,2019-04-01 17:45:07,"Maintenant, les grands pollueurs payent et largent est remis aux Canadiens  pour garder nos communautes propres e... https://t.co/5HJsSxbdnC"
1112742957499715584,2019-04-01 15:46:09,"The answer to climate change is clear: we need to act now. And thats what were doing. Starting today, its no lon... https://t.co/qRsL1ictO1"
1112742922326327302,2019-04-01 15:46:01,La reponse aux changements climatiques est claire : on doit agir maintenant. Et cest ce quon fait. A partir dauj... https://t.co/DrI7mpch8j
1112712384962015234,2019-04-01 13:44:40,Today we celebrate the 20th anniversary of Nunavut and the unique heritage of the people who call it home. The Nort... https://t.co/NbXKdLAeOR
1112712340162646016,2019-04-01 13:44:29,Aujourd'hui on celebre le 20e anniversaire du Nunavut ainsi que le patrimoine unique des gens qui y vivent. Le Nord... https://t.co/ebClWRhEln
1112675588999991297,2019-04-01 11:18:27,"RT @cathmckenna: As of today, its no longer free to pollute anywhere in Canada. Canadians understand that climate change is real and they..."
1112675577138475009,2019-04-01 11:18:24,RT @cathmckenna: Plus personne ne pourra polluer gratuitement au Canada. Les Canadiens comprennent que le changement climatique est reel et...
1112520830951612417,2019-04-01 01:03:30,RT @cathmckenna: 100% of the proceeds will be returned to the province in which they were collected. While 90% will be returned directly to...
1112520814451150855,2019-04-01 01:03:26,RT @cathmckenna: 100% des revenus seront retournes a la province. 90% des revenus seront reverses directement aux residents de la province...
1112519832694648834,2019-04-01 00:59:32,"RT @liberal_party: Starting tomorrow, it will no longer be free to pollute anywhere in Canada. Our plan makes polluters pay and gives the m..."
1112519803745517569,2019-04-01 00:59:25,"RT @parti_liberal: A compter de demain, il sera interdit de polluer gratuitement ou que ce soit au Canada. Notre plan fait payer les pollue..."
1112450244309143553,2019-03-31 20:23:01,RT @Carolyn_Bennett: Welalin. Qujannamiik. Nia:wen. Miigwetch. Marsee. Kinanaskomitin. Huy ch qu. Merci. Thank you to those who have foug...
1112450197752291333,2019-03-31 20:22:50,RT @Carolyn_Bennett: Welalin. Qujannamiik. Nia: wen. Miigwetch. Marsee. Kinanaskomitin. Huy ch qu. Thank you. Merci a ceux qui se sont ba...
1112431614313803776,2019-03-31 19:08:59,"RT @Rodriguez_Pab: Happy National Aboriginal Languages Day! Today we celebrate the more than 70 diverse Indigenous languages in Canada. 

L..."
1112431602087403523,2019-03-31 19:08:56,"RT @Rodriguez_Pab: Bonne Journee nationale des langues autochtones ! Aujourd'hui, nous celebrons plus de 70 langues autochtones au Canada...."
1112405752734466048,2019-03-31 17:26:13,".@IamSandraOh, congratulations on hosting @nbcsnl! You were hilarious last night, and made us all proud.  https://t.co/a8bOpCcwLo"
1112405662426939394,2019-03-31 17:25:52,".@IamSandraOh, felicitations davoir anime @nbcsnl! Vous etiez vraiment drole hier soir et vous nous avez tous rend... https://t.co/PctnMX9VCo"
1112367528699924483,2019-03-31 14:54:20,"Thanks for the call, @drewdilkens. Together well keep working to stand up for auto workers in Windsor, fight for t... https://t.co/kKC9Z777YV"
1112367469333753857,2019-03-31 14:54:06,"Merci de votre appel, @drewdilkens. Ensemble, nous continuerons a travailler pour defendre les travailleurs de lau... https://t.co/AtyHffH6An"
1112367250546327552,2019-03-31 14:53:13,"RT @NavdeepSBains: Was in Windsor to meet FCAs leadership, Mayor @drewdilkens, @LOCAL444UNIFOR &amp; a number of auto workers whose life and f..."
1112367238768705537,2019-03-31 14:53:11,"RT @NavdeepSBains: A Windsor jai rencontre FCA, le maire @drewdilkens, @LOCAL444UNIFOR &amp; des travailleurs dont la vie et les familles ont..."
1112361898274668544,2019-03-31 14:31:57,"All Canadians should feel free and safe to be who they are. On this Transgender Day of Visibility, know that well... https://t.co/rDRXmuUbhS"
1112361870911066121,2019-03-31 14:31:51,Tous les Canadiens devraient se sentir libres detre qui ils sont. En cette Journee internationale de la visibilite... https://t.co/yrFOxjYMja
1112150244895215618,2019-03-31 00:30:55,"We all have a role to play to protect our environment  not just during #EarthHour, but every single day. Starting... https://t.co/4PutbigdHs"
1112150169217200128,2019-03-31 00:30:37,"Il nous revient a tous de proteger lenvironnement, pas seulement durant #Uneheurepourlaterre, mais chaque jour. A... https://t.co/vdPWSarvAR"
1112087108494262277,2019-03-30 20:20:02,RT @jyduclos: Every Canadian deserves a safe and affordable place to call home. #YourBudget2019 offers new support for first-time home buye...
1112087092249665536,2019-03-30 20:19:59,"RT @jyduclos: Chaque Canadien merite un chez-soi sur et abordable. #VotreBudget2019 soutient les acheteurs d'une premiere propriete, contie..."
1112064640958283776,2019-03-30 18:50:46,"For too many hardworking Canadians, buying a house right now seems impossible. The First-Time Home Buyer Incentive... https://t.co/6F4vyfCzYv"
1112064545344970752,2019-03-30 18:50:23,"Pour bien des Canadiens, lachat dune propriete semble impossible. LIncitatif a lachat dune premiere propriete... https://t.co/1x57mP6GSU"
1112037147954036742,2019-03-30 17:01:31,"RT @liberal_party: #YourBudget2019 is taking the next steps in our plan for a better future for all Canadians by:

 Supporting first-time..."
1112037111241293826,2019-03-30 17:01:22,"RT @parti_liberal: Voyez les nouvelles etapes du plan visant a offrir un meilleur avenir a tous dans #VotreBudget2019 :

Soutien aux achet..."
1111997383926337536,2019-03-30 14:23:30,"One of the highlights of my day was meeting Marjorie Caldwell, and spending some time with her on her 100th birthda... https://t.co/7xyG9a7kTu"
1111997377991401477,2019-03-30 14:23:29,"Seniors at the St. Croix Wellness and Renewal Centre in New Brunswick, and all across Canada, have worked hard thei... https://t.co/x5GmRvQxDZ"
1111997371968299008,2019-03-30 14:23:28,"Our government is supporting Canadian seniors, whove contributed so much to our country. I had a busy day in NS &amp;... https://t.co/LdfWARbYTV"
1111997276505948160,2019-03-30 14:23:05,Lun des points forts de ma journee : ma rencontre avec Marjorie Caldwell et le temps passe en sa compagnie lors de... https://t.co/51tFWx6Y0T
1111997270600413187,2019-03-30 14:23:03,Les aines du St. Croix Wellness and Renewal Centre au N. B. et de partout au Canada ont travaille fort toute leur v... https://t.co/tmhpkNJ47s
1111997263667179520,2019-03-30 14:23:02,"Le gouvernement vient en aide aux aines canadiens, qui contribuent tant a notre pays. Cette semaine en N. E. et au... https://t.co/iv4uNMTRPU"
1111730966177943553,2019-03-29 20:44:51,"Starting Monday, polluting will no longer be free in Canada. Putting a price on pollution is going to make big emit... https://t.co/lQ0W6HxbJm"
1111730933382692871,2019-03-29 20:44:44,"A partir de lundi, la pollution aura un prix au Canada. En mettant un prix sur la pollution, nous nous assurons que... https://t.co/Wl5Z7xVw5x"
