id,created_at,text1049476189230956545,2018-10-09 01:46:36,RT @PresidencialVen: #EnVivo  | Yo confio que los niveles de Direccion y la nueva estructura que estamos configurando dentro del PSUV e v...
1049476165797404674,2018-10-09 01:46:30,RT @ViceVenezuela: #EnVivo || Presidente @NicolasMaduro: Algo bueno debemos estar haciendo en Venezuela para ser el centro de ataques media...
1049475953653702663,2018-10-09 01:45:40,RT @VTVcanal8: #EnDirecto | Pdte. @NicolasMaduro: Julio Borges es un magnate que vive en mansiones de lujo y que maneja los recursos del f...
1049475935651721221,2018-10-09 01:45:36,RT @PresidencialVen: #EnVivo  |  Son 3 niveles de Liderazgo de bases: 1 nivel: 242 mil Jefes o Jefas de calles. 2 Nivel: Formacion de j...
1049475760971501569,2018-10-09 01:44:54,RT @JEHYSONGUZMAN: Desde Merida felicitamos a todos nuestros hermanos y hermanas compatriotas que asumen nuevas responsabilidades politicas...
1049475722409074688,2018-10-09 01:44:45,"RT @HectoRodriguez: La meta esta fijada: en el 2025 Venezuela sera una Patria libre, soberana, de suprema felicidad para el pueblo y social..."
1049475706906992640,2018-10-09 01:44:41,RT @HectoRodriguez: Asumimos con mucha consciencia y compromiso la Vicepresidencia de Formacion Ideologica del @PartidoPSUV. Garantizar el...
1049475657200259072,2018-10-09 01:44:29,RT @FreddyBernal: Mi agradecimiento a toda la militancia del @PartidoPSUV y al Pdte. @NicolasMaduro por su confianza y ratificacion en la d...
1049475631300395009,2018-10-09 01:44:23,"RT @PresidencialVen: #EnVivo  | En Venezuela hay una oposicion no dialogante, no politica, no democratica. Es una derecha colombianizada..."
1049475465478582273,2018-10-09 01:43:43,"RT @OmarPrietoGob: En el marco de este historico congreso del @PartidoPSUV y la @JuventudPSUV recibo con humildad y compromiso, la designac..."
1049475418825400320,2018-10-09 01:43:32,"RT @RMarcoTorres: Agradezco a nuestro presidente @NicolasMaduro al designarme en esta nueva responsabilidad, asumire con humildad de soldad..."
1049475404501831681,2018-10-09 01:43:29,RT @OmarPrietoGob: Gracias Pdte. Nicolas Maduro por su confianza para llevar al #ZuliaMia por el camino hermoso de la revolucion bolivarian...
1049412035799379970,2018-10-08 21:31:41,"#EnVivo  | Conclusiones de la plenaria conjunta del IV Congreso del @PartidoPSUV y la @JuventudPSUV, para definir... https://t.co/01XGXDw3cO"
1049332786044256256,2018-10-08 16:16:46,"El Petro da inicio a una nueva era en el intercambio comercial nacional e internacional, que rompera con el cerco e... https://t.co/0JmcUzq1Ig"
1049310803265032193,2018-10-08 14:49:25,"Hace 123 anos nacio Juan Domingo Peron, una de las figuras politicas mas importantes y trascendentales de Argentina... https://t.co/M1lV5jikFB"
1049288758929965057,2018-10-08 13:21:49,"En homenaje al Cmdte. Che Guevara, conmemoramos el Dia del Guerrillero Heroico. La conviccion del Che por la constr... https://t.co/MNwWKPBjyL"
1049274391576682496,2018-10-08 12:24:44,Felicito a los Medicos y Medicas Integrales Comunitarios en su dia. Ustedes son los encargados de construir y conso... https://t.co/S6jkSKmgCl
1049086476343021568,2018-10-07 23:58:01,"Esta semana iniciamos el ano escolar, lanzamos nuestra criptomoneda El Petro, entregamos la vivienda 2 millones 200... https://t.co/qF8HYYRiMx"
1049067598242074624,2018-10-07 22:43:00,Felicito a nuestras atletas Maria Gimenez y Katherin Echandia! Sus brillantes actuaciones en los Juegos Olimpicos... https://t.co/Yz4ZVoWs15
1049052609754136577,2018-10-07 21:43:27,"Les comparto un extraordinario articulo que nos rememora los hechos de aquel ano 2012, cuando consagramos a nuestro... https://t.co/hlLnLYDucc"
1048983799474864128,2018-10-07 17:10:01,"En el Boletin N 128 del @PartidoPSUV, encontraras orientaciones que invitan a toda nuestra militancia a asumir la... https://t.co/zR0qBXrSfU"
1048964798120189952,2018-10-07 15:54:31,"En nombre de todo el pueblo venezolano, le enviamos un caluroso abrazo a nuestro hermano presidente Vladimir Putin,... https://t.co/FM8dX4csN7"
1048944708830056448,2018-10-07 14:34:41,"Hoy esta de aniversario la Mision ""Jovenes de la Patria Robert Serra"", en honor a nuestro joven martir. Nuestro com... https://t.co/4PAyU6eUCC"
1048930664907767810,2018-10-07 13:38:53,"Hace 6 anos, fui testigo de una batalla democratica historica, donde el pueblo, lleno de civismo y esperanza, salio... https://t.co/Cnl40IivJP"
1048909044474400768,2018-10-07 12:12:58,"Conmemoramos los 200 anos de las Cartas de la Dignidad, respuesta ejemplar y soberana de nuestro Libertador Simon B... https://t.co/PmolpB7nSU"
1048778495185358848,2018-10-07 03:34:13,"RT @NicolasMaduro: Los invito a descargar la edicion No 184 del periodico @CuatroFWeb: Victoria historica, con mas verdades de Venezuela..."
1048778238422605824,2018-10-07 03:33:12,RT @correoorinoco: Ministro @vladimirpadrino insta a la Milicia Bolivariana a consolidar las unidades populares de defensa integral https:/...
1048776949550788609,2018-10-07 03:28:04,RT @AmeliachPSUV: No puedes dejar de escuchar a @vladimirpadrino explicando como se prepara la @MiliciaFANB para la defensa de la Patria ht...
1048776920614223872,2018-10-07 03:27:57,RT @CuatroFWeb: Desde el 4to Congreso del @PartidoPSUV @HectoRodriguez convoca a la militancia a los #CirculosCuatroF un espacio para el de...
1048650334086868997,2018-10-06 19:04:57,Quieres saber que podras hacer con El Petro? Comparto informacion importante de nuestra moneda digital como herram... https://t.co/LHlYyzJwBM
1048610590783156224,2018-10-06 16:27:01,"En el marco del fortalecimiento de nuestro sistema de proteccion social, nos reunimos con Maria Cristina Perceval,... https://t.co/Dfo2X1EXBs"
1048576220768686080,2018-10-06 14:10:27,"A 42 anos de la voladura del avion de Cubana de Aviacion, acto criminal que acabo con la vida de 73 personas inocen... https://t.co/3SFH8bqWdK"
1048553886460653569,2018-10-06 12:41:42,"En el Dia Interamericano del Agua, Venezuela reafirma su compromiso con el desarrollo sostenible para seguir mejora... https://t.co/7QISKjWihA"
1048376037464309760,2018-10-06 00:54:59,RT @jaarreaza: Hace unos minutos aterrizo el quinto vuelo @LAConviasa del Plan Vuelta a la Patria procedente de Ecuador con 96 compatriotas...
1048351035113316357,2018-10-05 23:15:38,"En Venezuela nuestro pueblo manifiesta en la calle su apoyo, respaldo y confianza en la Revolucion Bolivariana. Aqu... https://t.co/i0JKxptqmk"
1048341502815027201,2018-10-05 22:37:46,"Tuvimos un extraordinario encuentro de trabajo con Maria Cristina Perceval, Directora Regional de la @UNICEF, conve... https://t.co/8h3hEQOMk4"
1048324559521435649,2018-10-05 21:30:26,"Ante la partida fisica de la Constituyentista Haydee Machin, expreso mis sentidas condolencias a sus familiares y a... https://t.co/cOcEPdjeof"
1048320589440667649,2018-10-05 21:14:40,"#EnVivo  | Palacio de Miraflores | Despedimos a Maria Cristina Perceval, Directora Regional de la @UNICEF para Ame... https://t.co/fx4MuM03OG"
1048312078585552900,2018-10-05 20:40:50,"#EnVivo  | En reunion con Maria Cristina Perceval, Directora Regional de la @UNICEF para America Latina y el Carib... https://t.co/UEqSBe2y1L"
1048248132260249600,2018-10-05 16:26:44,"Los invito a descargar la edicion No 184 del periodico @CuatroFWeb: Victoria historica, con mas verdades de Venez... https://t.co/EWjYm7DkAp"
1048224879600971777,2018-10-05 14:54:21,"En el dia historico en el que recordamos el abrazo del pueblo a nuestro Comandante Chavez, en el cierre de campana... https://t.co/yAvYr8JmXF"
1048212551903956992,2018-10-05 14:05:21,Venezuela se suma a la era digital! Conoce la nueva forma de adquirir El Petro. Epicentro para el desarrollo de... https://t.co/R7goQZ7Lt2
1048196880973398018,2018-10-05 13:03:05,"Estamos haciendo una reconversion salarial a favor de los trabajadores, en este sentido, continuaremos pagando sema... https://t.co/YcMbHu5ROn"
1048189670675423232,2018-10-05 12:34:26,"Conmemoramos 83 anos de la siembra del ilustre tocuyano, Jose Pio Tamayo, poeta, politico, escritor, integrante de... https://t.co/JYm44Q1yAa"
1048179547714322432,2018-10-05 11:54:13,"Hace 129 anos nacio la novelista mas importante de la primera mitad del siglo XX en nuestro pais, Ana Teresa Parra... https://t.co/TcHM5x4VF1"
1048168101290942464,2018-10-05 11:08:44,"En el marco de la construccion de un nuevo sistema educativo que forme ciudadanos responsables, con valores sociali... https://t.co/77RzPxaN2i"
1048006861054730244,2018-10-05 00:28:01,La vivienda es el punto de partida para una nueva vida familiar y comunal. Invito a todos los habitantes de los urb... https://t.co/uM91w7OwYR
1047998336647798785,2018-10-04 23:54:08,"Cumpliendo el sueno de nuestro Comandante Chavez, hoy hemos alcanzado las #2Millones200MilViviendas para nuestro pu... https://t.co/rfVYvW8rdw"
1047977324006838272,2018-10-04 22:30:39,"RT @teleSURtv: Presidente @NicolasMaduro lidera este jueves acto de entrega de vivienda 2 millones 200 mil

Estos #2Millones200MilViviendas..."
1047975873847218177,2018-10-04 22:24:53,"RT @teleSURtv: En #Colombia van 22 lideres sociales asesinados desde que Ivan Duque asumio la presidencia https://t.co/sk58iqIlei 

Cauca y..."
1047974036603637761,2018-10-04 22:17:35,"RT @PresidencialVen: #EnVivo  | Solo en socialismo es posible avanzar en una politica de justicia, la Gran Mision Vivienda Venezuela  es..."
1047974026147237888,2018-10-04 22:17:32,"RT @PresidencialVen: EnVivo  | La GMVV es una experiencia unica en el mundo q consigue los mejores terrenos, pone el financiamiento y los..."
1047973995340095489,2018-10-04 22:17:25,RT @PresidencialVen: #EnVivo  | Puede decir el gobierno colombiano que ha construido una sola vivienda para su pueblo? Puede decirlo lo...
1047973938440097792,2018-10-04 22:17:11,"RT @PresidencialVen: #EnVivo  | Nosotros aqui acabamos de incorporar a parte de la comunidad ecuatoriana, peruana, colombiana Todos tien..."
1047973922522779649,2018-10-04 22:17:08,"RT @PresidencialVen: #EnVivo  | Nosotros aqui acabamos de incorporar a parte de la comunidad ecuatoriana, peruana, colombiana Todos tien..."
1047973903363133440,2018-10-04 22:17:03,RT @PresidencialVen: #Noticia  | Presidente @NicolasMaduro recordo espiritu revolucionario y patriota del Comandante Chavez https://t.co/i...
1047973881028468736,2018-10-04 22:16:58,"RT @PresidencialVen: #EnVivo  | Yo lo dije en Nueva York hace una semana, la Revolucion Bolivariana es una realidad, es la verdad de Vene..."
1047973852549189632,2018-10-04 22:16:51,RT @PresidencialVen: #Noticia  | Develan en Anzoategui el hito 2 millones 200 mil de la GMVV https://t.co/PNoktvR896 @NicolasMaduro #2Mill...
1047973838066266112,2018-10-04 22:16:48,RT @PresidencialVen: #EnVivo  | Con el Programa de Recuperacion Economica va coincidiendo el alza del petroleo. No debemos depender de es...
1047973806780948480,2018-10-04 22:16:40,"RT @PresidencialVen: #EnVivo  |  En el ano 2014, con el petroleo a 93$ el barril, construimos 126 mil viviendas; en el 2015, se desplomo..."
1047954726258716674,2018-10-04 21:00:51,"#EnVivo  | En el marco de la #GMVV, legado de nuestro Comandante Chavez, hoy alcanzamos el hito... https://t.co/pmBeBKiq8h"
1047919820442947587,2018-10-04 18:42:09,Hoy es un dia historico para el pueblo de Venezuela! Estare entregando el hito #2Millones200MilViviendas Seguimos... https://t.co/yZq0Ni8Wfl
1047881327599636480,2018-10-04 16:09:11,"La Superintendencia Nacional de Criptoactivos cuenta con personal de la mas alta calidad profesional para que ""El P... https://t.co/QIGlpLfscE"
1047860139250860032,2018-10-04 14:45:00,Hace 36 anos fueron torturados y asesinados 23 jovenes revolucionarios del Frente Guerrillero Americo Silva. La Mas... https://t.co/fxlfcYHbC6
1047851967102509057,2018-10-04 14:12:31,"Un dia como hoy en 1917, nacio una de las creadoras y compositoras mas grandes de nuestra America, Violeta Parra. R... https://t.co/pK83vz36A8"
1047823949596434434,2018-10-04 12:21:11,"Recuerdo aquel #04Oct de 2012, cuando el pueblo colmo las calles de Caracas con amor y alegria bajo la lluvia bendi... https://t.co/JSlKzP1PRC"
1047671035775123457,2018-10-04 02:13:34,RT @PresidencialVen: Descarga aqui el historico discurso del Pdte. @NicolasMaduro en la ONU   https://t.co/VkNW54F04F https://t.co/knXRrQ...
1047553649533247489,2018-10-03 18:27:07,"RT @teleSURtv: #Rusia | Presidente Vladimir Putin califico de ""inaceptables"" metodos terroristas aplicados contra #Venezuela

El mandatar..."
1047520624661450754,2018-10-03 16:15:53,"Con la Billetera Digital podras comprar Petro con otras criptomonedas y divisas convertibles. Enterate como, 
aqui... https://t.co/iFr1tNtryb"
1047485728165384192,2018-10-03 13:57:13,"El Plan Nacional Integral de Criptoactivos de Venezuela, permitira que ""El Petro"" se posicione con gran fuerza no s... https://t.co/f9oNtkl5Bg"
1047464082608205825,2018-10-03 12:31:12,"A 226 anos del natalicio del procer hondureno de la emancipacion centroamericana, el Gral. Francisco Morazan, rendi... https://t.co/cz7oJNIuIM"
1047450642913136640,2018-10-03 11:37:48,"Se cumplen 205 anos de la Batalla de Las Trincheras, donde el Ejercito Patriota, al mando del oficial Luciano D El... https://t.co/5Z7XDIURFi"
1047228022187855872,2018-10-02 20:53:11,El Petro es un bastion importante del Programa de Recuperacion Economica para garantizar la proteccion integral de... https://t.co/TMGyip20Qr
1047203234866253824,2018-10-02 19:14:41,"Pondremos en marcha un plan especial de fortalecimiento de las reservas internacionales a traves del Petro, para qu... https://t.co/vvdzOuoH4A"
1047185717879816192,2018-10-02 18:05:05,Bienvenido El Petro! Llego para fortalecer el Programa de Recuperacion Economica y a revolucionar la criptoeconomi... https://t.co/Pqm94fB7em
1047163052196597761,2018-10-02 16:35:01,Dimos inicio al ano escolar 2018-2019 evocando el principio robinsoniano de Aprender-Haciendo. Para el Gobierno B... https://t.co/F4uyJGm0Dk
1047146637922119682,2018-10-02 15:29:48,"Hace 149 anos nacio uno de los grandes pensadores y luchadores por la humanidad, Mahatma Gandhi, Padre de la India.... https://t.co/EN4qiHSo0U"
1047136563002576901,2018-10-02 14:49:46,"A partir del #05Nov, todos los venezolanos y venezolanas podran adquirir Petros con Bs.S. Tendran  acceso a compras... https://t.co/VaJ6Ir5O9n"
1047112875758768128,2018-10-02 13:15:38,"El proximo #29Oct tendremos el primer encuentro de mineros, mineras y especialistas en criptoactivos del mundo, par... https://t.co/BgkcmnTrBM"
1047102363461398529,2018-10-02 12:33:52,Debemos familiarizarnos con lo que sera nuestro futuro economico. Aqui les dejo para su estudio y difusion el nuevo... https://t.co/BEv0hDaYvg
1047093574309949441,2018-10-02 11:58:56,Nacio El Petro! Venezuela se abre camino al futuro iniciando una nueva etapa en la historia economica y monetaria... https://t.co/UumsCQspem
1046968927081910273,2018-10-02 03:43:38,"RT @PartidoPSUV: ""La verdad siempre se impone, la verdad es revolucionaria!"", esto dijo nuestro primer vicepdte. @dcabellor sobre la extra..."
1046968886011281410,2018-10-02 03:43:28,RT @correoorinoco: Presidente @NicolasMaduro resalta incremento de la escolaridad en 7 % en este inicio de clases https://t.co/NkrcU1UmPe...
1046968869590581249,2018-10-02 03:43:24,"RT @PartidoPSUV:  ""El chavismo es una realidad historica, es una identidad que va mas alla de los entendimientos formales... Es una form..."
1046968841505574912,2018-10-02 03:43:18,"RT @tmaniglia: EL PETRO VIENE BLINDADO
El PRESIDENTE @NicolasMaduro incorporo, adenas del petroleo, el respaldo en oro, diamante, hierro y..."
1046934264309329922,2018-10-02 01:25:54,"RT @tmaniglia: NACIO EL PETRO EXISTE!
Y a partir de hoy, como dijo EL PRESIDENTE @NicolasMaduro ""comienza la compra y venta, de acuerdo a..."
1046933628058505216,2018-10-02 01:23:22,RT @vwinstonv: Dia historico para la Patria  el lanzamiento oficial internacional y nacional del PETRO. Garantia de la prosperidad de nue...
1046933606558511105,2018-10-02 01:23:17,RT @PartidoPSUV: PUEBLO A LA CALLE!  Vamos todas y todos a la Gran Marcha por la Paz... Este viernes a partir de las 10.00 de la manana...
1046933558043062272,2018-10-02 01:23:05,"RT @correoorinoco: Presidente @NicolasMaduro activa Plan Nacional de Criptoactivos de Venezuela    https://t.co/OfMIdO5J0G

#PetroNuevaEraE..."
1046932557391171584,2018-10-02 01:19:07,"RT @tmaniglia: AHI ESTA EL DETALLE
@NicolasMaduro Nos han montado en una guerra psicologica y le han hecho creer al mundo que de verdad se..."
1046932495571267585,2018-10-02 01:18:52,RT @VTVcanal8: #Periscope | Pdte. @NicolasMaduro lidera activacion del Petro como moneda digital soberana https://t.co/xKAm1FRCby
1046932415850209280,2018-10-02 01:18:33,RT @PresidencialVen: #Noticia  | Presidente @NicolasMaduro inaugura Superintendencia Nacional de Criptoactivos https://t.co/KAJdmdNrbc htt...
1046932401044303872,2018-10-02 01:18:30,RT @PresidencialVen: #Noticia  | @NicolasMaduro: Desde el 5 de noviembre se podran adquirir Petros con Bolivares Soberanos https://t.co/vd...
1046932379296772096,2018-10-02 01:18:24,"RT @PresidencialVen: #ANUNCIO A partir de hoy entra en vigencia la nueva version del Libro Blanco White Paper- del Petro, en el cual se i..."
1046932348405780481,2018-10-02 01:18:17,RT @PresidencialVen: A partir de hoy entran en funcionamiento todos los mecanismos para que cualquier venezolano pueda adquirir Petros ex...
1046912846137896960,2018-10-02 00:00:47,#EnVivo  | Venezuela hace historia! Hoy damos un paso adelante con el lanzamiento del Petro como moneda nacional... https://t.co/u9xXQrhBBc
1046855716345139200,2018-10-01 20:13:47,Hemos incrementado la escolaridad en un 7% gracias a los esfuerzos inclusivos de nuestro gobierno revolucionario. D... https://t.co/cF4b3tWSXX
1046845855347675136,2018-10-01 19:34:36,Iniciamos el Ano Escolar 2018-2019 con la inauguracion de nuevas instalaciones educativas. La Revolucion Bolivarian... https://t.co/ZLdiZe4qk9
1046835707866746887,2018-10-01 18:54:16,La Agricultura Urbana es una herramienta para lograr la independencia productiva de la Patria desde lo local. Aqui... https://t.co/kv7jBj2PAf
1046798879486857216,2018-10-01 16:27:56,#EnVivo  | Palacio de Miraflores | Arranco el Ano Escolar 2018-2019 en todos los Liceos y Escuelas Tecnicas del Pa... https://t.co/cenPI2i4Ag
1046778580615786497,2018-10-01 15:07:16,"Felicito a los mas de 2 millones de ninos, ninas y adolescentes, que hoy inician el Ano Escolar 2018-2019 en todos... https://t.co/UI3FBdqhRc"
1046759660835999750,2018-10-01 13:52:05,Celebramos el Dia Nacional del Cacao! Decretado por nuestro Comandante Chavez en el ano 2011 como rubro estrategic... https://t.co/oBzoDpeRWs
1046750259999887362,2018-10-01 13:14:44,"Felicitamos a nuestro hermano presidente Xi Jinping y a todo el pueblo chino, al conmemorarse el 69 Aniversario de... https://t.co/CnssshEJDu"
1046733530661826562,2018-10-01 12:08:15,"Hoy se cumplen 4 anos de la siembra de nuestro martir y lider revolucionario Robert Serra y su companera de lucha,... https://t.co/ff6zUsPyZw"
1046551930951127041,2018-10-01 00:06:38,Llevamos en la sangre la fuerza de nuestros libertadores para sobreponernos a las arremetidas y persecuciones imper... https://t.co/8DuJac3Cxv
1046438831535386624,2018-09-30 16:37:13,"Somos millones los patriotas que creemos en Venezuela, tierra de grandes potencialidades que requiere del esfuerzo... https://t.co/79zB4ySv5s"
1046394335133159424,2018-09-30 13:40:25,"En el Dia Internacional del Orgullo Salsero, celebramos el nacimiento de uno de los mejores y mas grandes exponente... https://t.co/sPqR4oYGDI"
1046133505586008064,2018-09-29 20:23:58,La voz del pueblo heroico y digno de Venezuela ha sido escuchada en el 73 Periodo de Sesiones de la Asamblea Gener... https://t.co/7lhoRauoMb
1046073454703898624,2018-09-29 16:25:21,RT @correoorinoco: Lea en linea su #CorreoOrinocoEdicionImpresa de este #29Sep de 2018 #VenezuelaDiplomaciaDePaz https://t.co/7wv8gI5ANs ht...
1046054773978484736,2018-09-29 15:11:07,"Luego de llevar la voz digna de nuestro pueblo a las Naciones Unidas, en la que 193 paises han escuchado nuestra ve... https://t.co/omuxR0qnI0"
1046026286248972289,2018-09-29 13:17:55,"Celebramos el 471o aniversario del natalicio del gran genio de la literatura universal, Miguel de Cervantes Saavedr... https://t.co/E4IgSHCNqx"
1045827034172280832,2018-09-29 00:06:10,"Asi como tenemos valentia, dignidad, entereza y coraje para decir verdades; tambien tenemos una ferrea voluntad de... https://t.co/CoAH50fhIJ"
1045819600963817472,2018-09-28 23:36:37,"Llegamos victoriosos de Nueva York! Nuestro discurso causo gran impacto en el debate de las Naciones Unidas, expre... https://t.co/fsD4LXbrCA"
1045788350026850304,2018-09-28 21:32:27,#EnVivo  | Regresamos victoriosos a nuestra amada Patria. Venezuela se abre camino en el mundo con la verdad. https://t.co/Sj8RUJxQ7K
1045705328908816385,2018-09-28 16:02:33,"Victoria en la ONU, Victoria Total!

En camino al aeropuerto, con destino a mi Patria amada. La verdad de nuestros... https://t.co/Jcca8fL8FF"
1045702727685341184,2018-09-28 15:52:13,"La verdad abre caminos! Ante las intensas agresiones, nosotros hacemos una campana de Paz por Venezuela. Tenemos d... https://t.co/ofOdMI6go6"
1045692650555355138,2018-09-28 15:12:10,"La dictadura pinochetista pretendio extinguir la llamarada del cantor y revolucionario chileno, Victor Jara. A 86 a... https://t.co/nnsoEA048N"
1045647771544551424,2018-09-28 12:13:50,"Gracias al convenio China-Venezuela, se puso en orbita el primer Satelite venezolano de Observacion Terrestre, Fra... https://t.co/mcTbzKlEt2"
1045509472024694784,2018-09-28 03:04:17,"Le expreso a @MBachelet, Alta Comisionada de los Derechos Humanos de la ONU, que las puertas de nuestra Patria esta... https://t.co/o2Zzg0hP7X"
1045497717445849088,2018-09-28 02:17:34,"Sostuve una reunion cordial con el Secretario General de la ONU @AntonioGuterres, donde expuse la verdad de Venezue... https://t.co/EfojnoIXkT"
1045482481514950657,2018-09-28 01:17:02,#EnVivo  | Me dirijo a los pueblos del mundo luego de participar en el 73 Periodo de Sesiones de la Asamblea Gene... https://t.co/2NgP4dOf15
1045448428367609857,2018-09-27 23:01:43,RT @NicolasMaduro: Aterrizando en Nueva York para participar en la Asamblea General de las Naciones Unidas. Traigo la voz de todo mi pueblo...
1045412505366007808,2018-09-27 20:38:58,"No dejen de leer la Edicion N 183 del periodico @CuatroFWeb, con importantes articulos sobre las alianzas China-Ve... https://t.co/BjAFJG7YKA"
1045359177000980480,2018-09-27 17:07:04,"Tengo confianza en el futuro de la humanidad, en el destino de mi Patria, en la #ONU y en los ideales nobles del pu... https://t.co/6KGPVxwJ49"
1045338813638352898,2018-09-27 15:46:09,"He participado en un emotivo acto en la Iglesia Riverside en Harlem, junto a mi hermano presidente Miguel Diaz-Cane... https://t.co/aC1c8CaIPm"
1045329009696010248,2018-09-27 15:07:11,"Desde la honorable Asamblea General de las Naciones Unidas y a pesar de las profundas diferencias sociales, politic... https://t.co/O8eSHsQ29w"
1045319250762764289,2018-09-27 14:28:25,"Solicite al Sistema de Naciones Unidas, nombrar un delegado especial de la Sec. General para que conduzca una inves... https://t.co/7VlvQakWya"
1045314040858386434,2018-09-27 14:07:42,RT @correoorinoco: Lea en linea su #CorreoOrinocoEdicionImpresa de este #27Sep de 2018 #MaduroVozDePuebloDigno https://t.co/XLXhcLUA7z http...
1045310681191522309,2018-09-27 13:54:21,"Venezuela ha sido sometida a una ilegal agresion economica, ideologica, politica y diplomatica. Por que? Por levan... https://t.co/Euo8e6NqEl"
1045292313566752769,2018-09-27 12:41:22,RT @NicolasMaduro: He llevado a la #ONU la voz de un pueblo digno que no se rinde ante las agresiones imperialistas. Somos herederos de Bol...
1045292204103815168,2018-09-27 12:40:56,"RT @NicolasMaduro: Sostuvimos un importante encuentro con el Ministro de Relaciones Exteriores de la Federacion Rusa, Serguei Lavrov. Trajo..."
1045292173263065089,2018-09-27 12:40:49,"RT @NicolasMaduro: He sostenido una calida reunion con nuestro hermano Presidente de la Republica Islamica de Iran, Hasan Rohani. Acordamo..."
1045288260786892802,2018-09-27 12:25:16,He llevado a la #ONU la voz de un pueblo digno que no se rinde ante las agresiones imperialistas. Somos herederos d... https://t.co/YHdAJScC0v
1045096070089453569,2018-09-26 23:41:34,"#EnVivo  | Defendemos con la verdad, la dignidad de Venezuela y compartimos los principios de nuestra Diplomacia B... https://t.co/iHKOaQ332O"
1045084167883624448,2018-09-26 22:54:17,"Sostuvimos un importante encuentro con el Ministro de Relaciones Exteriores de la Federacion Rusa, Serguei Lavrov.... https://t.co/OfX27Hyzw9"
1045081416441241600,2018-09-26 22:43:21,"He sostenido una calida reunion con nuestro hermano Presidente de la Republica Islamica de Iran, Hasan Rohani. Aco... https://t.co/jyqS4y1Nls"
1045005005793701888,2018-09-26 17:39:43,Aterrizando en Nueva York para participar en la Asamblea General de las Naciones Unidas. Traigo la voz de todo mi p... https://t.co/FHTEHGSMdT
1044991619521482753,2018-09-26 16:46:31,La Revolucion Bolivariana protege a nuestros hermanos y hermanas del mundo que han decidido establecerse en nuestro... https://t.co/PLcv75RKYn
1044962366578970627,2018-09-26 14:50:17,"De Colombia, producto del deterioro de la calidad de vida, la droga y la guerra, han emigrado mas de 12 millones de... https://t.co/mKn1HpOVFC"
1044949998885109760,2018-09-26 14:01:08,Los venezolanos somos amorosos con quienes llegan a esta tierra de oportunidades llenos de esperanza. Los invito a... https://t.co/hlmiOUyPJ2
