id,created_at,text1095049461997412354,2019-02-11 19:58:31,"RT @PrensaFANB: || GJ @vladimirpadrino: ""No aceptamos tutelaje de imperio alguno que pretenda poner sus manos en Venezuela. Esta es una ti..."
1095049428992475136,2019-02-11 19:58:23,"RT @tmaniglia: Con Ali Cantamos ""Iremos tocando puertas
hasta llegar
iremos juntando noches
hasta llegar
iremos juntando soles
hasta llegar..."
1095049409367339011,2019-02-11 19:58:18,"RT @teleSURtv: Venezolanos reunen firmas para exigir el cese de la injerencia estadounidense https://t.co/mOC2BhgvB3

Son miles de hombres..."
1095049246938710016,2019-02-11 19:57:40,RT @CancilleriaVE: Desde #Italia el pueblo revolucionario y de paz se solidariza con el pueblo de Venezuela y el presidente constitucional...
1094990445816569887,2019-02-11 16:04:00,"El pueblo consciente y movilizado ha impedido que las constantes agresiones y amenazas, detengan la marcha de Venez... https://t.co/bIDxQ53oBl"
1094975178621227009,2019-02-11 15:03:20,"Estamos demostrando al mundo que nuestra Patria es libre, soberana e inexpugnable. Contamos con un pueblo que esta... https://t.co/JrZRlnnDRs"
1094962630152937472,2019-02-11 14:13:29,La juventud valiente de Venezuela esta consciente de su papel como constructor de la Patria potencia y no se deja d... https://t.co/Urr9utrq6b
1094951956521598976,2019-02-11 13:31:04,Son millones las y los venezolanos que han acudido a todas las Plazas Bolivar de Venezuela a poner su firma para de... https://t.co/yM8cwUly1R
1094936468416618497,2019-02-11 12:29:31,"La Edicion N 197 del periodico @CuatroFWeb, contiene una excelente cobertura informativa de la batalla historica q... https://t.co/YKsHQTP7s9"
1094766432431337473,2019-02-11 01:13:51,"RT @madeleintlSUR: 4. ""Mi Comandante en Jefe permitame hacerle entrega del primer misil disparado por un miliciano como testimonio de la un..."
1094766138028904453,2019-02-11 01:12:41,"RT @aran_tirado: Video grabado el 7 de febrero 2019 en un mercado de Caracas. #Venezuela es un pais maravilloso, lleno de gente amorosa y a..."
1094765572041125890,2019-02-11 01:10:26,"Nuestros 200 anos de lucha permanente por el futuro, nos ha permitido consolidar una poderosa y perfecta union Civi... https://t.co/gxvesWPpBK"
1094759132631105536,2019-02-11 00:44:51,"Orgulloso de la capacidad, logistica y de despliegue de nuestra digna Milicia Nacional Bolivariana. Rumbo a los 2... https://t.co/qD1kXs6vYd"
1094756564668481537,2019-02-11 00:34:39,"Avanzamos en la consolidacion de nuestra nueva Doctrina Militar, la Guerra de Todo el Pueblo, basados en los idea... https://t.co/Sbx4tviG87"
1094753857509429248,2019-02-11 00:23:53,Impecable demostracion que vimos en el Centro de Adiestramiento y Cohesion de la Milicia Nacional Bolivariana del e... https://t.co/fziOX0QH5U
1094752176205905921,2019-02-11 00:17:12,Felicito a nuestros milicianos y milicianas por la extraordinaria preparacion tactica y estrategica demostrada dura... https://t.co/tvXv12Geij
1094750822599147521,2019-02-11 00:11:50,"Nuestros hombres y mujeres de la #FANB, estan altamente entrenados y con maxima moral para defender, de cualquier i... https://t.co/3UXV7gw8rP"
1094749330160922624,2019-02-11 00:05:54,"Leales Siempre, Traidores Nunca! Ese es el grito valiente que se escucha en cada unidad militar de nuestra Patria... https://t.co/qh1KuIGwL4"
1094748360718848007,2019-02-11 00:02:03,"Como muestra de la solidez de la Union CivicoMilitar, recibo de parte de nuestros guerreros y guerreras de la... https://t.co/LGdUj9dbRo"
1094746292977307650,2019-02-10 23:53:50,Felicito al Comando Estrategico Operacional y al Comando de Defensa Aeroespacial Integral por la extraordinaria dem... https://t.co/1lBiwICgyO
1094744913105821696,2019-02-10 23:48:21,"Excelente explicacion de una guerrera, Capitana del Ejercito Libertador, destacada en el Comando de Defensa Aeroesp... https://t.co/PZi7zdPSNA"
1094743188928167936,2019-02-10 23:41:30,"Nuestros oficiales de la #FANB, altamente preparados para la defensa de la Patria, nos explican sobre las capacidad... https://t.co/qecrrJXODu"
1094741968826126338,2019-02-10 23:36:39,"Desde el Fuerte Guaicaipuro en compania del Estado Mayor Superior, iniciamos la Operacion Civico-Militar Bicentena... https://t.co/4le0jZ2TaR"
1094731119906512896,2019-02-10 22:53:32,RT @PresidencialVen: #EnFotos  | Asi dio inicio el jefe de Estado @NicolasMaduro a los Ejercicios Militares  #BicentenarioDeAngostura2019...
1094731089799794688,2019-02-10 22:53:25,"RT @PresidencialVen: #EnVivo  | Debemos prepararnos para defender la soberania, la integridad territorial, la independencia, puntualizo..."
1094731069495099398,2019-02-10 22:53:20,RT @PresidencialVen: #EnVivo  | Estos son los ejercicios militares mas importantes de la historia porque estamos moviendo a miles de homb...
1094731055855271938,2019-02-10 22:53:17,"RT @PresidencialVen: #EnVivo  | El pueblo esta de pie, armado de conciencia, armado para la defensa Asi debemos continuar!, manifesto e..."
1094730951723237376,2019-02-10 22:52:52,"RT @PresidencialVen: #EnVivo  | Este es el ejercito del Libertador Simon Bolivar otra vez haciendo historia, asevero el conductor de vic..."
1094730934224650241,2019-02-10 22:52:48,"RT @PresidencialVen: #EnVivo  | Lo unico que quiere Venezuela es paz, respeto, futuro, prosperidad, para eso luchamos, para eso trabajamo..."
1094730908211576834,2019-02-10 22:52:42,"RT @PresidencialVen: #EnVivo  | Llamo a todo el pueblo de Venezuela: A la mujer, a la juventud, a los hombres, a incorporarse a este plan..."
1094710697198567425,2019-02-10 21:32:23,"#EnVivo  | Junto al Estado Mayor Superior y personal militar de la #FANB, damos inicio a la Operacion Civico-Milit... https://t.co/Wxd8ajTCAh"
1094688156304191489,2019-02-10 20:02:49,"#EnVivo  | Llegamos al Fuerte Guaicaipuro, en el estado Miranda, para dar inicio a los Ejercicios Militares enmarc... https://t.co/tiurDVuXoP"
1094648867348537344,2019-02-10 17:26:42,"RT @PartidoPSUV: VENEZUELA, UN PUEBLO QUE NO SE RINDE... UN PUEBLO QUE APUESTA A LA PAZ! 

La edicion No142 de nuestro #BoletinInformati..."
1094648720828915712,2019-02-10 17:26:07,"RT @tmaniglia: Llegan de todas partes 
A donde? A la Plaza Bolivar de Caracas 
Por que? Porque saben que su firma tiene un valor protagon..."
1094625471038410753,2019-02-10 15:53:44,"No se pierdan la Edicion N 142 del Boletin Informativo de nuestro @PartidoPSUV, que nos comparte una clara interpr... https://t.co/n9tgDiNpdZ"
1094598601630773248,2019-02-10 14:06:57,Extraordinaria movilizacion del pueblo de Barcelona en rechazo a la injerencia imperial. Una contundente demostraci... https://t.co/Rdpkk28Y6A
1094564305507418112,2019-02-10 11:50:41,"Hace 192 anos nacio el pintor, Martin Tovar y Tovar. Reconocido por el pueblo venezolano por retratar en numerosas... https://t.co/9cgnVszizY"
1094364307297615872,2019-02-09 22:35:57,RT @PartidoPSUV: Omar Prieto encabezo multitudinaria marcha en el municipio Rosario de Perija en respaldo al presidente Nicolas Maduro http...
1094363698234306565,2019-02-09 22:33:32,RT @RamonLoboMoreno: #VenezuelaFirmaContraLaGuerra y  marcha en El Vigia en apoyo al Pdte @NicolasMaduro con la fuerza y pasion que caracte...
1094316586897428481,2019-02-09 19:26:20,"RT @PartidoPSUV: Y si nos preguntan Donde estabamos hoy? Pues... 

En el oriente del pais, gracias a nuestro noble y hermoso pueblo de Ba..."
1094316242062716929,2019-02-09 19:24:58,RT @alfreserramanci: Informe CELAG demuestra que bloqueo economico-financiero internacional a Venezuela ha supuesto la perdida de 350.000 m...
1094316111590502400,2019-02-09 19:24:27,"RT @FreddyBernal: #SomosUnaFronteraDePaz
No permitiremos, bajo ninguna circunstancia, que ningun imperio, que ningun rumor mediatico, que n..."
1094308747013509120,2019-02-09 18:55:11,RT @VTVcanal8: #VIDEO | Se viola la Carta de las Naciones Unidas que proscribe el uso de la amenaza para atentar o agredir a otro pais; a e...
1094308707427590145,2019-02-09 18:55:01,RT @SputnikMundo: Ayuda humanitaria? El gesto de @realDonaldTrump en Puerto Rico que las redes no olvidan https://t.co/gHEJiMHe6A
1094308548400607233,2019-02-09 18:54:23,"RT @SputnikMundo: Delcy Rodriguez: EEUU busca invadir a #Venezuela escudandose en ayuda humanitaria https://t.co/Z7NlinvEPH
#AyudaHumanitar..."
1094308523234811904,2019-02-09 18:54:17,"RT @HectoRodriguez: Venezuela no quiere invasion, ni golpe de estado, ni guerra civil, queremos dialogo, soberania, democracia y trabajo pa..."
1094308308545085440,2019-02-09 18:53:26,"RT @Marco_Teruggi: Desde el puente internacional Simon Bolivar, frontera con Cucuta, Colombia. Asi esta la realidad en este lugar del que t..."
1094307861704912896,2019-02-09 18:51:40,RT @PresidencialVen: El pueblo venezolano defendera por siempre nuestra libertad e independencia. Jamas nos someteremos a imperio alguno!...
1094307809364242433,2019-02-09 18:51:27,"RT @KatuArkonada: Manifestacion de los chalecos amarillos en Francia portando la bandera venezolana.

Que lindo el internacionalismo entre..."
1094307568745414656,2019-02-09 18:50:30,"RT @VTVcanal8: #VIDEO | Quien esta gobernando ahorita? Nicolas Maduro y, con Maduro, el pueblo. No nos desesperemos! Mano segura no se tr..."
1094290553292967938,2019-02-09 17:42:53,"Ante las sistematicas agresiones, mentiras y manipulaciones contra Venezuela, hemos logrado mantener la paz y el re... https://t.co/VzhGHh9pyy"
1094269798811344896,2019-02-09 16:20:25,Nuestra #FANB esta movilizada y en permanente preparacion para la defensa del legado historico de los Libertadores... https://t.co/D9NSFQetoU
1094252992155566080,2019-02-09 15:13:38,"Se ha despertado un profundo sentimiento patriota en el pueblo, que se ha volcado a las calles en defensa de la sob... https://t.co/Ei5qrCKgi0"
1094234744399765505,2019-02-09 14:01:07,La familia del @IVIC_oficial cumple 60 anos de arduo trabajo investigativo en el campo cientifico. Enviamos un abra... https://t.co/kOX3LTNywo
1093992315516059653,2019-02-08 21:57:48,Reitero el llamado a la oposicion venezolana para que actuen con sensatez y cordura. El camino de la locura que han... https://t.co/idRu2rKMop
1093983289952604165,2019-02-08 21:21:56,La Ayuda Humanitaria es un show para humillarnos y pretende justificar una agresion militar; un plan macabro que... https://t.co/c4yc7NKadp
1093975808136413185,2019-02-08 20:52:12,"Venezuela se encuentra en defensa permanente de la democracia, la soberania y su derecho a la Paz, en medio de una... https://t.co/KhZialQ99U"
1093913566590181383,2019-02-08 16:44:52,#EnVivo  | Continuamos desde el Palacio de Miraflores con la Rueda de Prensa con Medios de Comunicacion Nacionales... https://t.co/SHkCK0ZYMD
1093902217587900417,2019-02-08 15:59:47,#EnVivo  | Rueda de Prensa con Medios de Comunicacion Nacionales e Internacionales para defender la verdad y el de... https://t.co/H6QPkIKya3
1093894352890486784,2019-02-08 15:28:31,"Como Presidente Constitucional de Venezuela y primer garante de la paz, convoque al pueblo venezolano a firmar por... https://t.co/U4TXS3qtdq"
1093877418211852289,2019-02-08 14:21:14,"Venezuela es una tierra de gente solidaria, noble, trabajadora y con capacidad de salir adelante con el esfuerzo pr... https://t.co/jIz9mojOxl"
1093857573508468736,2019-02-08 13:02:23,Agradezco al pueblo de los estados Guarico y Aragua por las inmensas concentraciones en respaldo a la Soberania y l... https://t.co/eT61RI7dNs
1093842373476581376,2019-02-08 12:01:59,Felicito al Movimiento Corazon Salsero por sus dos anos llenando de alegria a los barrios y comunidades de Venezu... https://t.co/iRf7RYVBXK
1093709755879702530,2019-02-08 03:15:00,"RT @laradiodelsur: Marea Roja en Guarico apoya al presidente legitimo Nicolas Maduro Moros 
https://t.co/9pnQQe7gP3"
1093709672396320768,2019-02-08 03:14:40,"RT @ConElMazoDando: Escualidos, a modo de informacion general: Medio Guariney en Aragua!!! #VenezuelaFirmaPorLaPaz https://t.co/Q3oPRx2sw1"
1093709439390101505,2019-02-08 03:13:45,"RT @telesurenglish: #Venezuela | President @NicolasMaduro repeated that Venezuelans were ""warriors for peace"" and will come out undefeated..."
1093688827275825153,2019-02-08 01:51:50,"RT @ConCiliaFlores: Hoy firmamos por la Paz y todos los dias la defendemos desde todos los espacios, con amor, paciencia y determinacion, c..."
1093687568351272960,2019-02-08 01:46:50,"Invito al pueblo de Venezuela y a los movimientos sociales, artistas, sindicatos, deportistas e intelectuales del m... https://t.co/DFlkAneL2w"
1093681593875660801,2019-02-08 01:23:06,"Comparto la Carta Abierta al Pueblo de los EE.UU., que esta siendo firmada por el pueblo libre de Venezuela y el... https://t.co/2Mss62mTQF"
1093673993234800645,2019-02-08 00:52:54,Firmamos por la paz y por el respeto a la autodeterminacion de los millones de hombres y mujeres de esta tierra her... https://t.co/hOdd3sqWqk
1093642061700567042,2019-02-07 22:46:01,RT @VTVcanal8: #EnFotos  | Asi firmo el Pdte. @NicolasMaduro la carta a favor de la paz de Venezuela y en contra de las amenazas imperiale...
1093641478432325633,2019-02-07 22:43:41,"RT @VTVcanal8: #EnDirecto | Primer Vicepdte. PSUV @dcabellor: Hoy el autoproclamado pide una guerra civil en Venezuela, sin ni siquiera sa..."
1093641067960983553,2019-02-07 22:42:04,"RT @josemvasquez: GUARICO LEALES SIEMPRE!

Queremos Paz y el pueblo en la calle lo demostro, asi como el apoyo incondicional al presidente..."
1093640837756538883,2019-02-07 22:41:09,"RT @PresidencialVen: #EnVivo  | Acabo de firmar por la paz, la soberania sagrada de Venezuela, en apoyo al derecho a la independencia y a..."
1093640749370036224,2019-02-07 22:40:48,RT @PresidencialVen: #EnVivo  | Hoy Venezuela esta unida en un solo clamor: exigimos el cese de la agresion que busca asfixiar nuestra ec...
1093640684446384129,2019-02-07 22:40:32,"RT @evoespueblo: En reunion en Uruguay, apoyamos y nos sumamos al Mecanismo de Montevideo, impulsado por #Mexico, #Uruguay y CARICOM para p..."
1093640611905851392,2019-02-07 22:40:15,RT @PresidencialVen: #EnVivo  | Le digo al pueblo de Estados Unidos: Vuestros representantes de Washington quieren traer a sus fronteras...
1093640552145477632,2019-02-07 22:40:01,RT @PresidencialVen: #EnVivo  | El presidente Donald Trump pretende ademas perturbar nobles iniciativas de dialogo impulsadas por Uruguay...
1093640541504499714,2019-02-07 22:39:58,RT @PresidencialVen: #EnVivo  | Apelamos al alma buena de la sociedad estadounidense para que se unan a nuestro llamado por la paz. Seamo...
1093630740754038787,2019-02-07 22:01:01,"#EnVivo  | Llegamos a la Plaza Bolivar de Caracas, para participar en la Jornada de Solidaridad y de Despertar de... https://t.co/tuACiU2CzT"
1093534146876588032,2019-02-07 15:37:12,"Vamos a recuperar y a mejorar toda la capacidad productiva de la industria farmaceutica, y nos ponemos como meta pa... https://t.co/H4OYXcq00G"
1093514810728345602,2019-02-07 14:20:22,"En el escenario que nos toque batallar, asumiremos nuestra lucha con la union Civico-Militar, por nuestro derecho i... https://t.co/xbl7hR7WUz"
1093497733225349121,2019-02-07 13:12:30,"Saludo la reunion que sostuvieron los 14 paises del CARICOM, Mexico, Bolivia y Uruguay, en Montevideo. Suscribimos... https://t.co/7ceBt8nAea"
1093480440575524864,2019-02-07 12:03:47,"Se cumplen 57 anos del criminal e inmoral #Bloqueo contra la hermana Republica de Cuba, por parte del imperio estad... https://t.co/h7Pu8Uj5LD"
1093360843968917510,2019-02-07 04:08:33,Aprobe recursos por mas de Bs.S 15.400 millones para la recuperacion de 9 Centros de Rehabilitacion Integral del es... https://t.co/nZMXfPBVmX
1093356733546876928,2019-02-07 03:52:13,"En el marco de nuestro Plan Permanente de atencion al sector Salud, creamos el Centro Nacional de Electromedicina,... https://t.co/vpRoEW7kCX"
1093351736113352704,2019-02-07 03:32:22,"En nuestra visita al estado Zulia, supervisamos la Planta de Medicamentos SM PHARMA C.A., que posee la capacidad pa... https://t.co/4iIWLQun0l"
1093346105859936257,2019-02-07 03:09:59,"El honor y la dignidad del Pais, esta en el uniforme y las armas que portan nuestros dignos soldados y soldadas de... https://t.co/vMtJg4N3fE"
1093339561751662592,2019-02-07 02:43:59,"Lo que se respira y se siente en las 8 Regiones de Defensa Integral de nuestra Patria, es la alta Moral y espiritu... https://t.co/3dhGqA1NDR"
1093328774916128768,2019-02-07 02:01:07,Agradezco al pueblo que ha acudido multitudinariamente a las Plazas Bolivar de Venezuela para firmar por la Paz y e... https://t.co/Lrh43eOr1s
1093301053490188288,2019-02-07 00:10:58,"Soy un soldado mas de nuestra digna #FANB, dispuesto a dar mi vida, si fuese necesario, para defender cada palmo de... https://t.co/gKobjWxiQr"
1093298064855576577,2019-02-06 23:59:05,"En compania del Estado Mayor Superior de la #FANB, presenciamos la activacion del Plan de Defensa y Evacuacion de M... https://t.co/nDJ12GZqXy"
1093296386479714304,2019-02-06 23:52:25,"Los dignos pilotos de nuestra @AviacionFANB, nos dieron la bienvenida en la Base Aerea GJ. Rafael Urdaneta, en el e... https://t.co/DJKTVX9bYD"
1093296363910189057,2019-02-06 23:52:20,"RT @PresidencialVen: #EnVivo  | Tenemos que sembrar conciencia y valores, un pueblo con conciencia y valores es capaz de dar cualquier ba..."
1093293879170879490,2019-02-06 23:42:27,"RT @teleSURtv: #Mexico y #Uruguay presentan mecanismo de dialogo para #Venezuela  https://t.co/GeNqfkV8wZ

La propuesta de dialogo p..."
1093293857603796993,2019-02-06 23:42:22,"RT @teleSURtv: #Venezuela |Recolectan firmas contra injerencia de #EEUU  https://t.co/dZx7qpmTts

La jornada se extendera durante esta..."
1093293801089744898,2019-02-06 23:42:09,RT @PresidencialVen: #EnVivo  | Barrio Adentro es la operacion humanitaria mas grande que se conozca en el mundo entero por la cantidad d...
1093292515887849472,2019-02-06 23:37:02,"RT @VTVcanal8: #EnDirecto | Pdte. @NicolasMaduro: He decido crear el Centro Nacional de Electro Medicina, organismo que estara adscrito a..."
1093292436464508928,2019-02-06 23:36:43,RT @PresidencialVen: #EnVivo  | La Revolucion sigue mas viva que nunca cuando avanzamos en el desarrollo de salud para el bienestar del p...
1093280996068376576,2019-02-06 22:51:16,"#EnVivo  | En el marco de nuestro Plan Permanente para el sector salud, visitamos la Planta de Medicamentos SM PHA... https://t.co/1D4WqdlaNd"
1093268944104898562,2019-02-06 22:03:22,"#EnVivo  | Llegamos a la Base Aerea GJ. Rafael Urdaneta, acompanado por el Estado Mayor Superior de la #FANB, para... https://t.co/e68NUyvQD6"
1093176790384816128,2019-02-06 15:57:11,"Pido al sector transporte mayor esfuerzo, en el marco de la Gran Mision Transporte Venezuela, para atender las nece... https://t.co/HHLwZTYZGD"
1093166582296203265,2019-02-06 15:16:37,"Comparto los 7 vertices de la Gran Mision Transporte Venezuela, que propiciaran la transformacion integral de todo... https://t.co/zyFKvbbSmb"
1093146324340477952,2019-02-06 13:56:08,"Se cumplen 103 anos de la siembra del gran poeta nicaraguense Ruben Dario, hijo insigne de nuestra America; lidero... https://t.co/PCr5tCSLWK"
1093138033807896576,2019-02-06 13:23:11,"Nos unimos a la celebracion que embarga al hermano pueblo de Cuba, en el 87o aniversario del natalicio del Heroe de... https://t.co/3BeWDw8itO"
1093128863285166080,2019-02-06 12:46:45,"A 90 anos del natalicio del revolucionario Fabricio Ojeda, honramos su lucha por la soberania y la democracia; hono... https://t.co/gnzQNchB1o"
1092977938449006592,2019-02-06 02:47:01,"RT @teleSURtv: El presidente de #Venezuela, @NicolasMaduro, alzo su voz ante los medios internacionales para contrarrestar la arremetida..."
1092976402406801408,2019-02-06 02:40:55,RT @jaarreaza: Here is the truth #TrumpLies https://t.co/dQfagikwh8
1092976383729561603,2019-02-06 02:40:51,"RT @jaarreaza: Mas de 2.737 nin@s separados arbitrariamente de sus padres en la frontera de EEUU entre junio de 2017 y noviembre de 2018, s..."
1092976376125276160,2019-02-06 02:40:49,RT @jaarreaza: 32 millones de personas en EEUU aun no posee seguro medico. Mas del 40% de estadounidenses se ha endeudado debido a problema...
1092965543684976640,2019-02-06 01:57:46,Firme los Decretos para la creacion de la Universidad Nacional Experimental del Transporte y la creacion de la Fund... https://t.co/trY195voZS
1092957418395291648,2019-02-06 01:25:29,"En el marco del lanzamiento de la Gran Mision Transporte Venezuela, hicimos la botadura de la primera de 15 embarca... https://t.co/CJFjR41BIS"
1092951770245021701,2019-02-06 01:03:02,"Pese a la agresion del imperio de los EE.UU. contra nuestra Patria, hemos lanzado la Gran Mision Transporte Venezue... https://t.co/u51hn4gi6l"
1092909751632101376,2019-02-05 22:16:04,"#EnVivo  | Lanzamiento de la Gran Mision Transporte Venezuela, en el marco del Programa de Recuperacion Economica,... https://t.co/gW6fD0DUX0"
1092834987546681344,2019-02-05 17:18:59,"En estos momentos de agresion contra Venezuela, agradezco la solidaridad y el respaldo de los pueblos y movimientos... https://t.co/fBsJwMGVXC"
1092797696769970176,2019-02-05 14:50:48,"Los patriotas estamos de pie y en union Civico-Militar, alzando las banderas del respeto a la dignidad y el honor d... https://t.co/ILbVw1wgcj"
1092768410306572288,2019-02-05 12:54:26,"La Patria Grande recuerda los 52 anos del paso a la eternidad de la cantora popular, Violeta Parra. Creadora extrao... https://t.co/h81VO4Aims"
1092753108881604609,2019-02-05 11:53:38,"Desde Venezuela saludamos a nuestros hermanos de la Republica Popular China y al Presidente Xi Jinping, deseando qu... https://t.co/7baH3B7jlw"
1092636758792126475,2019-02-05 04:11:18,"El proximo #6Feb iniciaremos una Jornada nacional de solidaridad y conciencia, en la que vamos a recolectar, por lo... https://t.co/MPJWeOoPeS"
1092631244960157698,2019-02-05 03:49:23,"La locura imperial que se ha desatado contra Venezuela, hasta el punto de amenazar con el uso de la fuerza militar,... https://t.co/hNGugMUk6r"
1092625817778221057,2019-02-05 03:27:49,"Pido a nuestras amigas y amigos del mundo, levantar un poderoso movimiento internacional de solidaridad con Venezue... https://t.co/q0dT11L0lo"
1092574772041576450,2019-02-05 00:04:59,"#EnVivo  | Llegamos a la Casa Amarilla, para participar en un importante encuentro con movimientos, lideres e inte... https://t.co/qVDdk4RQv2"
1092508994420248576,2019-02-04 19:43:36,"En la Base Aerea El Libertador, fuimos recibidos por nuestros Guardianes del Aire con la Cancion del Piloto. Junt... https://t.co/A6HX29AhMc"
1092497399942180865,2019-02-04 18:57:32,"Hago un llamado a los gobiernos dignos e independientes del mundo, para que manifiesten su rechazo a las virulentas... https://t.co/oVrIO9B0z6"
1092491067574898693,2019-02-04 18:32:22,"Vamos a una gran jornada de recoleccion de firmas en todas las plazas Bolivar, cuarteles y fabricas del pais, para... https://t.co/Ag5ez9HGVC"
1092478421979095043,2019-02-04 17:42:07,"En los hombres y mujeres de la 42 Brigada de Infanteria Paracaidista, donde nuestro Comandante Chavez puso en march... https://t.co/SILjGScZgU"
1092470374988685313,2019-02-04 17:10:09,"Asi fue la bienvenida en el Cuartel GJ. Jose Antonio Paez, alli se siente mas vivo que nunca, el espiritu y la fort... https://t.co/YYRnDyP34K"
1092464184019877888,2019-02-04 16:45:33,"El saludo y las demostraciones de afecto, compromiso y apoyo del pueblo rebelde del estado Aragua, nos fortalece. https://t.co/NYCu6izsdh"
1092457053648572416,2019-02-04 16:17:13,"La historia que comenzo hace 27 anos, continua en rebelion contra el imperialismo. Viva la Union CivicoMilitar!... https://t.co/QDIPkuupYG"
1092451939122589697,2019-02-04 15:56:53,"Marchamos con el pueblo y la #FANB para celebrar los 27 anos de la Rebelion Militar que cambio para siempre, la his... https://t.co/0H9T1pRwZl"
1092446507645710337,2019-02-04 15:35:18,"Marchamos por las calles de la historica Maracay, donde comenzo la Revolucion Bolivariana. Seguiremos por siempre e... https://t.co/hkmHZoLrpb"
1092445776100372482,2019-02-04 15:32:24,"La batalla que hoy esta librando Venezuela, es ejemplo para los pueblos que luchan por su autodeterminacion. Lee so... https://t.co/fktSccACSK"
1092437319418814464,2019-02-04 14:58:48,"Hombres y Mujeres del mar, me enorgullece la capacidad profesional, operativa y de despliegue que tiene nuestra... https://t.co/lZCrs1eNch"
1092417841574367232,2019-02-04 13:41:24,"Celebramos 27 anos del Por ahora que cambio la historia de la Patria, gracias a nuestro Comandante Chavez y a los... https://t.co/nqCKxFElRE"
1092409253510463489,2019-02-04 13:07:16,"Me uno a la conmemoracion del Dia Mundial contra el Cancer y les envio un abrazo lleno de mucha fuerza, a los hombr... https://t.co/GB0jyx1lLr"
1092388427251761157,2019-02-04 11:44:31,"#EnVivo  | Junto al Estado Mayor Superior de la #FANB y el personal militar acantonado en la ZODI Aragua, celebram... https://t.co/gFKCRJqI85"
1092250462076706816,2019-02-04 02:36:17,"Estamos dando una batalla historica por preservar la independencia nacional, sin retroceder un milimetro en el trab... https://t.co/4IxmdN1woi"
1092198782593368064,2019-02-03 23:10:56,"El futuro de la Patria se decide hoy, o dejamos que nos conviertan en una estrella de la bandera imperial, o defend... https://t.co/L4qHrptkU2"
1092194913092100097,2019-02-03 22:55:33,"Impecables ejercicios navales de nuestros hombres y mujeres, Comandos del Mar, que con gran profesionalismo, maxima... https://t.co/sVf7NzAbKy"
1092189478389727232,2019-02-03 22:33:58,"La misma oligarquia que dio aquel golpe de Estado en el 2002, hoy pretende entregar la Patria al imperialismo norte... https://t.co/83e029Buzy"
