id,created_at,text1071962311441702913,2018-12-10 02:58:25,Felicito a las concejalas y concejales electos en la maravillosa jornada electoral de este #9Dic. Los invito a pone... https://t.co/c01pRQ6UqO
1071943672105713664,2018-12-10 01:44:21,"RT @tmaniglia: El PRESIDENTE @NicolasMaduro y la Primera Combatiente @ConCiliaFlores en la eleccion N 25 de la Revolucion Bolivariana
#YoV..."
1071943480623161345,2018-12-10 01:43:36,RT @VTVcanal8: #Video | Pdte. @NicolasMaduro denuncia nuevo intento de golpe de Estado por parte de la Casa Blanca contra la democracia ve...
1071896810128592896,2018-12-09 22:38:09,"Felicito a los hombres y mujeres del CNE y la FANB, por la extraordinaria organizacion de esta nueva eleccion en Re... https://t.co/c1dvvYOJtt"
1071887838118117376,2018-12-09 22:02:29,"Venezuela establece un nuevo record en libertades politicas, al celebrar la eleccion numero 25 en 20 anos de Revolu... https://t.co/pylhhBScF9"
1071850367758057475,2018-12-09 19:33:36,"#EnVivo  | Todas y todos estamos llamados a salir a votar para fortalecer nuestra democracia. #YoVotoPorLaPatria
https://t.co/iXmHtqj5dp"
1071804375050477569,2018-12-09 16:30:50,Nuestro Comandante Hugo Chavez sento las bases de la democracia participativa y protagonica; 24 procesos electorale... https://t.co/v0CcEWOBil
1071754442297536512,2018-12-09 13:12:25,"Desde muy temprano, nuestro pueblo ha salido a las calles para participar en el proceso electoral de concejales y c... https://t.co/446pDbeWR5"
1071745508937482240,2018-12-09 12:36:56,"Hace 194 anos el Ejercito Libertador del Sur, al mando del Gran Mariscal, Antonio Jose de Sucre, logro la libertad... https://t.co/Z6kaSMI7bW"
1071479826089951232,2018-12-08 19:01:12,"Gracias hermano @evoespueblo por recordar siempre al Cmdte. Chavez, y por compartir la lucha para hacer realidad su... https://t.co/cvfajislBa"
1071476378187563013,2018-12-08 18:47:30,"RT @DiazCanelB: ""Un sueno que suenas solo, es solo un sueno. Un sueno que suenas con alguien mas, es una realidad"", dijo John Lennon. Desde..."
1071471464908505089,2018-12-08 18:27:58,Finalizamos un ano exitoso en la configuracion de la geopolitica mundial de nuestra Patria. Venezuela abre sus puer... https://t.co/fYz6ZDEqUb
1071435947173183488,2018-12-08 16:06:50,"Se cumplen 131 anos del natalicio del mirandino que se convirtio en un referente latinoamericano de la musica, Vice... https://t.co/WCpBkDUiEf"
1071422968448856064,2018-12-08 15:15:16,"La Patria venezolana conmemora el Dia de Guaicaipuro y de los Caciques de la Resistencia, como un homenaje a los ho... https://t.co/gVS7xOGNnP"
1071400605686661120,2018-12-08 13:46:24,"Dia de la Lealtad y el Amor a Chavez y a la Patria! Aqui estoy 6 anos despues, cumpliendo la mision que me encomen... https://t.co/M3413VPdj5"
1071162143725289478,2018-12-07 21:58:50,"El acuerdo de Viena que reduce la produccion petrolera en 1,2 millones de barriles diarios, y que mantiene la alian... https://t.co/TB1L9u8NsJ"
1071146670849736712,2018-12-07 20:57:21,"#EnVivo  | Llegamos victoriosos de nuestra productiva visita a la Federacion de Rusia, para continuar la agenda de... https://t.co/MctQnxBzYM"
1071132998744137731,2018-12-07 20:03:02,"La Edicion N191 del @CuatroFWeb, nos convoca a asistir, masivamente, el proximo #09Dic, a las elecciones municipal... https://t.co/PqkJSFtc8W"
1071112983399596033,2018-12-07 18:43:30,"Me uno al luto que embarga a la familia del beisbol venezolano y toda su fanaticada, por la partida fisica de Luis... https://t.co/qXiRz4RwQQ"
1071089438271438848,2018-12-07 17:09:56,Venezuela consolida su amistad con el Presidente Putin y fortalece la alianza integral con Rusia para cerrar con ex... https://t.co/oiTbEvrjhV
1071064779656192000,2018-12-07 15:31:57,"En el marco de la Defensa y Seguridad Nacional, durante nuestra visita a Rusia, firmamos diversos contratos para la... https://t.co/pdg1Ct4l0C"
1071030242448433152,2018-12-07 13:14:43,"En marzo de 2019 se desarrollara la reunion de la Comision Mixta RusiaVenezuela, un encuentro de alto nivel en Mos... https://t.co/ombw0VZxXE"
1071016745878609921,2018-12-07 12:21:05,"Hace 227 anos, nacio en Caracas, uno de los militares mas destacados de nuestra historia independentista, Ambrosio... https://t.co/sREo66PemB"
1070818532563263488,2018-12-06 23:13:27,"Lee, discute y comparte la Edicion Especial del periodico @CuatroFWeb, que rememora los 20 anos del triunfo de nues... https://t.co/RMXIYsdcqj"
1070786464219348993,2018-12-06 21:06:01,"Exitosa jornada de trabajo que concluye con la firma de diversos contratos por mas de 6.000 millones de dolares, pa... https://t.co/GMr39ioB0Q"
1070760422947598338,2018-12-06 19:22:33,"Junto a Rusia, levantamos las banderas por la construccion de un mundo pluripolar y multicentrico. La cooperacion b... https://t.co/8yAebs1Pl0"
1070743738253750272,2018-12-06 18:16:15,"Desde la primera visita del Comandante Chavez a Rusia, siempre hemos contado con el pueblo y el gobierno ruso. En n... https://t.co/bDiSxeCEsH"
1070709988719558657,2018-12-06 16:02:08,"#EnVivo  | Luego de haber culminado la agenda de trabajo con nuestros hermanos de la Federacion de Rusia, ofrecemo... https://t.co/pPX7ICCAXm"
1070693621442244608,2018-12-06 14:57:06,"Al finalizar la exitosa agenda de trabajo con nuestros hermanos de la Federacion de Rusia, realizamos un balance, m... https://t.co/w7TiUgAaFA"
1070689881985306630,2018-12-06 14:42:14,"El Presidente Vladimir Putin me manifesto su respaldo en la busqueda de mecanismos para superar las dificultades, e... https://t.co/d70QTRFXct"
1070667814644736001,2018-12-06 13:14:33,"Los Diablos Danzantes de Corpus Christi fueron declarados Patrimonio Inmaterial de la Humanidad, por la @UNESCO, ha... https://t.co/VeNS4Maam6"
1070643973780357121,2018-12-06 11:39:49,"Un dia como hoy, comenzo a escribirse la nueva historia de nuestro pais; un gigante llamado Hugo Chavez, desperto l... https://t.co/pqqb7FZ9To"
1070440485355966465,2018-12-05 22:11:14,El Petro se fortalece como un solido instrumento de intercambio financiero para consolidar nuestra independencia ec... https://t.co/BOzq8F2euH
1070440252811157504,2018-12-05 22:10:18,"RT @CancilleriaVE: #FOTOS | Pdte.@NicolasMaduro afianza los lazos de cooperacion y amistad entre Venezuela y Rusia, tras su encuentro con e..."
1070440151451611136,2018-12-05 22:09:54,"RT @DrodriguezVen: Pdte de Rusia, Vladimir Putin, recibe al Pdte @NicolasMaduro en su visita a esta hermana Nacion. Rusia y Venezuela segui..."
1070410058092175360,2018-12-05 20:10:19,"Luego de un exitoso primer encuentro con el Presidente Vladimir Putin, caminamos por las calles de Moscu. Manana co... https://t.co/KLtVbTse6u"
1070369878618468352,2018-12-05 17:30:40,"La Revolucion Economica llego con nuestra criptomoneda el Petro, para romper el cerco economico impuesto por el imp... https://t.co/KHuHYvWpxc"
1070355386748817410,2018-12-05 16:33:05,"RT @VTVcanal8: #ULTIMOMINUTO | Ahora se desarrolla un encuentro entre el Pdte. de la Federacion de Rusia , Vladimir Putin y el Pdte. de l..."
1070354205758644225,2018-12-05 16:28:23,"RT @CancilleriaVE: #AHORA | Pdte.@NicolasMaduro es recibido por su homologo de la Federacion de Rusia, Vladimir Putin para evaluar y fortal..."
1070354180223762432,2018-12-05 16:28:17,"RT @PresidencialVen: #EnDesarrollo | Encuentro entre el Presidente de la Federacion de Rusia, Vladimir Putin y el Presidente de la Republic..."
1070354075072503808,2018-12-05 16:27:52,"RT @teleSURtv: #ULTIMOMINUTO | Presidente de #Venezuela, @NicolasMaduro, es recibido por su homologo ruso, Vladimir Putin, para revisar a..."
1070354028608045056,2018-12-05 16:27:41,RT @PresidencialVen: #Video | Asi fue el encuentro entre el Pdte. @NicolasMaduro y su homologo ruso Vladimir Putin en Moscu https://t.co/LJ...
1070351487673483264,2018-12-05 16:17:35,"Inicia nuestra jornada de trabajo en la Federacion de Rusia con el Presidente Vladimir Putin, para revisar diversos... https://t.co/AdRolAJLOe"
1070334015729819648,2018-12-05 15:08:09,"#EnVivo  | Reunion de trabajo con el Presidente de la Federacion de Rusia, Vladimir Putin, para revisar diversos t... https://t.co/ALpofBcB2v"
1070297172887957504,2018-12-05 12:41:45,"Se cumplen 205 anos de la Batalla de Araure, enfrentamiento que tuvo lugar en las sabanas del estado Portuguesa. Do... https://t.co/qMRzOL8xZX"
1070287275156738049,2018-12-05 12:02:26,"Recordamos al gran lider sudafricano, que hace 5 anos se sembro en el corazon de millones de personas en el mundo.... https://t.co/k353E9vcIW"
1070096167009247232,2018-12-04 23:23:02,RT @correoorinoco: Jefe de Estado @NicolasMaduro llega a Rusia para cumplir agenda de trabajo con el presidente Vladimir Putin. https://t.c...
1070096057101623298,2018-12-04 23:22:36,RT @PresidencialVen: #Noticia | Presidente @NicolasMaduro arriba a Rusia para cumplir agenda de trabajo bilateral https://t.co/gwEMvULTfh h...
1070096033512853505,2018-12-04 23:22:30,"RT @PresidencialVen: #Video | Asi fue la llegada del Pdte. @NicolasMaduro a la capital rusa, Moscu, donde sostendra agenda de trabajo bilat..."
1070053989729865729,2018-12-04 20:35:26,"RT @teleSURtv: Presidente de #Venezuela, @NicolasMaduro llega a #Rusia para reunirse con su par Vladimir Putin https://t.co/NFEf1bS51p..."
1070053902119329792,2018-12-04 20:35:05,RT @teleSURtv: Presidente de #Turquia vaticina que su visita a Venezuela traera mejores relaciones  bilaterales y fortalecera el comercio e...
1070000867494035462,2018-12-04 17:04:21,"Historica y trascendental visita de nuestro amigo y Presidente @RT_Erdogan, afianzamos la hermandad y las relacione... https://t.co/KLpNulteQL"
1069989381652602881,2018-12-04 16:18:42,Hemos desarrollado relaciones de hermandad con Turquia para fortalecer la construccion de bases solidas en materia... https://t.co/8asmboiXig
1069775718501019648,2018-12-04 02:09:41,Rumbo a la Federacion de Rusia para sostener un importante encuentro de trabajo con el Presidente Vladimir Putin. D... https://t.co/FJvv48GDpw
1069766712432693248,2018-12-04 01:33:54,"La visita oficial del hermano Presidente Erdogan, inicio con el Foro de Negocios VenezuelaTurquia, en el que alcan... https://t.co/bCvJv9fboQ"
1069759736692789248,2018-12-04 01:06:11,#EnVivo  | En este momento salimos rumbo a la Federacion de Rusia para fortalecer y ampliar nuestras relaciones di... https://t.co/YhTWbuYAuC
1069758011869224960,2018-12-04 00:59:19,"Turquia y Venezuela! Como parte de nuestra agenda de cooperacion bilateral, suscribimos acuerdos en materia de def... https://t.co/yU7hGFAH7S"
1069753566108233729,2018-12-04 00:41:39,"En el Palacio del pueblo rendimos honores a nuestro hermano Recep Tayyip Erdogan, Presidente de la Republica de Tur... https://t.co/dztolEopOv"
1069739249317093376,2018-12-03 23:44:46,"En nombre del pueblo de Venezuela, dimos una calida y fervorosa bienvenida a nuestro companero y amigo Presidente,... https://t.co/CgYXWRDagz"
1069729125475196929,2018-12-03 23:04:32,"RT @ConCiliaFlores: Para darle la bienvenida a la Primera Dama de Turquia, Emine Erdogan, y mostrarle nuestra hermandad, visitamos el Siste..."
1069721193819844608,2018-12-03 22:33:01,"#EnVivo  | Luego de una intensa jornada de trabajo junto a Recep Tayyip Erdogan, Presidente de la Republica de Tur... https://t.co/EDVcL0fnV0"
1069710958203994113,2018-12-03 21:52:21,"#EnVivo  | Firma de acuerdos entre la Republica de Turquia y la Republica Bolivariana de Venezuela, para ampliar n... https://t.co/KgttHf9qYP"
1069688148488318976,2018-12-03 20:21:43,"#EnVivo  | Reunion de trabajo con el Presidente de la Republica de Turquia, Recep Tayyip Erdogan, para revisar el... https://t.co/e7ZLgpdrMI"
1069682843243159554,2018-12-03 20:00:38,"#EnVivo  | Recibimos en el Palacio del Pueblo a Recep Tayyip Erdogan, Presidente de la Republica de Turquia, en su... https://t.co/0VSTI4Ro2s"
1069653040024694790,2018-12-03 18:02:12,"#EnVivo  | Junto al hermano Presidente Recep Tayyip Erdogan, participamos en el Foro de Negocios VenezuelaTurquia... https://t.co/m6XG7p3uks"
1069608804835299331,2018-12-03 15:06:26,"Venezuela continua dando pasos firmes hacia la consolidacion de su desarrollo economico, la defensa integral de la... https://t.co/N5j4lWOAlo"
1069592416745865217,2018-12-03 14:01:18,"Hace 7 anos tuve el privilegio de formar parte, junto al Comandante Chavez, del nacimiento de la Comunidad de Estad... https://t.co/3IBfOtsOv0"
1069579868130689024,2018-12-03 13:11:27,Se cumplen 12 anos de la reeleccion del Comandante Chavez con el 63% de los votos del Pueblo. Hecho sin precedentes... https://t.co/gfEOTb27zc
1069563205402402818,2018-12-03 12:05:14,"La Revolucion Bolivariana, a traves de la @MisionDrJGH, ha reivindicado los derechos de nuestros hermanos y hermana... https://t.co/sCuj6cLFvb"
1069399890613231616,2018-12-03 01:16:17,"En el marco del respetuoso y espiritual encuentro con el Gran Rabino Sefardi de Israel, impuse la orden Libertadora... https://t.co/z3RUylxG1d"
1069390426514296833,2018-12-03 00:38:40,"Sostuve un grato y cordial encuentro con Shlomo Moshe Amar Shelita, Gran Rabino Sefardi de Israel, quien me dio su... https://t.co/0ap5a6caQt"
1069373337917431808,2018-12-02 23:30:46,"#EnVivo  | Recibimos las bendiciones y buenos deseos de Shlomo Moshe Amar Shelita, Gran Rabino Sefardi de Israel (... https://t.co/1157HHgmRu"
1069349015303667713,2018-12-02 21:54:07,"RT @PresidencialVen: #AHORA | Canciller venezolano @jaarreaza a la clase obrera mexicana: ""Nosotros estamos del lado correcto de la histori..."
1069348960790347777,2018-12-02 21:53:54,RT @PresidencialVen: #AHORA Pdte @NicolasMaduro envia un mensaje de agradecimiento a la digna clase obrera mexicana por su respaldo a la Re...
1069286834482618369,2018-12-02 17:47:02,"Esperanza, solidaridad y amor, son los sentimientos que se respiran en las calles de Mexico con la llegada al Poder... https://t.co/fDvvyuIAwx"
1069275058076614656,2018-12-02 17:00:14,El pueblo de Benito Juarez esta listo para tomar las riendas de su futuro junto al Presidente @lopezobrador_ https://t.co/SSe7gFh4bN
1069257692466814976,2018-12-02 15:51:14,El Presidente @lopezobrador_ agradecio el abrazo de Venezuela al pueblo mexicano y le exprese nuestra disposicion d... https://t.co/ELMRTu0HOQ
1069239212187238400,2018-12-02 14:37:48,"Desde nuestra llegada a la tierra de Emiliano Zapata, la gratitud y el agradecimiento por nuestra visita estuvieron... https://t.co/O8eQNEFrpo"
1069044107736244225,2018-12-02 01:42:31,"Extraordinario encuentro con el Presidente @LopezObrador_ y su esposa, le transmitimos los buenos deseos y el abraz... https://t.co/HzTWa2FOQo"
1069042438709366784,2018-12-02 01:35:53,"RT @NicolasMaduro: Hermanos de la patria grande en la toma de protesta de @LopezObrador_, quien hoy escribe una pagina brillante en la hist..."
1069042260002652161,2018-12-02 01:35:11,"RT @tmaniglia: LA VERDAD EN MEXICO
#Video EL PRESIDENTE Manuel Lopez Obrador al PRESIDENTE @NicolasMaduro...
Vuelven los caminos de la Patr..."
1069042175005069312,2018-12-02 01:34:51,"RT @teleSURtv: # Mexico  I Movimientos sociales respaldan visita de @NicolasMaduro al pais  https://t.co/IXdflCoIXJ 

El hombre de paz..."
1069041893445693440,2018-12-02 01:33:43,RT @VillegasPoljak: #EnFotos | Presidente @NicolasMaduro en Ciudad de Mexico invitado a investidura del nuevo mandatario mexicano @lopezobr...
1069041868908957697,2018-12-02 01:33:38,"RT @PresidencialVen: #Noticia  | Pueblo mexicano fortalecera lazos de hermandad con Venezuela
@NicolasMaduro https://t.co/0x0sry72Gh https..."
1069040859822329857,2018-12-02 01:29:37,"RT @correoorinoco: Pueblo de Mexico expresa apoyo a Maduro en su visita al pais (+Fotos y Video)       https://t.co/SEnqNNAcsu

#CorreoOrin..."
1069040841866575872,2018-12-02 01:29:33,RT @pvillegas_tlSUR: #LaFoto. #AmloPresidente. https://t.co/UzvJEPiald
1069040510122319873,2018-12-02 01:28:14,"RT @tmaniglia: @NicolasMaduro EN MEXICO
Porque la verdad de los pueblos es muy diferente a la que te cuentan los medios https://t.co/L2kNa1..."
1069040377129287680,2018-12-02 01:27:42,"RT @CancilleriaVE: #NOTICIA | Presidente Maduro es recibido por Lopez Obrador en el Palacio Nacional de Mexico

#PlanNavidadesFelices
https..."
1069040331277111296,2018-12-02 01:27:31,RT @DrodriguezVen: Mexico y Venezuela retoman el camino de la Patria Grande de la mano del Pdte @NicolasMaduro y el Pdte Manuel Lopez Obrad...
1069040254810767360,2018-12-02 01:27:13,RT @VTVcanal8: Presidente Maduro es recibido por su par mexicano Lopez Obrador https://t.co/7WM40Qvi6c https://t.co/7loRKpaTBd
1069040228281843712,2018-12-02 01:27:06,RT @ConCiliaFlores: Trajimos al Presidente Lopez Obrador la solidaridad del pueblo venezolano y recibimos  demostraciones de carino y apoyo...
1069040171935510529,2018-12-02 01:26:53,RT @ConCiliaFlores: Pueblo mexicano demostro su carino y apoyo al Presidente @NicolasMaduro Viva Mexico lindo y querido. Viva Venezuela htt...
1069040130047045633,2018-12-02 01:26:43,RT @FBuenAbad: Desde Mexico un gran abrazo al pueblo victorioso que hara posible la 4transformacion. Se respira un clima de fiesta historic...
1069040033297035264,2018-12-02 01:26:20,RT @PresidencialVen: #Noticia  | El Zocalo se desborda de pueblo para celebrar asuncion al poder de la izquierda en Mexico  @NicolasMaduro...
1069039764240769024,2018-12-02 01:25:16,RT @VTVcanal8: Movimientos sociales mexicanos expresan respaldo a la Revolucion Bolivariana https://t.co/SZV5yPaSJM https://t.co/01PXo40Rhn
1069039654136176645,2018-12-02 01:24:49,RT @HectoRodriguez: Que viva Mexico! https://t.co/DAsYWwMVPW
1069039572628238336,2018-12-02 01:24:30,"RT @teleSURtv: #Presidentes y representantes del mundo en posesion de AMLO  https://t.co/VeD5p6zcnW

El nuevo #PresidenteDeMexico despiert..."
1069039473755910144,2018-12-02 01:24:06,RT @madeleintlSUR: Por cierto esta fue la acogida a las afuera del hemiciclo y representa la nueva politica con la llegada de #AMLO de resp...
1068986352904097799,2018-12-01 21:53:01,"Hermanos de la patria grande en la toma de protesta de @LopezObrador_, quien hoy escribe una pagina brillante en la... https://t.co/Awtg2w6gf8"
1068968181627305984,2018-12-01 20:40:49,Agradezco las muestras de carino del fraterno pueblo mexicano. Hemos venido a expresar a @LopezObrador_ nuestro res... https://t.co/tx4SQ5ZpsI
1068896464766681088,2018-12-01 15:55:50,"En el marco de nuestra Diplomacia Bolivariana de Paz, fortalecemos los lazos de cooperacion en materia energetica,... https://t.co/TDs5Imt7sF"
1068879277159038977,2018-12-01 14:47:33,"En el Cuartel de la Montana, en un acto lleno de lealtad y compromiso, ascendimos al Personal Profesional Militar d... https://t.co/GrHeq8loit"
1068861172449980418,2018-12-01 13:35:36,"Revolucion, Partido y Victoria! Son dos decadas de un proceso historico de triunfos para nuestro pueblo. Lee y com... https://t.co/VZLJmHF6bi"
1068831152214028289,2018-12-01 11:36:19,"Hace 55 anos, desde las alturas del Parque Nacional Warairarepano, se encendio por primera vez la Cruz del Avila. S... https://t.co/UP6u4sckOc"
1068668996742983681,2018-12-01 00:51:58,"Fructifero encuentro de trabajo con Hojattolah Soltani, Viceministro Adjunto para America, enviado especial del Pre... https://t.co/cwgm96hK0q"
1068658140101656577,2018-12-01 00:08:49,Felicito a los hombres y mujeres de la Guardia de Honor Presidencial que ascendieron a la jerarquia y grado inmedia... https://t.co/KRgOThc5kG
1068643545874092033,2018-11-30 23:10:50,"#EnVivo  | Reunion con Hojattolah Soltani, Viceministro Adjunto para America en el Ministerio de Asuntos Exteriore... https://t.co/fO1FybAYiw"
1068622183113678848,2018-11-30 21:45:57,#EnVivo  | Continuamos con el acto de ascensos del Personal Profesional Militar de la Guardia de Honor Presidencia... https://t.co/j6xM5yTORf
1068611086805598210,2018-11-30 21:01:51,#EnVivo  | Acto de Ascenso a la Jerarquia y Grado inmediato superior del personal militar adscrito a nuestra Guard... https://t.co/opQV20OfGu
1068587252278853632,2018-11-30 19:27:08,"Jovenes de la Mision Chamba Juvenil! Trabajen con alegria, creatividad e inteligencia para defender a Venezuela co... https://t.co/AbEQJgIjC1"
1068577639730950145,2018-11-30 18:48:57,"Venezuela solo tiene un destino, construir su felicidad y su grandeza para lograr, con la bendicion de Dios, que nu... https://t.co/xuGsCelpwM"
1068520633716240384,2018-11-30 15:02:25,"Nuestra moneda digital cuenta con la seguridad y el respaldo de la tecnologia blockchain, garantia de confiabilidad... https://t.co/772e6Ix99U"
1068498977530744832,2018-11-30 13:36:22,"Asignaremos, a los 6 millones de Hogares de la Patria, un Bono Unico de Navidad (Bs.S 2.000) a partir del #01Dic, y... https://t.co/RCPja6SEtD"
1068342123169165312,2018-11-30 03:13:05,"Como parte del Factor de Correccion previsto en el Programa de Recuperacion Economica, estableci un aumento de los... https://t.co/6RPAFBLQ0Q"
1068335450744651781,2018-11-30 02:46:34,La Revolucion Bolivariana lograra la estabilidad economica de nuestro pueblo con la puesta en marcha de un conjunto... https://t.co/QTcwbmrRL8
1068328334407462915,2018-11-30 02:18:18,"Al cumplirse 100 dias de la puesta en marcha del Programa de Recuperacion Economica, ajustamos el valor de la Unida... https://t.co/HFpxVthOX2"
1068300959640682497,2018-11-30 00:29:31,"RT @PresidencialVen: #EnVivo  | Creo que funciona bien el sistema de precios acordados, si se respeta, en todos los niveles, con la capac..."
1068300934114091008,2018-11-30 00:29:25,"RT @PresidencialVen: #EnVivo  | Presidente @NicolasMaduro a  los empresarios venezolanos: Apuesten por Venezuela, jueguensela por Venezue..."
1068300404738408448,2018-11-30 00:27:19,"RT @PresidencialVen: #EnVivo  | Hoy, manana, pasado manana debe haber capacidad de regulacion, correccion, mejoria y adaptacion de sistem..."
1068300370768732160,2018-11-30 00:27:11,RT @pinfantea: Pdte @NicolasMaduro Venezuela lleva una propuesta a la reunion de la OPEP el 6 de diciembre de ratificar el acuerdo petrole...
1068300228527357953,2018-11-30 00:26:37,"RT @teleSURtv: #ULTIMOMINUTO | Presidente @NicolasMaduro anuncia aumento en los ingresos de trabajadores de Venezuela 

El salario minimo n..."
1068300010129899523,2018-11-30 00:25:45,RT @PresidencialVen: #Noticia  | Salario minimo aumenta a Bs.S 4.500 a partir del 1 de diciembre @NicolasMaduro https://t.co/9jZP4D3MMk #1...
1068299873815068673,2018-11-30 00:25:12,RT @PresidencialVen: #EnVivo  | En cuanto a los precios acordados hemos establecido conversaciones con los empresarios y ya tenemos los n...
1068299815371579392,2018-11-30 00:24:58,"RT @PresidencialVen: #ANUNCIO  | Tengo listas las 20 mil toneladas de pernil que se van a distribuir, a traves de las ferias del campo so..."
1068299753279107072,2018-11-30 00:24:43,RT @teleSURtv: Presidente @NicolasMaduro: Tenemos mas de 35 millones de piezas de ropa y calzado que se iran distribuyendo y comercializand...
1068299698262499329,2018-11-30 00:24:30,"RT @VTVcanal8: #EnDirecto | Pdte. @NicolasMaduro:  El centro de la Revolucion Bolivariana es el humanismo y las familias venezolanas 

#10..."
1068299650258616320,2018-11-30 00:24:19,RT @PresidencialVen: #Noticia  | Fase inicial del Plan de Recuperacion Economica vislumbro estabilidad financiera del pais https://t.co/WE...
1068274236521922560,2018-11-29 22:43:20,#EnVivo  | Palacio de Miraflores | Reunion con el Equipo Economico para evaluar la puesta en marcha de nuevas acci... https://t.co/GeDfwWlUJw
1068232382078205952,2018-11-29 19:57:01,Asi es Cilia! Lucharemos siempre por las causas nobles de nuestro pueblo. Juntos por Venezuela! https://t.co/vYSCkZ1vTG
1068220015302909952,2018-11-29 19:07:52,"Recomiendo a los amantes de la lectura un buen libro: La controversia entre Bolivar e Irving, el nacimiento de Ven... https://t.co/4j4EwTVqOv"
1068157241239457793,2018-11-29 14:58:26,Nuestra juventud se suma al desarrollo del Petro para consolidar la nueva estructura financiera de la Patria. Junt... https://t.co/qS4FiDqZfm
1068143839507070976,2018-11-29 14:05:11,"En el Dia Internacional de Solidaridad con el Pueblo Palestino, Venezuela reafirma su compromiso historico en defen... https://t.co/IiMQoQVUQ9"
1068134363014053889,2018-11-29 13:27:31,"Celebramos el Dia Nacional del Escritor, reconociendo el trabajo que realizan los hombres y mujeres de las letras,... https://t.co/3631i2RACL"
1068122447684272129,2018-11-29 12:40:10,"Celebramos 237 anos del nacimiento de don Andres Bello, maestro del Libertador; realizo grandes aportes a la humani... https://t.co/bCEyL808gy"
1067844720393707520,2018-11-28 18:16:35,"En el marco de la construccion de un mundo multipolar, Venezuela se abre paso junto a la hermana Republica Popular... https://t.co/3IELltPRIQ"
1067820811053162497,2018-11-28 16:41:35,"La #FANB, y en especial nuestra @AviacionFANB, tiene en sus filas a una juventud, dispuesta a garantizar el futuro... https://t.co/lDSwUASr7a"
1067782543460761600,2018-11-28 14:09:31,Ya son 10.000 los venezolanos y las venezolanas que han retornado a traves del Plan Vuelta a la Patria. Bienvenido... https://t.co/XztMSGowYf
1067761669747687425,2018-11-28 12:46:34,"Hace 198 anos nacio Federico Engels, filosofo, economista y politico aleman, que se intereso por los movimientos re... https://t.co/Ai04xqid4f"
1067600088434991104,2018-11-28 02:04:30,"Sostuve un importante encuentro de trabajo con el excelentisimo Kim Yong Nam, Presidente del Presidium de la Asambl... https://t.co/JUSGIohkuM"
1067535503233359872,2018-11-27 21:47:52,"#EnVivo  | Reunion de trabajo con Kim Yong Nam, Presidente del Presidium de la Asamblea Popular Suprema de la Repu... https://t.co/ewYx7AjCBJ"
