id,created_at,text675774708353245184,2015-12-12 20:30:20,"Hoy se logro importante acuerdo cumbre cambio climatico Paris, para reducir emisiones, controlar temp y mejorar la vida en el planeta tierra"
675085074702966785,2015-12-10 22:49:58,Just posted a photo https://t.co/Rc5XMVWdNi
675082411680661505,2015-12-10 22:39:24,"En el Parque Tantauco, con Kris y Douglas Tompkins (en el extremo derecho)en el verano del 2014 https://t.co/AEp5Bn5HhD"
674986198499262464,2015-12-10 16:17:05,"Hoy comienza nva etapa para Argentina,con nuevas esperanzas de libertad, justicia y progreso.Le deseo lo mejor al presidente @mauriciomacri"
674777418406629376,2015-12-10 02:27:27,"Recorriendo el Parque Tantauco, junto a Douglas Tomkins en el verano del 2013 https://t.co/uzzdRrZypt"
674775405090373632,2015-12-10 02:19:27,"En el verano del 2014,Inaugurando el parque Yendegagia, junto a Douglas Tompkins, con la... https://t.co/JcDmc7STSy"
673898383728357377,2015-12-07 16:14:29,Participando en cumbre Cambio Climatico en Paris https://t.co/3VogeVdjX6
673849149268340736,2015-12-07 12:58:51,"Gran triunfo libertad,democracia y derechos humanos en Venezuela. Merito de valientes: L Lopez, L Tintori, MC Machado,A Ledezma, E Capriles"
673416720820920322,2015-12-06 08:20:32,Lo importante es que voz y decision soberana venezolanos sea escuchada y respetada por gobierno de Presidente Maduro. #VenezuelaQuiereCambio
673407538352779264,2015-12-06 07:44:03,Hoy se apagara voz omnipresente gobierno Venezuela y se escuchara fuerte y clara la voz potente del pueblo venezolano.#VenezuelaQuiereCambio
673139555604766720,2015-12-05 13:59:11,En Tunisia (ex Cartago) participando en seminario sobre el futuro de la Primavera Arabe junto a... https://t.co/rIRxXJwvhm
672867678546186240,2015-12-04 19:58:50,"Terminando participar seminario Tunisia sobre futuro Primavera Arabe, junto a ex presidentes de Alemania y Turquia y ex 1 ministro frances"
672382170409889792,2015-12-03 11:49:36,"Feliz dia a todas las personas con capacidades diferentes, que saben enfrentar lo bueno y no tan bueno de la vida, con optimismo y voluntad"
672375014382026752,2015-12-03 11:21:10,"Feliz dia a todas las secretarias de Chile,especialmente a Sarita,que con carino, talento ymucha paciencia hacen mas gratas nuestras vidas."
672369594569498624,2015-12-03 10:59:38,Feliz dia a todos los medicos.Agradecemos compromiso con salvar vidas y aliviar dolor.Pero nada reemplaza la prevencion que es resp nuestra
672140266887860224,2015-12-02 19:48:22,"Partiendo a Tunisia( ex Cartago) y Paris, a participar seminario futuro primavera arabe y cumbre cambio climatico https://t.co/kCkqUpKNGc"
671804519941017600,2015-12-01 21:34:13,Gracias @ceciliamorel por la torta y por celebrarme aun en mis 66 anos. https://t.co/2lr39xB5La
671706305078427648,2015-12-01 15:03:57,"Recordando dias pasados, aqui con mis padres. Grandes recuerdos. https://t.co/oLkYouKQZS"
671683616842326018,2015-12-01 13:33:48,@MatiasAlcayagaT gracias
670359766267502592,2015-11-27 21:53:17,Con Pte de Colombia Juan Manuel Santos  y Vicepte German Vargas en clausura seminario Infraestructura  del Futuro https://t.co/QigIYrxI6i
670072039995260928,2015-11-27 02:49:58,"RT @T13: #Tele13| El pulmon del Parque Tantauco, el ultimo paraiso virgen de Chiloe  https://t.co/4U92OvHYxz https://t.co/1HrNUXRwMT"
669884809259425792,2015-11-26 14:25:59,Los invito a visitar https://t.co/3BYbFjLdGS y aventurarse en sus paisajes y su fauna.
669484436870832128,2015-11-25 11:55:02,"En consecuencia,como ex presidente, comprometo mi total apoyo en caso Bolivia a la presidenta,gobierno de Chile y al nuevo agente JM Insulza"
669482992860061698,2015-11-25 11:49:18,"Aprecio y valoro gestion ex agente F Bulnes en caso Bolivia, en que todos debemos actuar con unidad en defensa legitimos intereses de Chile"
669161486422581253,2015-11-24 14:31:45,"Los invito a conocer el maravilloso Parque Tantauco en Chiloe, primero en la web y luego en la realidad https://t.co/P4cR3DsVwc"
668606769418096641,2015-11-23 01:47:30,"Fotos del recuerdo con Mauricio Macri, futuro presidente de Argentina https://t.co/f0FNDepyet"
668564918715727872,2015-11-22 23:01:12,Gran triunfo de Mauricio Macri abre nuevas esperanzas para q Argentina supere largo periodo de confrontacion y estancamiento de ultimos anos
665509434995712000,2015-11-14 12:39:48,Terrorismo es enemigo poderoso e implacable.No respeta nada para cumplir abyectos objet. Para derrotarlo se requiere total unidad y voluntad
665508262708690944,2015-11-14 12:35:09,No basta condenar atentados en Paris y solidarizar con victimas.El mundo libre debe unirse y ganar guerra contra el terrorismo y sus aliados
664837680887422976,2015-11-12 16:10:29,RT @ceciliamorel: Les comparto mi entrevista publicada hoy en @revistacapital cc @ChileViveSano https://t.co/5Uuig6XdwJ
660473169535492096,2015-10-31 15:07:29,Los invito a leer columna publicada hoy en la tercera: Salvemos el Planeta Tierra ?   Adjunto link : https://t.co/Ld0RvNEsD7
660239981269618688,2015-10-30 23:40:52,Quiero saludar a los miembros de Iglesias Evangelicas y Protestantes en visperas de su dia y agradecerles su valioso aporte al alma de Chile
660202487979360256,2015-10-30 21:11:53,Libre competencia es esencial para q economia social de mercado sea buena y justa con consumidores.Debemos rechazar con fuerza la colusion
659398872620511232,2015-10-28 15:58:36,RT @Manena: Hay que levantar la voz para que elecciones en Venezuela sean libres. Entrevista a @sebastianpinera en @larazon_es https://t.co...
659017243326566400,2015-10-27 14:42:09,Conversando con el Rey Felipe de Espana en Madrid https://t.co/H3ksDMH3kw
659015945604698112,2015-10-27 14:37:00,Conversando con el Rey Felipe de Espana https://t.co/2DnE4quE6y
658987387213713409,2015-10-27 12:43:31,"RT @CLUBdeMADRID: Getting started, @sebastianpinera and @AndresPastrana_  at the @CLUBdeMADRID General Assembly https://t.co/gFUacFBj7h"
658987365181034496,2015-10-27 12:43:25,RT @CLUBdeMADRID: 40 Former Presidents &amp; PM's are ready to start our General Assembly https://t.co/3b1MVJdFxt
658722968428789761,2015-10-26 19:12:48,"En Madrid, una profunda y agradable conversacion con el presidente Felipe Gonzalez https://t.co/SJAH232tPK"
658611795498766337,2015-10-26 11:51:03,Compartiendo una buena conversacion con el presidente Aznar. https://t.co/mWeP1ou7gf
657991383358246912,2015-10-24 18:45:45,"En Mexico, recorriendo algo de su intensa historia https://t.co/JEtzlyK87o"
655053277583810560,2015-10-16 16:10:46,Un saludo carinoso a l@s profesores. Un buen profesor hace la diferencia. Muchos marcaron mi vida y se los agradezco.#felizdiadelprofesor
651428828426932228,2015-10-06 16:08:30,Aqui participando un rato en la sesion de preguntas y respuestas de @avanzachile junto a gblumel y... https://t.co/edRiskKRzk
651406457548746752,2015-10-06 14:39:36,Pueden preguntar a @gblumel ahora en https://t.co/JZd1zzRsm8 #TodoSobreElPresupuesto2016
651071315709952000,2015-10-05 16:27:52,Especial de Fundacion @avanzachile sobre el Presupuesto de la Nacion 2016 en http://t.co/6UM7oI9P3a Informate!
650003538509197312,2015-10-02 17:44:54,Los invito a revisar este especial digital de @AvanzaChile sobre ley de presupuesto en http://t.co/BmUnugWYK0 y video http://t.co/oQz7vD1s4s
648588240069480448,2015-09-28 20:01:01,Los invito a leer esta columna y prepararse para la revolucion tecnologica que viene.   http://t.co/dsBw3QyBre http://t.co/PHRNvvOTz1
645931470033420288,2015-09-21 12:03:57,"Muy feliz dia al Trabajador Radial, que todos los dias, como un buen amigo, nos informa, entretiene, acompana y es parte de nuestras vidas."
642292813711994880,2015-09-11 11:05:14,Todos los democratas debemos luchar por la libertad de Leopoldo Lopez .El 6 de diciembre el pueblo venezolano juzgara con sus votos a Maduro
642291840981540864,2015-09-11 11:01:22,Una jueza dependiente del gobierno venezolano (provisoria y sin inamovilidad en el cargo) condeno a 13 anos de prision a Leopoldo Lopez.
641958875009318913,2015-09-10 12:58:17,RT @AvanzaChile: Ve via streaming la conferencia y entrevista a realizar a @sebastianpinera en la 3a cumbre de Pais Digital. Ver en http://...
641276504421335040,2015-09-08 15:46:47,"Es urgente aprobar ley corta anti delincuencia, para proteger mejor familias chilenas y carabineros y asegurar mayor seguridad ciudadana"
641270957831811072,2015-09-08 15:24:45,"En ceremonia cambio mando de Carabineros de Chile, quienes merecen toda nuestra gratitud, pues arriesgan sus vidas por proteger las nuestras"
641258768219664384,2015-09-08 14:36:19,RT @ufinisterrae: Ahora ex presidente @sebastianpinera comienza su intervencion en #catedraampuero2015 destacando rol de America Latina htt...
638776760134434816,2015-09-01 18:13:42,"Recomiendo guia  ""Ojo con los Patrimonios de la Humanidad en Chile""; de @FundFuturo. Un aporte a la cultura. Veala en http://t.co/tK8J0nLMNK"
635309968741244929,2015-08-23 04:37:54,RT @Manena: Felicitaciones a @NataliaDucoSole por sus exitos deportivos en Beijing. Vamos x mas!!!! Cc @cataduco @ChileViveSano
633779528226205696,2015-08-18 23:16:29,Felicitaciones a @LucasPalaciosC por la presentacion de su primer libro de poesia #LunaVela http://t.co/7Fz1YFBC7P
633059517849333760,2015-08-16 23:35:25,"RT @AvanzaChile: Compartimos #InformeDeCoyuntura: ""Analisis de la propuesta de gratuidad en educacion superior"". http://t.co/pr3sVS46EH via..."
631622936638660608,2015-08-13 00:26:57,Felicitaciones a @clarroulet y @jgorosabel. #LaEducacionEnLaEncrucijada es un libro que viene a aportar ideas en un minuto muy relevante.
631602321433227264,2015-08-12 23:05:02,Ya estamos en la presentacion del libro #LaEducacionEnLaEncrucijada de @clarroulet y @jgorosabel. Estado docente o sociedad docente?
629259022781255680,2015-08-06 11:53:36,Total apoyo a la respuesta de la Presidenta Bachelet y Canciller Munoz a las destempladas e inaceptables amenazas del Presidente Boliviano
627293516755025921,2015-08-01 01:43:23,RT @albertoespina: Te invitamos a unirte a nuestra campana #JuntosContraLaDelincuencia aqui les dejo nuestro video https://t.co/nVdfPrjBPp
626837972047011841,2015-07-30 19:33:13,Felicitaciones a los amigos de @latercera por sus primeros 65 anos de vida aportando a nuestro pais. Animo y y fuerza para los que vendran.
625812029216002048,2015-07-27 23:36:29,"Recordemos  lo que hace 5 anos unio, motivo e inspiro a todos los chilenos: La busqueda y rescate de los 33 mineros: https://t.co/1n7FpBDUJo"
624716787544944640,2015-07-24 23:04:23,Felicitaciones a TVN y Sebastian Keitel por la gran transmision del atletismo de los juegos panamericanos
623215585934057472,2015-07-20 19:39:09,"Este nuevo referente sera un gran aporte para que Chile supere la crisis actual y recupere la senda del progreso, libertad, justicia y orden"
623214472476381185,2015-07-20 19:34:43,"Hoy la oposicion dio un gran primer paso , con unidad, compromiso y sentido de mision,hacia la conformacion de un nuevo referente de futuro"
622939438260293632,2015-07-20 01:21:50,"RT @ChileViveSano: Columna de @ceciliamorel ""Una apuesta por las proximas generaciones"" en el primer aniversario de @ChileViveSano http://t..."
622939429494243329,2015-07-20 01:21:48,RT @ChileViveSano: Hoy cumplimos nuestro 1er ano de existencia! Gracias por acompanarnos en nuestra labor de construir un Chile mas sano ht...
619524379240697857,2015-07-10 15:11:36,"Ahora que Chile es Campeon de America, las chilenas y chilenos debemos aspirar a ser campeones de la Vida Sana http://t.co/TsJprJhBot"
617711963376906240,2015-07-05 15:09:43,@miguelhuerta32 ssszdzw
617468638292013056,2015-07-04 23:02:50,GRANDE CHILE !!! MERECIDO CAMPEON DE AMERICA.  https://t.co/DwVUm6qvYz
617392373547536385,2015-07-04 17:59:47,"Adios Carlo de Gavardo. Gran deportista, leal companero y  mejor amigo.Su muerte ensena que debemos andar liviano de equipaje por esta vida"
615911251508633600,2015-06-30 15:54:20,Perdida dos tercios capacidad de crecer y crear empleos esta impactando empleo y finanzas publicas y deteriorando calidad vida de chilenos
615911251487625216,2015-06-30 15:54:20,"Urge reformar las reformas trib, educ y laboral,para corregir sus pecados originales e impulsar una poderosa agenda pro crecimiento y empleo"
615911251277946880,2015-06-30 15:54:20,"Debemos tb recuperar tiempo perdido en educ,seguridad ciudadana y salud.Asi los chilenos vulnerables y de clase media tendran una mejor vida"
615559615753924608,2015-06-29 16:37:03,"Herede de mi padre 40 anos amistad con Sergio Diez. Gran  creyente y serv publico. Hombre bueno, amante de su familia y leal con sus amigos"
615216337158156288,2015-06-28 17:52:59,Que le esta pasando a Chile? Mi columna publicada hoy en El Mercurio http://t.co/UNI3geSAJZ
614046264230068224,2015-06-25 12:23:32,Declaracion reunion gabinete binacional Peru-Bolivia es inaceptable para Chile. Tema limitrofe es bilateral.Peru no debe intervenir
613696158196744192,2015-06-24 13:12:20,"Segun SIMCE 2014,20 de los 30 mejores liceos municip fueron Liceos Bicentenarios. Asi todos los jovenes con merito pueden cumplir sus suenos"
613492927206150144,2015-06-23 23:44:46,"Liceos Bicentenarios, creados  x gobierno anterior, superaron promedio nacional y tb a Liceos Emblematicos, creando verd oport a clase media"
613491429684416512,2015-06-23 23:38:49,"A pesar de los malos resultados en calidad y equidad del Simce 2014, hay que destacar el gran logro en calidad de los 60 Liceos Bicentenario"
612668083308773376,2015-06-21 17:07:08,Feliz dia a todos los padres https://t.co/aUtn6uiGgd
612458120787415040,2015-06-21 03:12:49,"Feliz dia a todos los padres, a los que seran padres y a los que fueron nuestros padres y ya no estan con nosotros"
610813788326117376,2015-06-16 14:18:50,Los desafios de Latinoamerica http://t.co/bwdbFzsAVZ cc @clapesuc @clarroulet @AndresPastrana_ @felipelarrain
610468917610446848,2015-06-15 15:28:26,"Problemas y desafios de Haiti. Reflexion de nuestra visita, junto al presidente @AndresPastrana_, a ese pais. http://t.co/bcJMYIWMK6"
606454319995621376,2015-06-04 13:35:51,Tb es necesario aprobar leyes de control preventivo de identidad y antiencapuchados. Asi la ciudadania podra vivir con mayor paz y seguridad
606453142000177152,2015-06-04 13:31:11,Grave  error debilitar a carabineros. Urge aprobar ley Gob anterior q protege mejor a carab. Pq lo necesitan y les permite protegernos mejor
605061553210183680,2015-05-31 17:21:30,"Interesante libro publicado por stanfordpress, sobre le reconstruccion de Chile despues del terremoto del 27/F  http://t.co/K1l7YOtXyj"
605007821302824960,2015-05-31 13:47:59,"Para interesados en Vivir Sano, recomiendo esta columna de Cecilia Morel, quien preside la fundacion Chile Vive Sano: http://t.co/NGiIw1k6hE"
604998626327293952,2015-05-31 13:11:27,"El gobierno y todos los chilenos debemos comprometernos con una Cultura de Vida Sana, para tener una vida mas plena y feliz para todos"
604997393705259008,2015-05-31 13:06:33,"Hoy se cumplen 2 anos desde que promulgamos la ley Elige Vivir Sano, que promueve una mejor alimentacion y mas deporte, familia y naturaleza"
603209392788471808,2015-05-26 14:41:40,"RT @CLUBdeMADRID: Kicking off ""Electoral Manifestos &amp; Political Communication"" in #Haiti with @AndresPastrana_  &amp; @sebastianpinera http://t..."
602920908232257536,2015-05-25 19:35:20,RT @AndresPastrana_: Con el Ex Presidente @sebastianpinera visitamos al Ex Presidente JB #Aristide en Mision del @CLUBdeMADRID en #Haiti ht...
602920361936691204,2015-05-25 19:33:10,RT @MichelJMartelly: Je rencontre une delegation du Club de Madrid au Palais National http://t.co/cWPj0KllAj
602920314243256321,2015-05-25 19:32:59,"RT @MichelJMartelly: Avec l'Ex President du Chili, M. Sebastian Pinera, au Palais National http://t.co/0q36jd2i7t"
602886820003618816,2015-05-25 17:19:53,"Con Presidente de Haiti , Michel Martelly, explicando posicion de Chile en diferendo con Bolivia ante CIJ http://t.co/p1rGYicG4u"
602855152744177664,2015-05-25 15:14:03,http://t.co/PnGHmdWZXJ
602534685785333760,2015-05-24 18:00:38,Compartiendo Con las tropas chilenas en Haiti http://t.co/3ctu3eG0ZQ
602504349747683328,2015-05-24 16:00:05,Con miembros de las FFAA Chilenas en Haiti http://t.co/K8WyEG3i7E
602495785771671552,2015-05-24 15:26:03,Jugando domino con una joven Haitiana y su familia http://t.co/ddNtPNY3ez
601477454163800064,2015-05-21 19:59:34,Interesante balance de gestion de gobierno publicado por El Libero: http://t.co/8eaHaJugUg
597208584116633600,2015-05-10 01:16:36,"Honremos y agradezcamos a nuestras madres, como ellas se lo merecen. Feliz dia a todas las mamas de Chile. Y tb a las que estan en el cielo."
596367605985845248,2015-05-07 17:34:51,"Debemos desterrar la logica de la confrontacion, recuperar la cultura de la colaboracion y poner siempre primero las prioridades de la gente"
596366854190407680,2015-05-07 17:31:52,"Lo importante hoy  es que Chile recupere el buen camino, salga del estancamiento y vuelva a avanzar. Para lograrlo todos debemos colaborar."
596045315590983683,2015-05-06 20:14:11,Una buena noticia http://t.co/p5H0DIc5By
595290002604630018,2015-05-04 18:12:51,El tratado de 1904 fue validamente suscrito y se encuentra plenamente vigente. Bolivia no debe torcidamente desconocerlo ni Chile permitirlo
595288814257623040,2015-05-04 18:08:07,"Firme y clara defensa de Chile en La Haya. Todos los Chilenos debemos unirnos ferreamente en defensa de nuestra soberania, territorio y mar"
592371171154391041,2015-04-26 16:54:27,"Ademas, un carabinero mejor protegido, protege mejor nuestras vidas y la seguridad de todos los ciudadanos, que tb lo necesitan y merecen"
592370724347731969,2015-04-26 16:52:41,"Todo mi apoyo a campana ""NO +"" para proteger mejor vida e integridad fisica de nuestros carabineros. Sin duda ellos lo necesitan y merecen"
592367492749660160,2015-04-26 16:39:50,Un abrazo solidario y carinoso a todos los damnificados por la erupcion del Volcan Calbuco y gratitud y animo a  quienes colaboran con ellos
591965842474172416,2015-04-25 14:03:49,"Recien liberaron a Antonio Ledezma, Alcalde de Caracas,detenido brutal y arbitrariamente por Gobierno del Presidente Maduro. Avanza Libertad"
591395705635373056,2015-04-24 00:18:18,Un orgullo compartir con @yoanisanchez. #YoaniEnChile http://t.co/V7kCJopYED
590654000099385344,2015-04-21 23:11:02,"El 27/F fue una tragedia: muerte, dolor y destruccion. Pero la reaccion de los Chilenos y reconstr mostro la nobleza y valor de los Chilenos"
590646088366960642,2015-04-21 22:39:35,"Salon de honor de la UC en lanzamiento del libro ""Leadership Dispatches"", sobre la Reconstruccion en Chile @clapesuc http://t.co/QZfalpFsmA"
590640247135981568,2015-04-21 22:16:23,Ya estamos en streaming para el lanzamiento del libro de M Useem y la reconstruccion cc @felipelarrain @clapesuc http://t.co/tqGdF9tux0
590613620754620416,2015-04-21 20:30:34,Haremos una reflexion y balance del desafio de la reconstruccion en Chile tras el 27/F cc @AvanzaChile @clapesuc @felipelarrain @cseebach
590613221784080384,2015-04-21 20:28:59,Hoy asistire a lanzamiento del libro del profesor M. Useem en el centro @clapesuc. Sigan el streaming en http://t.co/qI50IdbS5Q
588118786261262337,2015-04-14 23:17:00,Ya estamos en streaming http://t.co/sTUM8aeEMx #DialogoPorLaLibertad @liliantintori
588101882310176768,2015-04-14 22:09:49,"RT @AvanzaChile: Streaming a conferencia de @liliantintori, Mitzy Capriles, @sebastianpinera y @maylwino. Modera @maxcolodro http://t.co/u6..."
587690362896023552,2015-04-13 18:54:35,"Hoy me reuni con @liliantintori y Mitzy Capriles. Manana conversaremos en conferencia ""Dialogos por la Libertad"" http://t.co/sqvoF5A4mi"
587639004914384896,2015-04-13 15:30:31,"Dialogos por la Libertad, manana los esperamos desde las 19:00 horas streaming via http://t.co/IJoOUTN678  https://t.co/f1lg0vZbL5"
585152544449626112,2015-04-06 18:50:12,@Sokinesica gracias. Igual para ustedes! Fuerza
585139658910257153,2015-04-06 17:59:00,Dialogo por la Libertad junto a @liliantintori este martes14 de abril. Mas informacion en http://t.co/tAQnEhtCKY
584757705614749696,2015-04-05 16:41:15,La Ranita de Darwin en el Parque Tantauco http://t.co/oSm82P8u86
584756281824641025,2015-04-05 16:35:36,El Pajaro Carpintero en el Parque Tantauco http://t.co/7Y16c0U3Qx
584390518676815872,2015-04-04 16:22:11,"Comprando pescado en Maitencillo. Eliga Vivir Sano: +deporte,mejor alimentacion,+familia, mas naturaleza: Vida +Feliz http://t.co/L1NCVFBUL5"
584385147195252736,2015-04-04 16:00:51,Andando en bicicleta con nietos en Maitencillo. Feliz Semana Santa a todas y todos http://t.co/pO4pF4OcBP
581858022034685952,2015-03-28 16:38:57,"Despues de visitar el Museo de Historia Militar, tomando helados con los nietos en el Coppelia. Buen Abuelo ???? http://t.co/TMVKotKgYf"
580875846841438209,2015-03-25 23:36:08,Todo nuestro apoyo y solidaridad a los damnificados de las regiones de Antofagasta y Copiapo y estamos organizandonos para ir en su ayuda
580748302997676032,2015-03-25 15:09:19,Sobre el parque Yendegaia y otras cosas. Los invito a leer esta nota http://t.co/SXNYYsMvVT
580497748761436160,2015-03-24 22:33:43,"En la Isla de Tierra del Fuego se esta construyendo La ""Ruta del Fin del Mundo"",que unira el Estrecho de Magallanes con el Canal del Beagle"
580496824257118209,2015-03-24 22:30:02,Parque  Yendegaia es una de las maravillas de Chile. Se extiende desde el Canal del Beagle hasta la Cordillera de Darwin en Tierra del Fuego
580495718164635649,2015-03-24 22:25:38,"Junto al ministro de Medio  Ambiente Pablo Badenier, participando en lanzamiento del libro Parque Yendegaia, en la isla de Tierra del Fuego"
573796267932786689,2015-03-06 10:44:25,"En el dia internacional de la mujer, saludo con carino y admiracion a las mujeres chilenas, y especialmente a cecilia, a quien le debo tanto"
572581952269770752,2015-03-03 02:19:10,"Hoy se comenzo a pagar bono marzo, creado por nuestro gobierno en marzo de 2010. Gran y oportuna ayuda para mas de 1.5 millones de chilenos"
572577695562924034,2015-03-03 02:02:15,Gran reportaje tv13 sobre como retrasar envejecimiento y vivir mejor.Recomiendo verlo en t13.cl  Felicitaciones a c.santa maria y canal 13
571296511084142593,2015-02-27 13:11:17,"A 5 anos del 27/F, los chilenos debemos sentirnos orgullosos de lo que juntos hicimos por reconstruir Chile. Ver link http://t.co/V7ZtpfsaOc"
571262515218419712,2015-02-27 10:56:11,"El 27/F fue un dia de angustia, dolor y muerte. Pero tb mostro la nobleza y heroismo del alma de Chile.Toda mi solidaridad a las victimas."
568577232786083840,2015-02-20 01:05:50,"Pido respetuosamente al Gobierno de Chile que levante fuerte y clara su voz, en defensa de  las Libertades, Democracia  y DDHH en Venezuela"
568575206073245696,2015-02-20 00:57:47,"Esta detencion , ilegal y abusiva, confirma multiples atentados a las libertades, democracia y DDHH, por parte del  gobierno del Pte Maduro."
568572360900673538,2015-02-20 00:46:29,"Brutal detencion Alcalde Caracas Antonio Ledezma debe ser repudiada por todos los democratas,incluyendo gobiernos ,con gran fuerza por Chile"
568084043331477504,2015-02-18 16:26:05,"Con el ex Pte Andr Pastrana,nos sumamos a la campana por la libertad de Leopoldo Lopez y otr PP:  #visteaVZladeBlanco http://t.co/RsXT9nfQR2"
568034748024655872,2015-02-18 13:10:12,#VisteAVzlaDeBlanco http://t.co/iIszGum21J
566386419686719489,2015-02-14 00:00:20,"La responsab es del gob de N Maduro, que no respeta Libertades ni DDHH de venezolanos y de Org Int y paises de AL que no condenan ni actuan"
566384859325947904,2015-02-13 23:54:08,En 5 dias se cumplira un ano de abusiva e ilegal prision de Leopoldo Lopez y muchos otros presos politicos en carceles militares d Venezuela
565611414233305090,2015-02-11 20:40:44,"RT @AvanzaChile: Compartimos un nuevo especial: ""Las 10 cosas que debes saber de la reconstruccion del 27F"". http://t.co/InySp5InlK"
565536338251120640,2015-02-11 15:42:24,"Gr reduccion pobreza, cayo a la mitad, y creacion de mas de un millon de empleos,son noticias q alegran alma de Chile http://t.co/4gjZ9i33mo"
564446970342023168,2015-02-08 15:33:39,http://t.co/fAwAYKreAw
563071240009965568,2015-02-04 20:26:59,http://t.co/CIPYqPMcXl
561918930869288960,2015-02-01 16:08:07,"UNIDAD nos permitira ser mejor oposicion  y prepararnos para ser gobierno y recuperar un Chile con + libertad, justicia y progreso p todos"
561917805462040576,2015-02-01 16:03:39,""" No hay caminos a la unidad, la unidad es el camino"" .Felicito a RN, UDI, EVOPOLI y PRI por el acuerdo grande y fecundo en pos de la UNIDAD"
560938456168562689,2015-01-29 23:12:04,RT @T13: Esta es la carta del lider opositor venezolano Leopoldo Lopez al ex Presidente Pinera http://t.co/QhASkxOn6t http://t.co/KmmJyDBNTr
560431574660157440,2015-01-28 13:37:54,"Que 1,2 mm de Chilenos hayan superado su condicion de pobreza no es casualidad. Aqui no bastan las intenciones ,tb se necesitan resultados"
560430064815599617,2015-01-28 13:31:54,Encuesta casen muestra q entre 2009 y 2013 se produjo la mayor reduccion de pobreza y tb cayo la desigualdad. Porque se molesta el gobierno?
560199621050650626,2015-01-27 22:16:12,"Las libertades, la democracia y los DDHH estan vulnerados en Venezuela. Debemos actuar para defenderlos y pedir libertad de presos politicos"
560189680625668097,2015-01-27 21:36:42,"El presidente Maduro no rebate argumentos. Solo descalifica a todo el q piensa distinto. Si quiere ser respetado, debe aprender a respetar."
559731562682793984,2015-01-26 15:16:18,"RT @T13: ""Prefiero el ruido de la libertad de expresion al silencio de los cementerios"" @sebastianpinera por visita a Leopoldo Lopez en Ven..."
