id,created_at,text245805243038834688,2012-09-12 08:45:11,"Firmamos acuerdos con Hong Kong, China y Australia. Tambien logramos importantes avances con Tailandia, Rusia e Indonesia."
245804907171565569,2012-09-12 08:43:51,"Llegando de nuestra gira por Rusia y Australia, en que firmamos importantes acuerdos para Chile."
244166714839937024,2012-09-07 20:14:15,Felicitaciones a Cristian Valenzuela por su historica medalla de oro en la prueba de 5.000 metros de los Juegos Paralimpicos de Londres!
240802993929351170,2012-08-29 13:28:02,"Ayer en Sta. Barbara y Quirihue,en la region del Biobio, entregamos 838 viviendas definitivas a las familias damnificadas por el terremoto  "
239847312631926784,2012-08-26 22:10:30,Los invito a conocer mas de estas obras en http://t.co/yiAdR3ge y en @LegadoBi100. +obras+patrimonio+cultura
239846841292836864,2012-08-26 22:08:37,Hoy presentamos el programa Legado Bicentenario. 100 obras de Arica a Punta Arenas para los chilenos de hoy y de manana.
238373462052306944,2012-08-22 20:33:56,"No dejaremos de trabajar para hacer de Chile un pais sin campamentos, sin pobreza, mas justo y mas igualitario:  http://t.co/jScbVsqw"
238373281806315520,2012-08-22 20:33:13,"Hoy instalamos la 1a piedra de los edificios Las Torres I y II en Estacion Central. Acogeran a 264 flias, terminando asi con 5 campamentos."
236946637526822913,2012-08-18 22:04:15,"Hoy en el Santuario del Padre Hurtado, celebramos el Dia de la Solidaridad presentando la Agenda de Impulso Social: http://t.co/blM7RseX"
235454086051405825,2012-08-14 19:13:23,"Los invitamos a conocer http://t.co/z5acOmJO un sitio para generar, articular y fomentar los aportes de la sociedad a las causas solidarias."
235452837138669568,2012-08-14 19:08:25,"Hoy presentamos el Programa Mas por Chile, disenado para difundir y apoyar los proyectos sociales de cientos de fundaciones solidarias.  "
235035932187820032,2012-08-13 15:31:47,"Este proyecto forma parte del Plan Escuela Segura que busca dar mayor proteccion a los ninos y jovenes, y mas tranquilidad a los padres."
235035666612903936,2012-08-13 15:30:44,"Hoy firmaremos un proyecto de ley que incluira la prevencion de drogas y alcohol en la malla curricular a nivel parvulario, basico y medio  "
233196270989225984,2012-08-08 13:41:38,"Hoy tendremos la alegria de honrar con el muy merecido Premio Iberoamericano de Poesia Pablo Neruda, a nuestro gran poeta Nicanor Parra."
232211551774461953,2012-08-05 20:28:42,"Feliz dia a todos los ninos y ninas de Chile!, que merecen, hoy y siempre, toda nuestra proteccion, atencion y carino: http://t.co/d9RqAQj7"
232140520904867841,2012-08-05 15:46:27,Grande @tomasgonzalez1. Nos sentimos muy orgullosos por su actuacion. Fuerza y Fe manana en la final olimpica de saltos. Un abrazo carinoso
230462588851453952,2012-08-01 00:38:57,"Hoy presentamos el plan de accion ""Escuela Segura"" que protegera mejor  a nuestros ninos de agresiones y les permitira crecer mas felices"
230092199117873152,2012-07-31 00:07:09,Hoy presentamos modernizacion con estandares FIFA y ampliacion a 30 mil espectadores del Estadio de Concepcion. http://t.co/VJ1oldAC
228617706344157184,2012-07-26 22:28:03,Este estadio es otro @LegadoBi100 Mas informacion en http://t.co/zdsI8efH
228617471538638848,2012-07-26 22:27:07,"Tambien presentamos nuevo Estadio Municipal de Calama, de estandares FIFA y capacidad para 13 mil personas, que inaguraremos el proximo ano."
228616939751215105,2012-07-26 22:25:00,"Hoy revisamos obras de nuevo Hospital de Calama, que con tecnologia de punta y refuerzo de personal medico, estara operativo proximo ano."
228238025522556928,2012-07-25 21:19:20,Hoy en Quillota entregamos sus viviendas definitivas a 288 familias vulnerables damnificadas por el terremoto: http://t.co/1ctIGrdg
227143597038907393,2012-07-22 20:50:28,"Nuestro carino y condolencias para la familia y amigos del gran poeta y Premio Nacional de Literatura, Miguel Arteche."
227127602870091776,2012-07-22 19:46:55,"RT @LegadoBi100: Conoce mas detalles sobre los trabajos de Recuperacion Patrimonial de Fachadas, otro proyecto de @LegadoBi100 http://s. ..."
226392391622471680,2012-07-20 19:05:26,Buenas noticias que nos alegran y motivan a seguir trabajando para cumplir compromiso de derrotar la pobreza extrema durante este Gobierno
226391793971888128,2012-07-20 19:03:04,"148 mil chilenos, es decir, uno de cada cuatro, logro superar la pobreza extrema durante los dos ultimos anos."
226391665173209090,2012-07-20 19:02:33,"La encuesta CASEN nos muestra que durante los ultimos dos anos, gracias al esfuerzo de todos los chilenos, la pobreza  disminuyo."
226130569984106496,2012-07-20 01:45:03,"Ambos tendran estandares FIFA y calidad mundial, capacidad de 25 mil espectadores y se inauguraran el proximo ano: http://t.co/d5qop3Si "
226129745476218880,2012-07-20 01:41:47,"Hoy presentamos proyectos de remodelacion y ampliacion de estadios Elias Figueroa (ex Playa Ancha), en Valpo, y Sausalito en Vina del Mar."
225724524371529728,2012-07-18 22:51:35,Para conocer estas medidas los invito a visitar http://t.co/DmW0Lysw
225724299837833218,2012-07-18 22:50:41,Hoy presentamos 10 medidas concretas para iniciar un nuevo trato y combatir con toda nuestra fuerza los abusos sexuales contra ninos.
225308213132804096,2012-07-17 19:17:18,"Cumpliendo nuestro compromiso, desde hoy, 658 mil adultos mayores de FONASA tiene derecho a libre eleccion en Salud: http://t.co/l8KLxuNq"
224594921259139072,2012-07-15 20:02:56,RT @LegadoBi100: El legado que si queremos. Columna del Presidente @sebastianpinera sobre el programa @LegadoBi100 http://t.co/a0T8uGSp
224330775007473664,2012-07-15 02:33:19,He decidido decretar duelo oficial para honrar su memoria y reconocer su gran trayectoria y aporte a Chile . Un abrazo carinoso a su familia
224330194364796928,2012-07-15 02:31:00,Enrique Silva Cimma merece nuestro reconocimiento y gratitud por sus valiosos y generosos servicios a la patria durante su fecunda vida.
224329280535011329,2012-07-15 02:27:22,"Hoy,a los 93 anos,murio Enrique Silva Cimma,  destacado jurista,academico y extraordinario servidor publico.Mi carino y aprecio a su familia"
223833926794350592,2012-07-13 17:39:01,Con el nuevo postnatal de 6 meses ahora es mas facil que las mamas puedan amamantar a sus hijos. Conoce la campana aqui http://t.co/6HwqUCyM
223546368290074624,2012-07-12 22:36:22,La ley antidiscriminacion es hoy una realidad. Trabajemos todos por un pais que respete la diversidad: http://t.co/O2TRaW7Z
223478605643124736,2012-07-12 18:07:06,"Esta ley constituye un paso historico para construir juntos un Chile mas tolerante, inclusivo y acogedor para todos."
223478028834062337,2012-07-12 18:04:48,Hoy promulgamos la Ley Antidiscriminacion. Una ley muy necesaria porque toda discriminacion arbitraria causa mucho dolor y humillacion.
223070486932889600,2012-07-11 15:05:23,"En el Dia del Periodista saludo carinosamente a todos los q con su trabajo fortalecen la libertad de expresion, informacion y la democracia"
222121057946042368,2012-07-09 00:12:41,"De esta forma los pensionados, con sus Bonos Fonasa, podran elegir el medico y establecimiento de salud que los atendera."
222118538440212480,2012-07-09 00:02:40,Hoy anunciamos que los 650 mil pensionados  Fonasa A que tienen Pension Basica Solidaria o de Invalidez tendran derecho a la libre eleccion
221028028787081216,2012-07-05 23:49:23,"Para obtener mayor informacion, pueden consultar la pagina: http://t.co/fbxztEV4"
221027754072735744,2012-07-05 23:48:17,"A partir de manana, 7 millones de chilenos de sectores vulnerables y de clase media comenzaran a recibir el Bono Solidario de Alimentos."
219879614787502080,2012-07-02 19:45:59,"Los invito a apoyar la gran campana de la Fundacion Deportistas por un Sueno, ""Soy donante y mi familia lo sabe"": http://t.co/Cdjrkdbl "
219242542909243393,2012-07-01 01:34:30,"@FelipeCalderon: Felipe: un abrazo carinoso  a Margarita,que se recupere pronto y que manana sea un gran dia para Mexico"
218401688975970304,2012-06-28 17:53:15,Es la Delegacion Olimpica mas numerosa y con la mayor presencia de mujeres en la historia de Chile. Sabemos que dejaran muy alto a CHILE.
218401392161853440,2012-06-28 17:52:04,"Con mucho orgullo hemos entregado nuestra bandera nacional a Denisse Van Lamoen, nuestra abanderada en los Juegos Olimpicos Londres 2012"
216957172989444096,2012-06-24 18:13:15,"Este domingo celebramos,con mucho orgullo,el Dia Nacional de nuestros Pueblos Originarios,que hoy festejan el Ano Nuevo http://t.co/FVpd7MFW"
213359282496872448,2012-06-14 19:56:31,A partir de julio vamos a hacer entrega de este bono. Son 40 mil pesos por familia y 7.500 pesos adicionales por cada hijo o carga.
213358972814635009,2012-06-14 19:55:17,"Hoy promulgamos la ley del Bono Solidario de Alimentos que beneficiara a 1.940.000 familias, equivalentes a 7 millones de compatriotas."
212677331981045761,2012-06-12 22:46:41,El registro publico de estos condenados sirve para que los padres e instituciones que trabajan con ninos puedan protegerlos mejor.
212677036651708416,2012-06-12 22:45:31,Esta ley sirve para que los condenados por delitos sexuales contra menores nunca mas trabajen con ninos.
212659950093221891,2012-06-12 21:37:37,Hoy promulgamos la ley que crea inhabilidades y el registro de condenados por delitos sexuales contra menores: http://t.co/ItRxBqBc  
211934000154030080,2012-06-10 21:32:57,El Plan Arauco Avanza significa una inversion de mas 600 millones de dolares entre 2012 y 2014.
211933774018134016,2012-06-10 21:32:03,"Este Plan mejorara la produccion, conectividad, salud, educacion y calidad de vida en Arauco.  "
211933282856742913,2012-06-10 21:30:06,Hoy en Canete presentamos el Plan Arauco Avanza. Un conjunto de medidas para impulsar el desarrollo integral de las 7 comunas de Arauco.
211638274186428416,2012-06-10 01:57:51,felicitaciones a la seleccion por vibrante triunfo en Venezuela. La roja de todos encabeza las clasificatorias (no eliminatorias) al mundial
211584113474408450,2012-06-09 22:22:38,"Bienvenida a la libertad Gabriela Blas, la mujer Aymara, que gracias a un indulto presidencial,recupero hoy su libertad.Fuerza Gabriela"
210476903134531584,2012-06-06 21:02:58,"Con los Presidentes de Mexico, Colombia y Peru, hoy inauguramos la IV Cumbre de la Alianza del Pacifico en Paranal: http://t.co/qjFeadFG"
209704633336205312,2012-06-04 17:54:15,"Tambien establece un nuevo tipo de credito, al 2% de interes, con un pago maximo del 10% del ingreso y que se extingue con la cuota No 180."
209704341731409920,2012-06-04 17:53:05,Hoy enviamos al Congreso el proyecto que otorga becas a los estudiantes con merito que pertenezcan al 60% mas vulnerable de nuestro pais.
208622105447768066,2012-06-01 18:12:40,"Hoy inauguramos el puente del Rio Claro,  Region del Maule. Felicito a quienes lograron construirlo 4 meses antes del plazo fijado!"
208281755558490112,2012-05-31 19:40:14,"Porque aunque la vejez puede ser dura, no tiene porque ser una amenaza para la dignidad y bienestar de nuestros adultos mayores vulnerables."
208281399013281793,2012-05-31 19:38:49,"Incluira un plan de atencion domiciliaria, centros de atencion diurnos y subvenciones a centros que acogen a adultos mayores no autovalentes"
208280813970784256,2012-05-31 19:36:30,"Hoy presentamos una Politica de Estado, permanente e integral, para que nuestros adultos mayores tengan un envejecimiento mas sano.  "
207805838600044544,2012-05-30 12:09:07,"Es lo que merecen miles de familias que han sufrido tanto y que, por largos anos, esperaron una solucion concreta a sus problemas.  "
207805411422777346,2012-05-30 12:07:25,"Las familias ariquenas afectadas por polimetales recibiran subsidios de vivienda, atenciones de salud y apoyo para sus hijos estudiantes.  "
207805206250012672,2012-05-30 12:06:36,Ayer celebramos en Arica la publicacion de la Ley de Polimetales que significara una gran ayuda y beneficios para las familias afectadas.
207168669728522240,2012-05-28 17:57:14,Pedimos al Congreso que apruebe lo mas pronto posible este proyecto para poder entregar este bono en julio.  
207168557132419072,2012-05-28 17:56:47,"Este Bono consiste en $40.000 por familia, mas $7.500 por cada nino (hijo o nietos). No es una solucion total pero si un alivio importante."
207168469802819584,2012-05-28 17:56:26,"Hoy firmamos el proyecto de ley que establece el Bono Solidario de Alimentos, que beneficiara a mas de 7 millones de chilenos."
207143552449384450,2012-05-28 16:17:26,La  recuperacion de este valioso patrimonio cultural de Valparaiso es otro @LegadoBi100: http://t.co/CqSRsU67
207143552168361985,2012-05-28 16:17:26,"Ayer anunciamos la compra, reparacion y recuperacion de 10 ascensores de Valparaiso."
206886211942494208,2012-05-27 23:14:51,@Josesita87 mejorese!
206885691920105472,2012-05-27 23:12:47,"RT @javimartinezl: @sebastianpinera la casa de la moneda, el club de la union y el bellas artes!"
206884135682326528,2012-05-27 23:06:36,"""@PaulyQuiroz: Excelente el #DiaDelPatrimonio. Vale la pena llegar cansada despues de disfrutar de un grandioso dia cultural."" Que visito?"
206883866387030017,2012-05-27 23:05:32,"""@javimartinezl: Agotada pero feliz despues de un largo dia de visitas patrimoniales con @victorialenka #DiadelPatrimonio"" / Que visito?"
206831811383410688,2012-05-27 19:38:41,Ayer lanzamos 3ra etapa de Fondo Reconstruccion Patrimonio que en 2 anos ha permitido recuperar patrimonio danado en 27-F #diadelpatrimonio
206747130122076160,2012-05-27 14:02:11,"RT @LegadoBi100: A prepararse para el Dia del Patrimonio, manana domingo 27 de mayo. Donde ir? http://t.co/WclW0mOt y http://t.co/AQBQKOSV"
205867302527311873,2012-05-25 03:46:04,RT @legadobi100: Directora de la Dibam: Por una iniciativa presidencial se decide recuperar el Palacio Pereira http://t.co/iWhgqap7
205741897124290560,2012-05-24 19:27:45,Hoy asistimos a la ceremonia conmemorativa del 150o aniversario de la Gran Logia de Chile. Felicitaciones a todos sus miembros!
204379707838435329,2012-05-21 01:14:54,Preparando el discurso del 21 de mayo. http://t.co/0XGwLZHA
203650884830367744,2012-05-19 00:58:49,"Los invito a visitar este tradicional espacio que alberga el patrimonio cultural, natural y paleontologico de Chile: http://t.co/8Ubji3QB "
203650766999797761,2012-05-19 00:58:21,"Hoy asistimos a la reapertura del Museo Nacional de Historia Natural del Parque Quinta Normal, cerrado por danos desde el terremoto del 27F "
201733095567790082,2012-05-13 17:58:12,"El postnatal de 6 meses y el perfeccionamiento del sist de salas cunas son un reconocimiento y apoyo a las mamas, la maternidad y la familia"
201732281403052032,2012-05-13 17:54:58,Feliz dia a todas las madres y las futuras mamas! Gracias x entregarnos la vida y apoyarnos siempre. Un abrazo especial para @ceciliamorel
200728690999570433,2012-05-10 23:27:03,Agradezco al Congreso la aprobacion del Ingreso Etico Familiar que beneficiara a 170.000 familias. Un paso historico para superar la pobreza
199202394842726400,2012-05-06 18:22:06,Mas informacion de este proyecto de ley en http://t.co/UtaFmXXP
199202152177082368,2012-05-06 18:21:08,El proyecto de ley que hoy firmamos con la ministra Matthei mejorara las condiciones de las trabajadoras de casa particular.
199200393840955392,2012-05-06 18:14:09,"Nuestra mision: Crear mas trabajo, mejorar los salarios, proteger mejor los derechos y dignidad de los  trabajadores."
198913931270557697,2012-05-05 23:15:51,"Quiero expresar mis condolencias y carino a la familia de Maximo Pacheco Gomez, un gran chileno, amigo y ejemplar servidor publico."
198102935736033283,2012-05-03 17:33:15,"Cuando el Congreso apruebe el Ingreso Etico Familiar, este bono premiara a miles de alumnos meritorios de flias vulnerables y de clase media"
198102393676771328,2012-05-03 17:31:05,Hoy empezamos a entregar el Bono Logro Escolar de $50.000 a 11 mil ninos vulnerables y de buen rendimiento. Un premio para ellos y sus flias
198057629069742081,2012-05-03 14:33:13,"Por eso, cuidemos la libertad de prensa que es esencial para la democracia. Feliz dia a todos los periodistas y trabajadores de la prensa!."
198057342787518464,2012-05-03 14:32:04,"Hoy es el Dia de la Libertad de Prensa que cuando se tiene, nadie la extrana, pero cuando falta, ya es muy tarde para salir en su defensa."
197291381646032896,2012-05-01 11:48:25,"En este dia, quiero hacer un llamado especial a los empleadores, a respetar la dignidad y derechos de los trabajadores y a cumplir la ley."
197291093900009472,2012-05-01 11:47:16,En el Dia del Trabajo quiero saludar con mucho carino a las chilenas y chilenos que trabajan cada dia por sacar adelante a sus familias.  
197051841945673728,2012-04-30 19:56:34,"Asimismo, la modificacion del SIPCO, frente a alzas en el petroleo, dara un merecido alivio a las familias en el precio de los combustibles."
197050109589078016,2012-04-30 19:49:41,"Tambien permitira aumentar en 75.000 los cupos de pre kinder y kinder, dando cobertura gratuita para todos los ninos del 60% mas vulnerable."
197048999532953600,2012-04-30 19:45:17,"Con esta reforma aumentaremos las becas para la Educacion Superior de 118 mil el ano 2009, a mas de 400 mil el 2014."
197047704994590721,2012-04-30 19:40:08,"Hoy firmamos el proyecto de ley de reforma tributaria destinada a aumentar la calidad y acceso a la Educacion Preescolar, Escolar y Superior"
196347241831731200,2012-04-28 21:16:45,"""Todos, por una educacion de calidad para todos"": http://t.co/lXdKtFxU"
196325637030555648,2012-04-28 19:50:54,RT @GobiernodeChile: Los invitamos a leer la entrevista al Presidente Pinera publicada en el cuerpo de Reportajes de La Tercera http://t ...
196299900525350913,2012-04-28 18:08:38,Con esto nivelaremos la cancha  http://t.co/bsm1pQJ7
195691265344552961,2012-04-27 01:50:08,RT @GobiernodeChile: (INFOGRAFIA) Te invitamos a ver este resumen de la #cadenanacional del Presidente sobre envio de Reforma Tributaria ...
195240228041146368,2012-04-25 19:57:52,"Todo joven con meritos, del 60% mas vulnerable, tiene garantizada su beca para estudiar en la educacion superior:  http://t.co/4SrQqhLy"
194820111981477889,2012-04-24 16:08:28,"La mayoria de esos empleos son con contrato indefinido, cotizaciones de salud, previsionales y seguro de desempleo: http://t.co/hBbD0rDA  "
194819834746388481,2012-04-24 16:07:22,Hoy visitamos la Feria Laboral del @Mintrabchile en la Estacion Mapocho. Contentos de haber creado mas de 700 mil nuevos y buenos empleos.
194170799601618944,2012-04-22 21:08:20,"Hoy en Valparaiso, despedimos la Esmeralda que, por 2o ano, incluye mujeres en su tripulacion. Y por 1o vez integra a un pastor evangelico. "
194134598580568064,2012-04-22 18:44:29,"Invito a los padres y a toda la flia a leerles a sus ninos ""Un cuento al dia"", pueden bajar libros y audiocuentos aqui: http://t.co/SzaxmcWz"
193832761075834880,2012-04-21 22:45:06,"Recoleta, Independencia, Conchali y Huechuraba. Sera gratuito y con 1.800 mts2 de juegos infantiles y un funicular hasta el Zoologico."
193831504651100160,2012-04-21 22:40:06,"Hoy inauguramos el Parque Bicentenario de la Infancia, con mas de 20 mil arboles y que abre el Parque Metropolitano a las siguientes comunas"
193031669802991616,2012-04-19 17:41:51,"Hoy lanzamos la campana Lee Chile Lee, invitamos a los padres y a toda la familia a leer cada dia un cuento a sus ninos http://t.co/ySiYocwf"
191661182183153664,2012-04-15 22:56:01,"Al mismo tiempo, debemos mejorar la prevencion y la rehabilitacion de los jovenes que son las principales victimas  de los narcotraficantes."
191660506862469122,2012-04-15 22:53:20,"Tambien trabajamos para fortalecer la lucha regional contra el narcotrafico, un cruel y despiadado enemigo de la libertad de las personas."
191660176623931392,2012-04-15 22:52:01,"Finaliza la VI Cumbre de las Americas en Colombia, en la que avanzamos para lograr mas desarrollo y reducir la desigualdad y la pobreza."
190476341542526976,2012-04-12 16:27:53,"Estamos en Colombia, en la VI Cumbre de las Americas. Y junto a Cecilia, muy contentos porque anoche nacio nuestra sexta nieta, Magdalena."
190185089823555584,2012-04-11 21:10:33,"Felicitaciones a todos los alumnos, profesores, padres, apoderados y directivos de los colegios. Los esfuerzos estan dando buenos frutos. "
190184882398445570,2012-04-11 21:09:44,Tambien hubo una alza historica en las pruebas de Matematica en 4o Basico y Ciencias Sociales en 8o Basico. Vamos por el camino correcto.
190184720527654912,2012-04-11 21:09:05,Muy contentos con los resultados del SIMCE 2011 de 4o y 8o Basico: disminuyo la diferencia entre los niveles socioeconomicos altos y bajos. 
189779424265244673,2012-04-10 18:18:35,"Nuevas salas de parto y unidades cardiovasculares y de UCI para ninos, que benefician a los compatriotas de Talcahuano,Penco, Tome y Hualpen"
189778775150571522,2012-04-10 18:16:00,"Hoy inauguramos la segunda etapa del Hospital Las Higueras de Talcahuano, que nos permitio llegar a las 400 camas y triplicar su espacio."
189148322668351489,2012-04-09 00:30:48,"Pueden informarse mas sobre el  Censo 2012 que sera el mas moderno, seguro y profesional en http://t.co/J8wFMYzv"
189147538568384512,2012-04-09 00:27:42,"La informacion sera confidencial y permitira mejorar mucho las politicas sociales, especialmente, para la clase media y los mas vulnerables."
189147014225866752,2012-04-09 00:25:37,"Manana empieza el Censo 2012. Servira para saber cuantos somos, que necesitamos, cuanto avanzamos y cuanto nos falta para ser un Chile justo"
187587961603375106,2012-04-04 17:10:29,Hoy les entregamos las llaves de sus viviendas definitivas a 124 familias de Rancagua y a 146 mas en Cauquenes. Asi reconstruimos Chile.
187235133584179201,2012-04-03 17:48:29,Por eso le pedimos que sea el Embajador de Chile en nuestra postulacion a los Juegos Panamericanos del ano 2019. Gracias @elfergonzalez!
187234071645138945,2012-04-03 17:44:15,"Hoy recibimos en La Moneda al gran Fernando Gonzalez, un admirable ejemplo para todos de hasta donde se puede llegar con esfuerzo y talento."
185146763387224064,2012-03-28 23:30:02,El 9 de abril comienza el nuevo Censo 2012. Informate en @chilecenso2012 o en http://t.co/J8wFMYzv. Aqui la campana: http://t.co/0CjNnnN2
184797149823893507,2012-03-28 00:20:48,Su muerte no quedara impune y refuerza el compromiso total del gobierno contra toda discriminacion arbitraria y con un pais mas tolerante.
184796537837195264,2012-03-28 00:18:22,"Quiero expresar a los padres, familia y amigos de Daniel Zamudio mis mas profundos sentimientos de carino y solidaridad."
184796317862727681,2012-03-28 00:17:30,La brutal y cobarde agresion y muerte de Daniel Zamudio hieren no solo a su familia sino tambien a todas las personas de buena voluntad.
183203249690640384,2012-03-23 14:47:13,"Por eso estamos en Asia, el continente del futuro: http://t.co/wBUIG7D5"
183203042974380034,2012-03-23 14:46:23,Estableciendo lazos con Asia Pacifico estamos creando las condiciones para que Chile sea un pais desarrollado y pueda superar la pobreza.
182871003490287616,2012-03-22 16:46:59,"Tenemos una permanente disposicion al dialogo, pero tambien, un firme compromiso con la mantencion del orden publico y de la paz ciudadana. "
182870370389463041,2012-03-22 16:44:28,"Pero no todas las peticiones, por legitimas que sean, se pueden cumplir inmediatamente. El Gobierno trabaja para todos los chilenos. "
182869971855085568,2012-03-22 16:42:53,"Ya estan en marcha el Plan Aysen y soluciones en materia de salud, educacion, asi como subsidios al transporte del combustible y a la lena."
182869485328412673,2012-03-22 16:40:57,"El Gobierno tiene plena conciencia de los problemas que,  por su aislamiento, afectan a Aysen y esta totalmente comprometido en resolverlos."
182443251272396800,2012-03-21 12:27:15,"Queremos estrechar lazos con los paises del Asia Pacifico que significaran para Chile mas oportunidades, mejores empleos y salarios."
182442504732418049,2012-03-21 12:24:17,"Ya estamos en Hanoi, Vietnam, pais con mas de 90 millones de habitantes y con el que, hace poco, firmamos un Tratado de Libre Comercio."
182381493035868160,2012-03-21 08:21:51,"Desde Vietnam, nuestro carino y solidaridad con el pueblo mexicano. #fuerzamexico."
182379922029948929,2012-03-21 08:15:36,Campana del Mineduc http://t.co/iPjigEbx
182074315456524289,2012-03-20 12:01:14,"Hoy iniciamos una gira para mantener y aumentar los vinculos de amistad y comerciales de Chile con Vietnam, la Republica de Corea y Japon."
181481004408651776,2012-03-18 20:43:37,"""Mi compromiso con la vida"": http://t.co/hetrFZsS"
180798726145716224,2012-03-16 23:32:30,Mas informacion en http://t.co/DmW5j8tq
180798632881168384,2012-03-16 23:32:07,"Hoy firmamos 7 acuerdos sobre reconocimiento de titulos profesionales, trasplante de organos, acuerdos e integracion energetica, entre otros"
180798338252292096,2012-03-16 23:30:57,"Pero mas importante aun, estamos unidos por un futuro de integracion y cooperacion integral."
180798060476112896,2012-03-16 23:29:51,"Argentina y Chile nacimos juntos a la vida independiente, estamos unidos por mas de 200 anos de amistad."
180797679843016704,2012-03-16 23:28:20,"Ayer dimos la bienvenida a Chile y a La Moneda a la Presidenta de Argentina, @CFKArgentina: http://t.co/vtpkAIKj"
179897875810103296,2012-03-14 11:52:50,"Es tarea de todos mejorar la calidad y la equidad de la educacion en todos los niveles: preescolar, escolar y superior: http://t.co/I1tmZSVF"
179896908188352512,2012-03-14 11:48:59,La reforma tributaria significara un esfuerzo mayor de las empresas que servira para financiar la reforma educacional que necesita Chile.
