id,created_at,text951805113919778817,2018-01-12 13:16:37,"Condeno los actos de violencia contra Iglesias de Penalolen, Estacion Central y Recoleta esta madrugada. El odio y... https://t.co/0IP4vfPAOS"
950862684165165058,2018-01-09 22:51:44,"Entre ayer y hoy nos reunimos con los Ministros de Educacion, Salud, Vivienda, Trabajo y Defensa, con quienes conve... https://t.co/SDS51OBvms"
950767045540499456,2018-01-09 16:31:42,"Agradezco a los chilenos el apoyo, carino y confianza para liderar a nuestro pais hacia una patria buena, justa y f... https://t.co/PxXRpxDRwe"
950530258171809793,2018-01-09 00:50:48,Nuestro compromiso con la libertad y democracia es absoluto y trasciende fronteras. Hoy nos reunimos con la ex Fisc... https://t.co/qvwhFfht6N
949399499541303298,2018-01-05 21:57:34,"Esta tarde con el Ministro de Energia @AndresReboll, analizamos las enormes oportunidades y desafios en materia de... https://t.co/HC2A5hvMls"
949258080533057536,2018-01-05 12:35:37,"Ayer, en  una reunion con el Canciller @HeraldoMunoz, analizamos los multiples temas de interes de Chile en materia... https://t.co/Y9Nq3vK9BP"
947657196535508992,2018-01-01 02:34:16,"Gracias 2017, gracias @ceciliamorel, familia y amigos. A pocos minutos de iniciar un nuevo ano, siento profunda gra... https://t.co/S7VC5BrbId"
947479296381243392,2017-12-31 14:47:22,Gracias a todos los que fueron parte de la gran mision de traer Tiempos Mejores para Chile y a todos mis compatriot... https://t.co/lJMjkBZwZV
945749986112888832,2017-12-26 20:15:42,"Felicito muy especialmente a los Liceos Bicentenario San Pedro de Puente Alto y de Temuco, ambos entre los 100 mejo... https://t.co/5s7ngh6SVS"
945736202669428737,2017-12-26 19:20:56,"Felicitaciones a los puntajes nacionales #PSU2017, por su gran esfuerzo y talento.Tambien a los miles de jovenes qu... https://t.co/APkUAhH6wu"
944980554818125826,2017-12-24 17:18:15,Junto a mis nietos les deseo una Muy Feliz Navidad y que el 2018 sea un muy Buen Ano para Todas y Todos https://t.co/dYnyEmsGEq
944956815334367234,2017-12-24 15:43:55,"Quiero desearte una muy Feliz Navidad y un buen ano 2018 a ti y tu familia.
Que este ano 2018 trabajemos juntos par... https://t.co/ODLxk5THjL"
944373014451359744,2017-12-23 01:04:06,"Ha sido una semana intensa y fecunda de reuniones de trabajo con Ministros de Gobierno, para compartir visiones, da... https://t.co/TjUsBYV0vD"
942930849816866818,2017-12-19 01:33:28,Agradezco gesto y visita de Presidenta @mbachelet que honra larga tradicion y le agradezco a mi companera de vida... https://t.co/CNf06kDrZT
942865720282673164,2017-12-18 21:14:39,"Gracias a cada chileno y chilena que confio en nuestros suenos, proyectos y equipo para traer Tiempos Mejores para... https://t.co/0piXGT6Y3u"
942472335424131078,2017-12-17 19:11:29,Queridas Amigas y Amigos: parece que aun faltan muchas Chilenas y Chilenos por Votar! Arriba los Corazones y vamos... https://t.co/JNf1BdWgwd
942431064550789120,2017-12-17 16:27:29,"RT @spineram: Porque no voto pensando en mi padre, voto pensando en mis hijos!! 

Por el Chile que queremos... Vamos Pinera!!!
#YoVOTOPiner..."
942408679634202624,2017-12-17 14:58:32,Listo nuestro voto con @ceciliamorel. Se silencia la voz de los candidatos y solo queda escuchar la voz de nuestros... https://t.co/XacqvGIHvZ
942374384613888000,2017-12-17 12:42:16,Empezando el dia con humildad y esperanza. Tengo fe y confianza q hoy los chilenos elegiremos el camino de los Tiem... https://t.co/XGEDvMNTNk
942156868197257217,2017-12-16 22:17:56,"He conversado con Clara Lazcano,Alcaldesa RN de Chaiten, comuna a la que pertenece la Villa Santa Lucia, gravemente... https://t.co/jI8gtSApc0"
942153049409314816,2017-12-16 22:02:45,"En esta campana, junto a Cecilia y familia,entregamos lo mejor de nosotros mismos y recibimos con emocion el carino... https://t.co/ezHQsHL9Ru"
942150276085108736,2017-12-16 21:51:44,"Manana escucharemos fuerte y clara la voz de la gente.Con Humildad y Esperanza.Humildad pq,igual como en la vida el... https://t.co/YTQ9WUguGO"
942054346472263680,2017-12-16 15:30:33,"Fuimos con mi hijo Sebastian y mis nietos Antonia, Juan, Magdalena, Tomas y Amalia al Cerro San Cristobal a rezarle... https://t.co/mVe8RkzYhb"
942050907520462849,2017-12-16 15:16:53,Toda mi carino y solidaridad  con las victimas del alud que arraso l a Villa Sta Lucia en Chaiten. Sin duda necesit... https://t.co/doLfH9xbh8
941679046454325248,2017-12-15 14:39:14,"Despues de 9 meses de intensa campana,donde se apreciaron legitimas diferencias y necesarias coincidencias,y dejand... https://t.co/Wq48kb7go3"
941468749546360833,2017-12-15 00:43:36,Le quiero pedir a Dios que nos de la sabiduria para encontrar siempre el camino correcto. La fuerza para superar la... https://t.co/JuZ0dCfHLe
941468231285530624,2017-12-15 00:41:32,"Agradezco a mis compatriotas por el generoso y tremendo apoyo y carino que nos han regalado. A mis hijos, nietos y... https://t.co/bnp8Xe6RQW"
941465822484189184,2017-12-15 00:31:58,Quiero terminar estas palabras pidiendo perdon y agradeciendo a mis compatriotas. Perdon por los errores que hemos... https://t.co/KaNx5mFHSk
941462608892387329,2017-12-15 00:19:12,"Queremos que Chile sea sea buen pais para nacer, para crecer, para trabajar, para formar familia y para envejecer.... https://t.co/gQtl1cqRNF"
941461689697996801,2017-12-15 00:15:32,"Los chilenos tenemos que construir el futuro y no seguir pensando en el pasado. Por eso, me comprometo con todos mi... https://t.co/YZLQMUV6bF"
941459933052264452,2017-12-15 00:08:34,"Los chilenos queremos cambios profundos, pero cambios bien hechos, basados en el liderazgo y los acuerdos. Hemos es... https://t.co/Me81ihqzav"
941374838895267850,2017-12-14 18:30:26,"Hoy mas que nunca Chile necesita unidad y no division. Los he escuchado y se que no solo quieren mas crecimiento, e... https://t.co/VA8IOvljfr"
941351464068354048,2017-12-14 16:57:33,Muchas gracias Presidente Macri por su apoyo y amistad. Nos une el amor y la esperanza de #TiemposMejores para nues... https://t.co/CVo8ovtBDr
941278132681740289,2017-12-14 12:06:09,"Gracias Dr Patch Adams con su ejemplo y trayectoria nos ha ensenado a mirar con amor las cosas simples de la vida,... https://t.co/MOkbgC2Mkj"
941099714279329793,2017-12-14 00:17:11,"Agradezco el sentido apoyo de @liliantintori, una mujer admirable, que ha luchado incansablemente y con gran valent... https://t.co/3Yt8WpLwjH"
941071434922774528,2017-12-13 22:24:49,"Vamos a apoyar y no asfixiar a nuestras Pymes, innovadores y emprendedores. Les vamos a dar oportunidades y no ahog... https://t.co/m9u6uMtybo"
940935016212848640,2017-12-13 13:22:44,"RT @KarlaEnAccion: Fiscalia de Rancagua incauta fichas de pacientes que fallecieron esperando atencion. A eso se referia, candidato @guilli..."
940934883593113600,2017-12-13 13:22:12,"RT @KarlaEnAccion: Candidato @guillier dice que hay corrupcion cuando se saca pacientes en lista de espera. En este Gobierno, en Rancagua,..."
940774598899130368,2017-12-13 02:45:17,"Agradezco el carino y entusiasmo recibido en San Bernardo! Estamos  cerrando una gran etapa, pero este no es el fi... https://t.co/mGiNJqts2a"
940671694305480704,2017-12-12 19:56:23,"Gracias @el_mago_oficial por tu aporte e ideas para un mejor #Chile, con menos delincuencia, mas deporte y una vida... https://t.co/jZytCh3nL0"
940585612813520897,2017-12-12 14:14:19,"Nueva manana para compartir con ustedes. Gracias a @matinaldechv por empezar este dia junto a nosotros, con... https://t.co/hsGKsVS8ot"
940584862586634245,2017-12-12 14:11:21,"Hace 5 anos un grupo inicio la noble aventura de construir un Chile mas libre, justo, prospero y solidario. Con mas... https://t.co/xG3N51QdfK"
940447173401038849,2017-12-12 05:04:13,"En esta eleccion, lo importante no son los candidatos. Lo que importa es lo que tu, tu familia, y la de todos los c... https://t.co/UWwGNHMZkd"
940389219691790336,2017-12-12 01:13:56,"Camino al debate con mi gran companera @ceciliamorel, confiados que tendremos un debate de ideas y propuestas para... https://t.co/XY4F8vYHTH"
940261391696613378,2017-12-11 16:45:59,"Los invito a acompanarnos esta noche en #DebateAnatel, en que se analizaran 2 caminos: Uno es mas de lo mismo y con... https://t.co/rSVSFBUKBL"
940232387690156032,2017-12-11 14:50:44,"Gracias @valegonzalezez, campeona de esqui nautico, por compartir  razones para votar por Tiempos Mejores. El depor... https://t.co/mJlWFlbiar"
939983187408769025,2017-12-10 22:20:30,Gobierno puso en consulta un reglamento que atenta gravemente contra espiritu de ley de #TenenciaResponsable de ani... https://t.co/KlegsNgP6v
939911345138556928,2017-12-10 17:35:02,No podemos regalarle nuestros parques y plazas a los delincuentes y la droga. Queremos que en cada comuna de Chile... https://t.co/mRZw6LlsqA
939909573879779329,2017-12-10 17:27:59,"En el #DiaDeLosDerechosHumanos  es bueno recordar que ninguna circunstancia, de ninguna naturaleza, justifica la vi... https://t.co/yNbhvdGSf5"
939518193206530053,2017-12-09 15:32:47,"A los miles de voluntarios y apoderados de todo Chile, les agradezco la energia y el compromiso. El prox domingo ga... https://t.co/RquAKIM985"
939509175872258048,2017-12-09 14:56:57,RT @joseantoniokast: La Ministra Paula Narvaez recibe $9.121.809 pesos mensualmente pagado por los impuestos de todos los chilenos. Lo que...
939180624417640448,2017-12-08 17:11:24,Haremos q todas las familias chilenas tengan un parque o plaza como patio trasero de su casa. Donde puedan recrears... https://t.co/PI0Vi64TPb
938931288018489346,2017-12-08 00:40:38,Los chilenos necesitan y merecen una mejor educacion.Nosotros tenemos un buen plan para lograrlo: Mejorando la cali... https://t.co/UCRsp3ZnT0
938726686950154240,2017-12-07 11:07:37,"Te esperamos ahora en el #DebateArchi. Porque queremos un pais mas desarrollado, justo y solidario. Un Chile con ti... https://t.co/Bfgk20aLrr"
938597323839606784,2017-12-07 02:33:34,"Tratemos a nuestros Adultos Mayores hoy como queremos que nos traten a nosotros manana. Por eso, no solo mejoraremo... https://t.co/YbrVaMF4eF"
938535877378297857,2017-12-06 22:29:24,"Condicion Jerusalen es parte negociacion global Palestino- Israeli,en marco NU q promueve solucion de 2 estados lib... https://t.co/sorED61JMZ"
938522869579042816,2017-12-06 21:37:43,Mantendremos la gratuidad a todos los estudiantes que la tienen o tengan derecho a tenerla en el futuro. Tambien av... https://t.co/mQ2tO8Ry73
938507663687716865,2017-12-06 20:37:18,Propuesta Pdte Trump de reconocer Jerusalen como capital de Israel rompe con politica de Dos Estados impulsada por... https://t.co/JWiIMEXejB
938506449474457603,2017-12-06 20:32:28,"Un fuerte abrazo a todos los Alcaldes de Chile que hoy cumplen su primer ano de gestion, mejorando la calidad de vi... https://t.co/PJsB7QPUt3"
938493186938458112,2017-12-06 19:39:46,"Queremos ayudarte a surgir como familia, salir adelante y tener una segunda oportunidad. Por eso, reactivaremos nue... https://t.co/PgV09TLW36"
938489165825630208,2017-12-06 19:23:48,"Los Chilenos queremos cambios, pero con unidad, bien hechos y mirando hacia adelante. Muchos sonamos con un Chile m... https://t.co/MMrRi1LuCc"
938232080382734336,2017-12-06 02:22:14,Ya estamos en el programa #CandidatoLlegoTuHora de @TVN. Acompanennos en la conversacion de ideas y propuestas para... https://t.co/uum0sDvnKb
938197087921033216,2017-12-06 00:03:11,"Reglamento sobre mascotas, propuesto por gobierno NM, demuestra que no comprende los sentimientos de los chilenos,... https://t.co/tadkr2hpey"
938193151604543490,2017-12-05 23:47:32,Crearemos un Seguro para Enfermedades Catastroficas para TODOS los chilenos porque no hay mayor angustia que ver a... https://t.co/vZsYIXHcVk
938190314443104257,2017-12-05 23:36:16,Grande @Karol_LuceroV! Siempre es bueno salirnos un poco del libreto y acercarnos a los jovenes chilenos. Porque s... https://t.co/JP3vfkMqlH
938168478590291969,2017-12-05 22:09:30,"El reglamento sobre mascotas, propuesto por el gobierno de la NM, demuestra que no comprende los sentimientos de lo... https://t.co/gv4y38E2vT"
938001568246398977,2017-12-05 11:06:15,Mucha suerte @ceciliamorel en tu entrevista en @futurofm. Mientras nosotros vamos entrando a @biobio. Trabajando en... https://t.co/63yLvwy7Tx
937862056648298496,2017-12-05 01:51:53,"Un Chile mas justo combate con fuerza y eficacia la delincuencia y el narcotrafico, entrega educacion de calidad y... https://t.co/bzE4o2qPRq"
937834906071187456,2017-12-05 00:04:00,"Por un mundo con mas alegria, risas y solidaridad. Hoy disfrutamos grata conversacion con @realpatchadams, medico d... https://t.co/eRHXLHvD1l"
937770515472711680,2017-12-04 19:48:08,"Comparto con Uds mi declaracion respecto informacion entregada por diversos medios de comunicacion, en relacion a d... https://t.co/xeTSa8tJpb"
937720186047565824,2017-12-04 16:28:09,Vamos a revivir la politica de 2da oportunidad en vivienda para las familias que viven en blocs o condominios indig... https://t.co/qJRRCTtjht
937716922849857536,2017-12-04 16:15:11,"Historias de esfuerzo de chilenos que decidieron ganarle a la vida, seguir adelante con fe y conviccion. Asi es... https://t.co/SYu2o5NkK3"
937639889260175360,2017-12-04 11:09:04,Ahora estamos en radios @Conciertoradio @RockandPop @Futurofm y @ADNradio. Los invito a que nos acompanen y conozca... https://t.co/VrMWuTcD3r
937499613048852481,2017-12-04 01:51:40,Te invitamos a unirte a un gran proyecto y noble mision: Construir un Chile con #TiemposMejores para todos. https://t.co/5GhMGgmDRb
937469165358723072,2017-12-03 23:50:41,"Acabamos de terminar una entretenida conversacion con @felipekast por Facebook, y ahora juntos nos vamos a ver la f... https://t.co/FIZQ4gJF4x"
937438744143106050,2017-12-03 21:49:48,Tenemos muy buenos medicos. Y serian  aun mejores si entendieramos sus diagnosticos y recetas https://t.co/OIEMLcxoSi
937384420289499139,2017-12-03 18:13:56,Les anticipo una historia que estara en nuestra franja esta noche. La historia de la vida y lucha de nuestro flaman... https://t.co/MvJkbSqA1g
937368699647995904,2017-12-03 17:11:28,En #DiaDelMedico saludo con mucho carino a los que con amor y vocacion entregan lo mejor de si por la salud de todo... https://t.co/0LMjjHyWKB
937365764604137472,2017-12-03 16:59:48,"En la feria se encuentra mas que fruta y verdura fresca. Se encuentra humanidad, cercania, carino. En las ferias vi... https://t.co/Wv2UxO7NRG"
937303722480361473,2017-12-03 12:53:16,Hacemos un compromiso con cada chileno y chilena como tu. Tolerancia Cero a la delincuencia y el narcotrafico que d... https://t.co/PIdoBWFAzA
937033661282521088,2017-12-02 19:00:08,"Hace pocos dias, caminando por las calles de Vina del Mar, nos encontramos con esta mujer que realmente nos toco el... https://t.co/CVtlTI8XYV"
936727536163225600,2017-12-01 22:43:42,"RT @mjossandon: Yo sueno un Chile Diferente, @sebastianpinera quiere Tiempos Mejores. Ambos queremos lo mejor para Chile. Por eso, por Chil..."
936722110080274432,2017-12-01 22:22:09,Gracias Alejandro por saludo cumpleanos. En la vida y politica debe primar siempre la nobleza y respeto.Somos conte... https://t.co/cJUtMOQudT
936720715293839362,2017-12-01 22:16:36,Emocionado con este video que hoy muy temprano me enviaron mis hijos y nietos. El regalo mas grande que me ha dado... https://t.co/ZvHPl8fYjj
936711894764843008,2017-12-01 21:41:33,"Esta manana estabamos en @RadioActivaFm con toda la buena onda del @danielexhuevo, cuando fuimos gratamente sorpren... https://t.co/Tms1fYllfp"
936538945394966528,2017-12-01 10:14:19,"Invito a todos los chilenos a que esta noche, mientras se desarrolla la #Teleton2017, bajemos las banderas de las c... https://t.co/sDlnNDiUtg"
936234737865289728,2017-11-30 14:05:30,"Buena conversacion 
en @Bienvenidos13. Lindos recuerdos y un gran encuentro con ideas para un Chile con... https://t.co/7eocheNQpt"
936007943111274503,2017-11-29 23:04:18,Pondremos a nuestros ninos en el corazon de nuestro gobierno. Haremos un Acuerdo Nacional por la Infancia. Vamos pa... https://t.co/RwQh1lfFj6
935969121153486848,2017-11-29 20:30:02,"La fuerza, el carino y la esperanza de la region de Valparaiso me dan la fuerza y entusiasmo para seguir trabajando... https://t.co/wNLBi9VIx6"
935949309824167938,2017-11-29 19:11:19,RT @ceciliamorel: Alejandro @guillier : Chile lo tenemos que construir entre todos. Me duele su ataque tan personal y descalificatorio cont...
935656030570196994,2017-11-28 23:45:55,"Acercaremos la cultura a los jovenes y a todos los chilenos. La cultura y las artes nos ensenan, inspiran y mejoran... https://t.co/UNJGwTQWqS"
935545455378825216,2017-11-28 16:26:32,Bienvenidos a los miembros de @Ciudadanos__  q se unen a nuestro equipo para ofrecerle a Chile una alternativa de p... https://t.co/qGcSwHF25c
935133288435519488,2017-11-27 13:08:44,"RT @ceciliamorel: El desafio de promover una cultura de vida sana en Chile ha perdido impulso en los ultimos anos, lo que nos compromete au..."
934975523297677314,2017-11-27 02:41:50,"A todos los jovenes y no tan jovenes q manana rinden la PSU, un fuerte y carinoso abrazo. Que el resultado de la pr... https://t.co/x53oK3rdaQ"
934844061432930304,2017-11-26 17:59:27,"Encuesta Nacional de Salud muestra grave retroceso en salud de los chilenos durante gob NM. 75% chilenos obesos, 87... https://t.co/FGRIFcFaho"
934809846565801984,2017-11-26 15:43:30,"Es bueno acoger buenas ideas de otros. Por un #Chile con mas dialogos y acuerdos, hoy incorporamos propuestas de ot... https://t.co/xhGlSXF7rg"
934628126856044544,2017-11-26 03:41:24,Gracias por abrirnos las puertas de sus casas y corazones en #PUERTAaPUERTAnacional. Gracias por entregarnos su car... https://t.co/6ShGCpjA05
934571121617395713,2017-11-25 23:54:53,Toda mi solidaridad a los familiares de las numerosas victimas fatales y heridos de un accidente de bus en la ruta... https://t.co/ifprgIWpgk
934476926479142912,2017-11-25 17:40:35,"Gracias, muchas gracias a todas las familias que nos abrieron las puertas de sus hogares para compartir sus penas y... https://t.co/P9Y1w5YGPw"
934431556659306501,2017-11-25 14:40:18,"Hoy, que conmemoramos dia contra la violencia de genero, me comprometo a que combatiremos este flagelo con total de... https://t.co/OB5KvorNFD"
934019443197222914,2017-11-24 11:22:43,"Gracias @felipekast, y a todos los que nos abrieron la ventana de su auto y nos dieron un buen apreton de manos, co... https://t.co/0FUyAS3c1v"
933469978761842689,2017-11-22 22:59:20,"Gracias @MarceloRios75 por tu gran apoyo. Ademas de talento deportivo, demuestras vision politica. En esta eleccion... https://t.co/fe1lDfHeU8"
933416649004404736,2017-11-22 19:27:25,"Hoy tuvimos una fecunda y constructiva reunion de trabajo con el Senador Ossandon,en q nos pusimos de acuerdo en po... https://t.co/FZSU5ZJWbv"
933382449819680768,2017-11-22 17:11:32,RT @MarceloRios75: Elegi no estar ni ahi con los comentarios en mi contra pero no puedo quedar indiferente a lo que va a pasar con mi pais...
933382367481356290,2017-11-22 17:11:12,"Hoy celebramos a Santa Cecilia, patrona de la musica. Le envio un fuerte abrazo a mi mujer @ceciliamorel, a mi hija... https://t.co/OY3jKubBGf"
933145687218409472,2017-11-22 01:30:43,"No te quedes fuera, sumate.  En pocos minutos estaremos en #LasCarasDeLaMoneda, usando el hashtag #PineraEnEl13, pa... https://t.co/YiqpjHMtOF"
933111397604569089,2017-11-21 23:14:28,"Empezamos esta semana con gratitud, esperanza, y sobre todo, compromiso, porque los Tiempos Mejores estan mas vivos... https://t.co/9oTaahaqPT"
932711886147211265,2017-11-20 20:46:57,Gracias @ceciliamorel por ser la madre de nuestros cuatro hijos y el pilar emocional de nuestra familia. Eres una f... https://t.co/COAR0kYcoj
932600208948645888,2017-11-20 13:23:11,"Partiendo el dia con energia y fe, junto a la mejor companera @ceciliamorel en este gran desafio de los... https://t.co/P9Cqo2k46e"
932585182670008321,2017-11-20 12:23:28,"Gracias a cada uno de los chilenos que ayer voto por los #TiemposMejores, por un Chile mas libre, justo, prospero y... https://t.co/BcvXgxKIsZ"
932273032248332289,2017-11-19 15:43:06,"Este ano se cumplen 65 anos desde que las mujeres chilenas votaron por primera vez en una eleccion presidencial, y... https://t.co/di9vC69uz4"
932254979552772096,2017-11-19 14:31:22,"En familia, acompanado de mi mujer @ceciliamorel, mis hijos y nietos. Vota porque tambien queremos escuchar tu voz... https://t.co/Ttwu8UCO0C"
932042815009419264,2017-11-19 00:28:18,"El futuro de Chile esta en tus manos. Manana TU decides. Gracias por el carino, alegria y esperanza. Gracias por tu... https://t.co/ORE1Qm5HCs"
932027478540943361,2017-11-18 23:27:21,Hoy 2 carabineros fueron victimas de cobarde agresion x parte de turba en centro de Stgo. Vamos a reimpulsar Proy d... https://t.co/N9W46bfz21
931959939177775109,2017-11-18 18:58:59,"En el camarin con el equipo de los Tiempos Mejores, despues de vencer 7-4 al equipo Arriba los Corazones. Muchos cr... https://t.co/5GTWpSvf29"
931927177746006016,2017-11-18 16:48:48,"Todo Chile forma un gran equipo para los #TiemposMejores! Sin divisiones, con unidad, trabajo y esperanza. Asi con... https://t.co/1MOINezAnx"
931629862883856390,2017-11-17 21:07:22,"RT @el_mago_oficial: Deporte y vida sana no discrimina equipos de futbol,raza,partidos politicos,sexo,condiciones economicas.el deporte y l..."
931628012356939776,2017-11-17 21:00:01,"Gracias @ceciliamorel por tu compromiso con la vida sana para todos los chilenos y al Mago Valdivia,... https://t.co/iopMQ5AvpZ"
931539999824236545,2017-11-17 15:10:17,"Gracias por una noche inolvidable, una fiesta de unidad y esperanza en un Chile con #TiemposMejores, y un nuevo ama... https://t.co/u7DlBgmdNI"
931265391715803136,2017-11-16 20:59:06,"Esta noche es de ustedes. Gracias por cada abrazo, cada sonrisa, cada selfie y cada palabra de apoyo. Hemos llegado... https://t.co/a0nQm43TIX"
931237266369937410,2017-11-16 19:07:20,"A 3 dias de que se apague la voz de los candidatos y se escuche fuerte la voz de los chilenos, agradezco tu carino... https://t.co/6Pnvn26LXm"
930959681295650816,2017-11-16 00:44:19,A 4 dias para las elecciones les recuerdo la importancia de lo que nos jugamos este domingo. Con tu voto transforma... https://t.co/SyCe8Bs2X2
930934713262407681,2017-11-15 23:05:06,"Tenemos un desafio grande pero hermoso. Construir unidos un Chile con #TiemposMejores. Este domingo vota por ti, po... https://t.co/I05Bkuda6e"
930868042573189120,2017-11-15 18:40:10,RT @fhuenchumilla: Inaceptable.Rechazo la grosera intervencion electoral del Gobierno Regional y la Conadi en la Araucania. https://t.co/3p...
930865950219522056,2017-11-15 18:31:51,Lamentamos lo que sucedio con el senador @FulvioRossiC y ratificamos nuestro compromiso con el fuerte y eficaz comb... https://t.co/rZINKuGtUH
930823880842850305,2017-11-15 15:44:41,"Acabo de hablar con el Senador @FulvioRossiC, victima de un cobarde y condenable atentado con cuchillo, del cual, g... https://t.co/CkMjDXpOtv"
930806174462615552,2017-11-15 14:34:20,La inauguracion de Hospital Exequiel Gonzalez Cortes es una maravillosa noticia para los ninos de Chile. Me produce... https://t.co/w1Z6V4hqsS
930780276732637184,2017-11-15 12:51:25,"Un dia como hoy, en 1945, vimos con emocion y orgullo a una chilena convertirse en la primera iberoamericana en rec... https://t.co/N7HjhwMsMa"
930573959233490945,2017-11-14 23:11:35,Agradezco a mi mujer @ceciliamorel  por su dedicacion y compromiso. Se que juntos y con el compromiso de todos los... https://t.co/EIoPsFs8VE
930415687230803968,2017-11-14 12:42:40,"Haremos de Chile un buen pais para nacer,crecer,aprender,trabajar, envejecer y saber que,en los momentos dificiles,... https://t.co/rvIu4Tibhu"
930261854341025792,2017-11-14 02:31:24,"Aprecio y agradezco al Pastor Dr Alberto Motessi y muy sentidamente al Pueblo Evangelico de Chile, por su dedicacio... https://t.co/yVUHyBfyFO"
930220333587603456,2017-11-13 23:46:24,"Este domingo unidos construiremos una patria buena, libre y justa con todos y para todos. Este domingo, de ti depen... https://t.co/ZtuNA2lRVg"
930097435388542977,2017-11-13 15:38:03,Gracias Isla de Pascua por el carino y apoyo desde Rapanui.  Que este domingo lleguen los #TiemposMejores a todo C... https://t.co/7v0fqGo0et
929882210697728000,2017-11-13 01:22:50,"RT @ceciliamorel: Hoy, todos juntos, apoyemos a @sebastianpinera en Tolerancia Cero usando el hashtag #EnPrimeraVotaPinera para que pronto..."
929845604062318595,2017-11-12 22:57:22,"A solo 7 dias de las elecciones presidenciales, los invito a que esta noche, desde las 22 horas, nos acompanen en... https://t.co/GzwKnUtOcI"
929779051119742983,2017-11-12 18:32:54,"Llego la hora, el proximo domingo tu decides. Vota por mas y mejores trabajos, salarios y pensiones. Trato digno pa... https://t.co/pi8JqaYVzz"
929501070740590593,2017-11-12 00:08:19,"Nada me llena mas de orgullo que ver a mi hija Cecilia, convertida en una gran pediatra, entregada al servicio publ... https://t.co/kkxXcifVB7"
929070526148079616,2017-11-10 19:37:29,"Que son los #TiemposMejores? Un pais que progresa, mas justo y mas solidario. Un Chile mas seguro y en paz. Pero l... https://t.co/vMS6CRejqI"
929018130923483136,2017-11-10 16:09:17,"Mi solidaridad y carino a Pidenco, en la comuna de Ercilla, ante nuevo ataque incendiario. Terrorismo es un enemigo... https://t.co/aLX73GTGxX"
928976962328154113,2017-11-10 13:25:42,Mejoraremos las pensiones de todos nuestros jubilados. Y con un carino muy especial las pensiones mas bajas y las d... https://t.co/E6eXcWRChr
